"conference","year","doi","title","citationCount","download6weeks","download12months","downloadAll","keywords","pageNumber","authors"
"CHI","08","http://dx.doi.org/10.1145/1357054.1357255","It's Mine, Don't Touch!: interactions at a large multi-touch display in a city centre","122 ","35","377","3,325","design; human factors; situated public displays","10","81342507378, Peter Peltonen, Helsinki Institute for Information Technology and University of Helsinki, Helsinki, Finland; 81100143375, Esko Kurvinen, Helsinki Institute for Information Technology and University of Helsinki, Helsinki, Finland; 81100551588, Antti Salovaara, Helsinki Institute for Information Technology and University of Helsinki, Helsinki, Finland; 81100644548, Giulio Jacucci, Helsinki Institute for Information Technology and University of Helsinki, Helsinki, Finland; 81100391905, Tommi Ilmonen, Helsinki Institute for Information Technology and University of Helsinki, Helsinki, Finland; 81350580664, John Evans, Helsinki Institute for Information Technology and University of Helsinki, Helsinki, Finland; 81100333050, Antti Oulasvirta, Helsinki Institute for Information Technology and University of Helsinki, Helsinki, Finland; 81342509745, Petri Saarikko, Helsinki Institute for Information Technology and University of Helsinki, Helsinki, Finland; "
"CHI","08","http://dx.doi.org/10.1145/1357054.1357256","PressureFish: a method to improve control of discrete pressure-based input","15 ","3","47","568","experimentation; human factors; pressure discretization","4","81350576969, Kang Shi, University of Manitoba, Canada, Winnipeg, MAN, Canada; 81100459517, Pourang Irani, University of Manitoba, Canada, Winnipeg, MAN, Canada; 81350569912, Sean Gustafson, University of Manitoba, Winnipeg, MAN, Canada; 81100277483, Sriram Subramanian, University of Bristol, Bristol, United Kingdom; "
"CHI","08","http://dx.doi.org/10.1145/1357054.1357257","Stane: synthesized surfaces for tactile input","18 ","5","55","660","channels and controllers; human factors; tactile input; vibration sensing","4","81100572841, Roderick Murray-Smith, Glasgow University NUI Maynooth, Glasgow, United Kingdom & Hamilton Institute, NUI Maynooth, Glasgow, United Kingdom; 81100169940, John Williamson, Glasgow University, Glasgow, United Kingdom; 81494640446, Stephen Hughes, Glasgow University, Glasgow, United Kingdom; 81350585797, Torben Quaade; "
"CHI","08","http://dx.doi.org/10.1145/1357054.1357259","Activity-based prototyping of ubicomp applications for long-lived, everyday human activities","18 ","12","134","1,265","activity-centered design; design; prototyping; ubiquitous computing","10","81350580013, Yang Li, University of Washington, Seattle, WA, USA; 81100103519, James A. Landay, University of Washington \ Intel Research Seattle, Seattle, WA, USA; "
"CHI","08","http://dx.doi.org/10.1145/1357054.1357260","Employing patterns and layers for early-stage design and prototyping of cross-device user interfaces","25 ","23","118","1,197","cross-device user interfaces; mobile computing; prototyping; voice user interfaces","10","81471640432, James Lin, IBM Almaden Research Center, San Jose, CA, USA; 81100103519, James A. Landay, University of Washington, Seattle, WA, USA; "
"CHI","08","http://dx.doi.org/10.1145/1357054.1357261","Using information scent to model the dynamic foraging behavior of programmers in maintenance tasks","17 ","2","64","682","debugging; human factors; software maintenance","10","81100235486, Joseph Lawrance, Oregon State University, Corvallis, OR, USA and IBM Research, Hawthorne, NY, USA; 81100257325, Rachel Bellamy, IBM Research, Hawthorne, NY, USA; 81100337865, Margaret Burnett, Oregon State University, Corvallis, OR, USA; 81339523613, Kyle Rector, Oregon State University, Corvallis, OR, USA; "
"CHI","08","http://dx.doi.org/10.1145/1357054.1357263","Melange: space folding for multi-focus interaction","16 ","11","89","770","design; exploration; folding; interaction; interaction techniques; space-distortion; visualization","10","81100015408, Niklas Elmqvist, INRIA, Saclay, France; 81313483984, Nathalie Henry, INRIA, Univ. Paris-Sud & University of Sydney, Orsay, France; 81363604200, Yann Riche, INRIA, Univ. Paris-Sud & University of Queensland, Orsay, France; 81100194446, Jean-Daniel Fekete, INRIA, Saclay, France; "
"CHI","08","http://dx.doi.org/10.1145/1357054.1357264","Sigma lenses: focus-context transitions combining space, time and translucence","21 ","8","79","841","controlled experiment; fisheye lenses; focus targeting; theory; user interfaces","10","81100222004, Emmanuel Pietriga, LRI - Universit&#233; Paris Sud, Orsay, France; 81311484266, Caroline Appert; "
"CHI","08","http://dx.doi.org/10.1145/1357054.1357265","FacetZoom: a continuous multi-scale widget for navigating hierarchical metadata","10 ","6","76","836","design; faceted metadata; interaction technique; time navigation","4","81100509454, Raimund Dachselt, Dresden University of Te hnology, Dresden, Germany; 81100574683, Mathias Frisch, Dresden University of Technology, Dresden, Germany; 81350572097, Markus Weiland, Dresden University of Technology, Dresden, Germany; "
"CHI","08","http://dx.doi.org/10.1145/1357054.1357266","LivOlay: interactive ad-hoc registration and overlapping of applications for collaborative visual exploration","5 ","4","31","461","computer-supported cooperative work; shared display groupware","4","81416606428, Hao Jiang, MERL-Mitsubishi Electric Research Labs, and Tsinghua University, Cambridge, MA, USA; 81100606762, Daniel Wigdor, MERL-Mitsubishi Electric Research Labs, Cambridge, MA, USA; 81100584798, Clifton Forlines, MERL-Mitsubishi Electric Research Labs, Cambridge, MA, USA; 81350585455, Michelle Borkin, Harvard University, Cambridge, MA, USA; 81350568577, Jens Kauffmann, Harvard University and Harvard Smithsonian Center for Astrophysi s, Cambridge, MA, USA; 81100343583, Chia Shen, MERL-Mitsubishi Electric Research Labs, Cambridge, MA, USA; "
"CHI","08","http://dx.doi.org/10.1145/1357054.1357268","<i>PieCursor</i>: merging pointing and command selection for rapid in-place tool switching","4 ","4","38","869","control menus; floating palette; graphical user interfaces; multifunction cursor; pie menus; tracking menus","10","81100585120, George Fitzmaurice; 81100153192, Justin Matejka; 81100345201, Azam Khan; 81414608731, Michael Glueck; 81332510496, Gordon Kurtenbach; "
"CHI","08","http://dx.doi.org/10.1145/1357054.1357269","Tilt menu: using the 3D orientation information of pen devices to extend the selection capability of pen-based user interfaces","25 ","4","96","859","design; human factors; orientation; pen-based ui; theory and methods","10","81100106876, Feng Tian, Chinese Academy of Sciences, Beijing, China; 81350570033, Lishuang Xu, Chinese Academy of Sciences, Beijing, China; 81100220294, Hongan Wang, Chinese Academy of Sciences, Beijing, China; 81316491376, Xiaolong Zhang, The Pennsylvania State University, University Park, PA, USA; 81350569523, Yuanyuan Liu, Chinese Academy of Sciences, Beijing, China; 81100609586, Vidya Setlur, Nokia Research Palo Alto, Palo Alto, CA, USA; 81100172122, Guozhong Dai, Chinese Academy of Sciences, Beijing, China; "
"CHI","08","http://dx.doi.org/10.1145/1357054.1357270","AAMU: adaptive activation area menus for improving selection in cascading pull-down menus","4 ","1","23","423","aamu; force field menus; graphical user interfaces; interaction styles; menu navigation; steering","4","81350587458, Erum Tanvir, University of Manitoba, Winnipeg, MAN, Canada; 81543460056, Jonathan Cullen, University of Manitoba, Winnipeg, MAN, Canada; 81100459517, Pourang Irani, University of Manitoba, Winnipeg, MAN, Canada; 81100607754, Andy Cockburn, University of Canterbury, Christchurch, New Zealand; "
"CHI","08","http://dx.doi.org/10.1145/1357054.1357271","Genetic algorithm can optimize hierarchical menus","6 ","1","22","389","algorithms; genetic algorithm; human factors; optimization","4","81100154085, Shouichi Matsui, CRIEPI, Komae, Tokyo, Japan; 81321500077, Seiji Yamada, National Institute of Informatics, Chiyoda, Tokyo, Japan; "
"CHI","08","http://dx.doi.org/10.1145/1357054.1357273","Blindsight: eyes-free access to mobile phones","31 ","26","145","1,284","devices; human factors; mobile phone; user interfaces","10","81350578803, Kevin A. Li, UC San Diego, La Jolla, CA, USA; 81100137268, Patrick Baudisch, Microsoft Research, Redmond, WA, USA; 81100519448, Ken Hinckley, Microsoft Research, Redmond, WA, USA; "
"CHI","08","http://dx.doi.org/10.1145/1357054.1357274","One-handed touchscreen input for legacy applications","18 ","14","93","1,170","human factors; interaction styles; one-handed interaction; touchscreens","10","81100168208, Amy K. Karlson, University of Maryland, College Park, MD, USA; 81100083927, Benjamin B. Bederson, University of Maryland, College Park, MD, USA; "
"CHI","08","http://dx.doi.org/10.1145/1357054.1357275","Target acquisition with camera phones when used as magic lenses","23 ","4","60","794","augmented reality; design; fitts' law; human-performance modeling; interaction styles; target acquisition","10","81314494694, Michael Rohs, TU Berlin, Berlin, Germany; 81100333050, Antti Oulasvirta, Helsinki Institute for Information Technology HIIT, Helsinki, Finland; "
"CHI","08","http://dx.doi.org/10.1145/1357054.1357277","Sonic interventions: understanding and extending the domestic soundscape","11 ","5","47","658","audio; ethnography; miscellaneous; soundscape","10","81416597992, Gerard Oleksik, University of Surrey, Guildford, United Kingdom; 81100162362, David Frohlich, University of Surrey, Guildford, United Kingdom; 81543111456, Lorna M. Brown, Microsoft Resear h, Cambridge, United Kingdom; 81100309669, Abigail Sellen, Microsoft Resear h, Cambridge, United Kingdom; "
"CHI","08","http://dx.doi.org/10.1145/1357054.1357278","Threshold devices: looking out from the home","24 ","7","57","690","design; miscellaneous; ubiquitous computing","10","81100104022, William Gaver, Goldsmiths, University of London, London, United Kingdom; 81100230335, Andy Boucher, Goldsmiths, University of London, London, United Kingdom; 81100048621, Andy Law, Goldsmiths, University of London, London, United Kingdom; 81100342942, Sarah Pennington, Goldsmiths, University of London, London, United Kingdom; 81100260889, John Bowers, Goldsmiths, University of London, London, United Kingdom; 81350578663, Jacob Beaver, Goldsmiths, University of London, London, United Kingdom; 81100412689, Jan Humble, University of Nottingham, Nottingham, United Kingdom; 81328488900, Tobie Kerridge, Goldsmiths, University of London, London, United Kingdom; 81100599166, Nicholas Villar, Lancaster University, London, United Kingdom; 81100170706, Alex Wilkie, Goldsmiths, University of London, London, United Kingdom; "
"CHI","08","http://dx.doi.org/10.1145/1357054.1357279","Requirements engineering for home care technology","4 ","3","56","522","care at home; home care technology; methodologies; requirements engineering; user-centered design","4","81350585418, Marilyn Rose McGee-Lennon, University of Glasgow, Glasgow, United Kingdom; "
"CHI","08","http://dx.doi.org/10.1145/1357054.1357281","Game over: learning by dying","4 ","10","130","1,302","design guidelines; game accessibility; games","10","81315488836, Dimitris Grammenos, Foundation for Research and Technology - Hellas, Heraklion - Crete, Greece; "
"CHI","08","http://dx.doi.org/10.1145/1357054.1357282","Heuristic evaluation for games: usability principles for video game design","41 ","119","719","4,665","design; heuristic evaluation; usability evaluation","10","81100573952, David Pinelle, University of Nevada, Las Vegas, Las Vegas, NV, USA; 81351594055, Nelson Wong, University of Saskatchewan, Saskatoon, SK, Canada; 81328490612, Tadeusz Stach, Queen's University, Kingston, ON, Canada; "
"CHI","08","http://dx.doi.org/10.1145/1357054.1357283","Renegade gaming: practices surrounding social use of the Nintendo DS handheld gaming system","12 ","7","100","1,050","collaborative computing; handheld games; nintendo ds","10","81350580611, Christine Szentgyorgyi, University of Waterloo, Waterloo, ON, Canada; 81100295906, Michael Terry, University of Waterloo, Waterloo, ON, Canada; 81315489747, Edward Lank, University of Waterloo, Waterloo, ON, Canada; "
"CHI","08","http://dx.doi.org/10.1145/1357054.1357285","Expandable grids for visualizing and authoring computer security policies","39 ","16","74","686","access controls; file permissions; privacy; security; user/machine systems","10","81100651314, Robert W. Reeder, Carnegie Mellon University, Pittsburgh, PA, USA; 81350570444, Lujo Bauer, Carnegie Mellon University, Pittsburgh, PA, USA; 81100472223, Lorrie Faith Cranor, Carnegie Mellon University, Pittsburgh, PA, USA; 81387594159, Michael K. Reiter, University of North Carolina at Chapel Hill, Chapel Hill, NC, USA; 81350586056, Kelli Bacon, Gonzaga University, Spokane, WA, USA; 81350578249, Keisha How, Carnegie Mellon University, Pittsburgh, PA, USA; 81350576211, Heather Strong, Carnegie Mellon University, Pittsburgh, PA, USA; "
"CHI","08","http://dx.doi.org/10.1145/1357054.1357286","LiveRAC: interactive visual exploration of system management time-series data","23 ","13","106","735","design; longitudinal studies; time-series data","10","81100654521, Peter McLachlan, University of British Columbia, Vancouver, BC, Canada; 81100047885, Tamara Munzner, University of British Columbia, Vancouver, BC, Canada; 81100289845, Eleftherios Koutsofios, AT&T Labs Inc. - Research, Florham Park, NJ, USA; 81452611984, Stephen North, AT&T Labs Inc. - Research, Florham Park, NJ, USA; "
"CHI","08","http://dx.doi.org/10.1145/1357054.1357287","Metrics for measuring human interaction with interactive visualizations for information analysis","1 ","3","65","743","evaluation; heuristics; information visualization; usability","4","81100393910, Theresa A. O'Connell,, National Institute of Standards and Technology, Gaithersburg, MD; 81100271785, Yee-Yin Choong, National Institute of Standards and Technology, Gaithersburg, MD; "
"CHI","08","http://dx.doi.org/10.1145/1357054.1357288","On the benefits of confidence visualization in speech recognition","3 ","1","26","353","design; natural language; speech recognition; visualization","4","81413602297, Keith Vertanen, University of Cambridge, Cambridge, United Kingdom; 81100362804, Per Ola Kristensson, University of Cambridge, Cambridge, United Kingdom; "
"CHI","08","http://dx.doi.org/10.1145/1357054.1357290","A latent semantic analysis methodology for the identification and creation of personas","3 ","12","97","928","cluster analysis; human factors; latent semantic analysis; theory and methods","10","81350583838, Tomasz Miaskiewicz, University of Colorado at Boulder, Boulder, CO, USA; 81339531152, Tamara Sumner, University of Colorado at Boulder, Boulder, CO, USA; 81100162726, Kenneth A. Kozar, University of Colorado at Boulder, Boulder, CO, USA; "
"CHI","08","http://dx.doi.org/10.1145/1357054.1357291","The effects of empathetic virtual characters on presence in narrative-centered learning environments","14 ","3","61","739","artificial, augmented, and virtual realities; evaluation/methodology; experimentation; learning environments; presence","10","81318490239, Scott W. McQuiggan, North Carolina State University, Raleigh, NC, USA; 81381595960, Jonathan P. Rowe, North Carolina State University, Raleigh, NC, USA; 81339512416, James C. Lester, North Carolina State University, Raleigh, NC, USA; "
"CHI","08","http://dx.doi.org/10.1145/1357054.1357292","Data-driven persona development","13 ","23","176","1,285","data analysis; design; human factors; persona development; survey; user research; user-centered design","4","81328489397, Jennifer (Jen) McGinn, Sun Microsystems, Inc., Burlington, MA, USA; 81350587159, Nalini Kotamraju, Sun Microsystems, Inc., Menlo Park, CA, USA; "
"CHI","08","http://dx.doi.org/10.1145/1357054.1357294","Cross-channel mobile social software: an empirical study","13 ","3","51","724","communications applications; field trial; human factors; multi-modal; user interfaces","10","81350568274, Clint Heyer, The University of Queensland, Brisbane, Australia; 81100017862, Margot Brereton, Queensland University of Technology, Brisbane, Australia; 81100331677, Stephen Viller, University of Queensland, Brisbane, Australia; "
"CHI","08","http://dx.doi.org/10.1145/1357054.1357295","Social copresence in anonymous social interactions using a mobile video telephone","5 ","2","40","743","affective behavior; avatar realism; miscellaneous; psychology; social presence","10","81317495070, Sin-Hwa Kang, Rensselaer Polytechnic Institute(RPI), Troy, NY, USA; 81408594805, James H. Watt, Rensselaer Polytechnic Institute(RPI), Troy, NY, USA; 81361595656, Sasi Kanth Ala, Rensselaer Polytechnic Institute(RPI), Troy, NY, USA; "
"CHI","08","http://dx.doi.org/10.1145/1357054.1357296","Use and reuse of shared lists as a social content type","12 ","4","39","704","collaboration; design; memes; shared lists; web-based interaction","10","81100543332, Werner Geyer, IBM T.J. Watson Research, Cambridge, MA, USA; 81340488769, Casey Dugan, IBM T.J. Watson Research, Cambridge, MA, USA; 81100057928, Joan DiMicco, IBM T.J. Watson Research, Cambridge, MA, USA; 81100086599, David R. Millen, IBM T.J. Watson Research, Cambridge, MA, USA; 81100297942, Beth Brownholtz, IBM T.J. Watson Research, Cambridge, MA, USA; 81332517372, Michael Muller, IBM T.J. Watson Research, Cambridge, MA, USA; "
"CHI","08","http://dx.doi.org/10.1145/1357054.1357298","Emotional and behavioral responses to haptic stimulation","13 ","25","101","1,071","empirical methods; haptic i/o","8","81381604455, Katri Salminen, University of Tampere, Tampere, Finland; 81339531194, Veikko Surakka, University of Tampere, Tampere, Finland; 81350584456, Jani Lylykangas, University of Tampere, Tampere, Finland; 81100035603, Jukka Raisamo, University of Tampere, Tampere, Finland; 81100502884, Rami Saarinen, University of Tampere, Tampere, Finland; 81100035638, Roope Raisamo, University of Tampere, Tampere, Finland; 81381603994, Jussi Rantala, University of Tampere, Tampere, Finland; 81100154026, Grigori Evreinov, University of Tampere, Tampere, Finland; "
"CHI","08","http://dx.doi.org/10.1145/1357054.1357299","Evaluating tactile feedback and direct vs. indirect stylus input in pointing and crossing selection tasks","23 ","6","83","862","crossing interfaces; experimentation; human factors; pen/stylus input","10","81100584798, Clifton Forlines, Mitsubishi Electric Research Laboratories, Cambridge, MA, USA and University of Toronto, Toronto, ON, Canada; 81100503904, Ravin Balakrishnan, University of Toronto, Toronto, ON, Canada; "
"CHI","08","http://dx.doi.org/10.1145/1357054.1357300","Investigating the effectiveness of tactile feedback for mobile touchscreens","83 ","44","343","3,006","fingertip interaction; human factors; multimodal interaction; touchscreens","10","81311484652, Eve Hoggan, University of Glasgow, Glasgow, United Kingdom; 81100359199, Stephen A. Brewster, University of Glasgow, Glasgow, United Kingdom; 81350572012, Jody Johnston, University of Glasgow, Glasgow, United Kingdom; "
"CHI","08","http://dx.doi.org/10.1145/1357054.1357302","A co-located interface for narration to support reconciliation in a conflict: initial results from Jewish and Palestinian youth","5 ","2","36","447","face-to-face collaboration; miscellaneous; tabletop interaction","10","81409595352, Oliviero Stock, FBK-irst, Trento, Italy; 81100153077, Massimo Zancanaro, FBK-irst, Trento, Italy; 81418595182, Chaya Koren, University of Haifa, Haifa, Israel; 81100072664, Cesare Rocchi, FBK-irst, Trento, Italy; 81418595475, Zvi Eisikovits, University of Haifa, Haifa, Israel; 81100179029, Dina Goren-bar, University of Haifa, Haifa, Israel; 81350578541, Daniel Tomasini, FBK-irst, Trento, Italy; 81350572487, Patrice (Tamar) Weiss, University of Haifa, Haifa, Israel; "
"CHI","08","http://dx.doi.org/10.1145/1357054.1357303","Cultural theory and real world design: Dystopian and Utopian Outcomes","9 ","6","67","862","cultural theory; human factors; mobile phones","10","81350582064, Christine Satchell, The University of Melbourne, Melbourne, Australia; "
"CHI","08","http://dx.doi.org/10.1145/1357054.1357304","The network in the garden: an empirical analysis of social media in rural life","19 ","24","209","1,721","digital divide; rural; social network sites","10","81336489255, Eric Gilbert, University of Illinois at Urbana-Champaign, Urbana, IL, USA; 81350570757, Karrie Karahalios, University of Illinois at Urbana-Champaign, Urbana, IL, USA; 81100067260, Christian Sandvig, University of Illinois at Urbana-Champaign, Urbana, IL, USA; "
"CHI","08","http://dx.doi.org/10.1145/1357054.1357306","An error model for pointing based on Fitts' law","13 ","7","106","1,222","clicking errors; error rates; fitts' law; human factors; movement time; pointing time; speed-accuracy tradeoff; theory and methods","10","81100086173, Jacob O. Wobbrock, University of Washington, Seattle, WA, USA; 81100506242, Edward Cutrell, Microsoft Research, Redmond, WA, USA; 81319492589, Susumu Harada, University of Washington, Seattle, WA, USA; 81100367406, I. Scott MacKenzie, York University, Toronto, ON, Canada; "
"CHI","08","http://dx.doi.org/10.1145/1357054.1357307","Optimal parameters for efficient crossing-based dialog boxes","5 ","0","25","343","crossing-based interfaces; dialog box; human factors; interaction design","10","81350581254, Morgan Dixon, University of Maryland, College Park, College Park, MD, USA; 81100301845, Fran&#231;ois Guimbreti&#232;re, University of Maryland, College Park, College Park, MD, USA; 81315488158, Nicholas Chen, University of Maryland, College Park, College Park, MD, USA; "
"CHI","08","http://dx.doi.org/10.1145/1357054.1357308","Fitts' throughput and the speed-accuracy tradeoff","18 ","1","59","518","fitts' law; input devices and strategies; throughput","4","81100367406, I. Scott MacKenzie, York University, Toronto, ON, Canada; 81100311272, Poika Isokoski, University of Tampere, Tampere, Finland; "
"CHI","08","http://dx.doi.org/10.1145/1357054.1357310","Articulating common ground in cooperative work: content and process","13 ","9","57","796","common ground; content; experimentation; measurement","10","81100232230, Gregorio Convertino, Penn State University, University Park, PA, USA; 81100393102, Helena M. Mentis, Penn State University, University Park, PA, USA; 81335496622, Mary Beth Rosson, Penn State University, University Park, PA, USA; 81350576124, John M. Carroll, Penn State University, University Park, PA, USA; 81100494824, Aleksandra Slavkovic, Penn State University, University Park, PA, USA; 81100569113, Craig H. Ganoe, Penn State University, University Park, PA, USA; "
"CHI","08","http://dx.doi.org/10.1145/1357054.1357311","CoSearch: a system for co-located collaborative web search","63 ","15","108","973","collaborative search; cscw; experimentation; web search","10","81323487634, Saleema Amershi, University of Washington, Seattle, WA, USA; 81452607037, Meredith Ringel Morris, Microsoft Research, Redmond, WA, USA; "
"CHI","08","http://dx.doi.org/10.1145/1357054.1357312","A survey of collaborative web search practices","65 ","31","167","1,449","computer-supported cooperative work; human factors","4","81452607037, Meredith Ringel Morris, Microsoft Research, Redmond, WA, USA; "
"CHI","08","http://dx.doi.org/10.1145/1357054.1357313","OpenMessenger: gradual initiation of interaction for distributed workgroups","8 ","0","24","360","asynchronous interaction; computer-supported cooperative work; human factors; privacy","4","81100651315, Jeremy P. Birnholtz, Cornell University, Ithaca, NY, USA; 81100275704, Carl Gutwin, University of Saskatchewan, Saskatoon, Canada; 81100092787, Gonzalo Ramos, University of Toronto, Toronto, Canada; 81414609477, Mark Watson; "
"CHI","08","http://dx.doi.org/10.1145/1357054.1357315","How accurate must an in-car information system be?: consequences of accurate and inaccurate information in cars","6 ","6","48","669","design; experimentation; human factors; information accuracy; speech systems; voice i/o","10","81100618598, Ing-Marie Jonsson, Link&#246;ping University, Link&#246;ping, Sweden; 81100116763, Helen Harris, Stanford University, Stanford, CA, USA; 81100153283, Clifford Nass, Stanford University, Stanford, CA, USA; "
"CHI","08","http://dx.doi.org/10.1145/1357054.1357316","In-car gps navigation: engagement with and disengagement from the environment","39 ","30","197","1,885","design; gps; miscellaneous; social issues","10","81350569215, Gilly Leshed, Cornell University, Ithaca, NY, USA; 81350584605, Theresa Velden, Cornell University, Ithaca, NY, USA; 81541163856, Oya Rieger, Cornell University, Ithaca, NY, USA; 81100157042, Blazej Kot, Cornell University, Ithaca, NY, USA; 81100397464, Phoebe Sengers, Cornell University, Ithaca, NY, USA; "
"CHI","08","http://dx.doi.org/10.1145/1357054.1357317","In-car interaction using search-based user interfaces","6 ","8","76","802","car interface; interaction styles; search-based interaction","4","81544856556, Stefan Graf, BMW Group Research and Technology, M&#252;nchen, Germany; 81324493828, Wolfgang Spiessl, BMW Group Research and Technology, M&#252;nchen, Germany; 81100588072, Albrecht Schmidt, Universit&#228;t Duisburg-Essen, Essen, Germany; 81350569783, Anneke Winter, BMW Group Research and Technology, M&#252;nchen, Germany; 81100243533, Gerhard Rigoll, Technische Universit&#228;t M&#252;nchen, M&#252;nchen, Germany; "
