"conference","year","doi","title","citationCount","download6weeks","download12months","downloadAll","keywords","pageNumber","authors"
"CHI","08","http://dx.doi.org/10.1145/1357054.1357056","Ambient social tv: drawing people into a shared experience","28 ","25","192","2,060","ambient displays; human factors; miscellaneous; social television","10","81350574653, Gunnar Harboe, Motorola Labs, Schaumburg, IL, USA; 81311483921, Crysta J. Metcalf, Motorola Labs, Schaumburg, IL, USA; 81311482466, Frank Bentley, Motorola Labs, Schaumburg, IL, USA; 81100056841, Joe Tullio, Motorola Labs, Schaumburg, IL, USA; 81350581341, Noel Massey, Motorola Labs, Schaumburg, IL, USA; 81350578686, Guy Romano, Motorola Labs, Schaumburg, IL, USA; "
"CHI","08","http://dx.doi.org/10.1145/1357054.1357057","Re-placing faith: reconsidering the secular-religious use divide in the United States and Kenya","10 ","4","213","1,002","design; miscellaneous; sketching","10","81314492849, Susan P. Wyche, Georgia Institute of Technology, Atlanta, GA, USA; 81100590142, Paul M. Aoki, Intel Research, Berkeley, CA, USA; 81328488487, Rebecca E. Grinter, Georgia Institute of Technology, Atlanta, GA, USA; "
"CHI","08","http://dx.doi.org/10.1145/1357054.1357058","From <i>meiwaku</i> to <i>tokushita</i>!: lessons for digital money design from japan","5 ","6","254","1,251","cybercash, digital cash; digital money; e-wallets; japan; ubiquitous computing","4","81100420884, Scott Mainwaring, Intel Research, Portland, OR, USA; 81311483392, Wendy March, Intel Research, Portland, OR, USA; 81350585687, Bill Maurer, UC Irvine, Irvine, CA, USA; "
"CHI","08","http://dx.doi.org/10.1145/1357054.1357059","Human-Currency Interaction: learning from virtual currency use in China","7 ","6","187","1,056","china; digital money; hci design; miscellaneous; trust; virtual worlds","4","81537980956, Yang Wang, University of California, Irvine, Irvine, CA, USA; 81100420884, Scott D. Mainwaring, Intel Research, Beaverton, OR, USA; "
"CHI","08","http://dx.doi.org/10.1145/1357054.1357061","CueFlik: interactive concept learning in image search","29 ","1","78","947","cueflik; interactive concept learning; user/machine systems","10","81100142271, James Fogarty, University of Washington, Seattle, WA, USA; 81100255664, Desney Tan, Microsoft Research, Seattle, WA, USA; 81100301388, Ashish Kapoor, Microsoft Research, Seattle, WA, USA; 81100443836, Simon Winder, Microsoft Research, Seattle, WA, USA; "
"CHI","08","http://dx.doi.org/10.1145/1357054.1357062","Knowledge in the head and on the web: using topic expertise to aid search","9 ","2","53","775","domain knowledge; expertise; information scent; query formulation; web search","10","81311482524, Geoffrey B. Duggan, University of Manchester, Manchester, United Kingdom; 81100557764, Stephen J. Payne, University of Manchester, Manchester, United Kingdom; "
"CHI","08","http://dx.doi.org/10.1145/1357054.1357063","MQSearch: image search by multi-class query","5 ","0","25","561","algorithms; design; image retrieval; prototyping; relevance feedback","4","81350572997, Yiwen Luo, The Chinese University of Hong Kong, Hong Kong, Hong Kong; 81418594973, Wei Liu, The Chinese University of Hong Kong, Hong Kong, Hong Kong; 81452603630, Jianzhuang Liu, The Chinese University of Hong Kong, Hong Kong, Hong Kong; 81452597691, Xiaoou Tang, Microsoft Research Asia, Beijing, China; "
"CHI","08","http://dx.doi.org/10.1145/1357054.1357065","AutoTopography: what can physical mementos tell us about digital memories?","40 ","12","103","1,068","autobiographical memory; digital mementos; human factors","10","81100189751, Daniela Petrelli, University of Sheffield, Sheffield, United Kingdom; 81100318557, Steve Whittaker, University of Sheffield, Sheffield, United Kingdom; 81361593530, Jens Brockmeier, University of Innsbruck, Innsbruck, Austria; "
"CHI","08","http://dx.doi.org/10.1145/1357054.1357066","Mobile multimedia presentation editor: enabling creation of audio-visual stories on mobile devices","15 ","8","83","1,234","animations; content creation; editor; human factors; mms; multimedia messages; smil; user interfaces","10","81408600326, Tero Jokela, Nokia Research Center, Tampere, Finland; 81100569515, Jaakko T. Lehikoinen, Nokia Research Center, Tampere, Finland; 81100009263, Hannu Korhonen, Nokia Research Center, Tampere, Finland; "
"CHI","08","http://dx.doi.org/10.1145/1357054.1357067","Temporal trajectories in shared interactive narratives","20 ","10","102","798","cscw; drama; games; hypermedia; mobile; pacing; sms; synchronization; time","10","81100619971, Steve Benford, University of Nottingham, Nottingham, United Kingdom; 81350583937, Gabriella Giannachi, Centre for Intermedia, Department of Drama, University of Exeter, Exeter, EX44LA, UK; "
"CHI","08","http://dx.doi.org/10.1145/1357054.1357069","Communication chains and multitasking","13 ","14","75","1,005","asynchronous interaction; computer-supported cooperative work; interaction; multitasking; workplace","10","81100108464, Norman Makoto Su, University of California, Irvine, Irvine, CA, USA; 81100279599, Gloria Mark, University of California, Irvine, Irvine, CA, USA; "
"CHI","08","http://dx.doi.org/10.1145/1357054.1357070","Effects of intelligent notification management on users and their tasks","22 ","6","85","1,014","breakpoint; human factors; interruption; statistical models","10","81343495796, Shamsi T. Iqbal, University of Illinois at Urbana-Champaign, Urbana, IL, USA; 81100615948, Brian P. Bailey, University of Illinois at Urbana-Champaign, Urbana, IL, USA; "
"CHI","08","http://dx.doi.org/10.1145/1357054.1357071","Attention by proxy? issues in audience awareness for webcasts to distributed groups","2 ","2","30","421","attention; e-learning; lectures; web-based interaction","4","81100651315, Jeremy Birnholtz, Cornell University, Ithaca, NY, USA; 81328489697, Clarissa Mak, University of Toronto, Toronto, ON, Canada; 81100197069, Saul Greenberg, University of Calgary, Calgary, AB, Canada; 81100448368, Ron Baecker, University of Toronto, Toronto, ON, Canada; "
"CHI","08","http://dx.doi.org/10.1145/1357054.1357072","The cost of interrupted work: more speed and stress","34 ","27","153","1,054","context; experiment; human factors; multi-tasking","4","81100279599, Gloria Mark, University of California, Irvine, Irvine, CA, USA; 81350585506, Daniela Gudith, Humboldt University, Berlin, Germany; 81350585339, Ulrich Klocke, Humboldt University, Berlin, Germany; "
"CHI","08","http://dx.doi.org/10.1145/1357054.1357074","Usability evaluation considered harmful (some of the time)","98 ","133","1,485","7,350","evaluation/methodology; interface critiques; usability testing","10","81100197069, Saul Greenberg, University of Calgary, Calgary, AB, Canada; 81452616426, Bill Buxton, Microsoft Research, Redmond, WA, USA; "
"CHI","08","http://dx.doi.org/10.1145/1357054.1357076","Exploring the use of tangible user interfaces for human-robot interaction: a comparative study","22 ","29","181","1,611","gesture input; human-robot interaction; tangible user interface","10","81543315156, Cheng Guo, University of Calgary, Calgary, AB, Canada; 81339528031, Ehud Sharlin, University of Calgary, Calgary, AB, Canada; "
"CHI","08","http://dx.doi.org/10.1145/1357054.1357077","Precision timing in human-robot interaction: coordination of head movement and utterance","20 ","11","82","835","conversation analysis; guide robot; human-robot interaction","10","81100620449, Akiko Yamazaki, Future University-Hakodate, Saitama, Japan; 81350572857, Keiichi Yamazaki, Saitama University, Saitama, Japan; 81100082332, Yoshinori Kuno, Saitama University, Saitama, Japan; 81350586995, Matthew Burdelski, Saitama University, Saitama, Japan; 81328488988, Michie Kawashima, Saitama University, Saitama, Japan; 81100072975, Hideaki Kuzuoka, University of Tsukuba, Tsukuba, Japan; "
"CHI","08","http://dx.doi.org/10.1145/1357054.1357078","The see-Puck: a platform for exploring human-robot relationships","1 ","4","36","542","commercial robots and applications; emergent visualizations; human-robot interaction; swarm interaction","4","81309488890, Mattias Jacobsson, Viktoria Institute, G&#246;teborg, Sweden; 81350578555, Johan Bodin, Viktoria Institute, G&#246;teborg, Sweden; 81100144729, Lars Erik Holmquist, Swedish Institute of Computer Science, Kista, Sweden; "
"CHI","08","http://dx.doi.org/10.1145/1357054.1357080","Explore! possibilities and challenges of mobile learning","27 ","16","191","2,243","children; cooperative inquiry; digital augmentation; edutainment; human factors","10","81100096224, Maria F. Costabile, Universit&#224; di Bari, Bari, Italy; 81100647415, Antonella De Angeli, The University of Manchester, Manchester, United Kingdom; 81100592341, Rosa Lanzilotti, Universit&#224; di Bari, Bari, Italy; 81314481061, Carmelo Ardito, Universit&#224; di Bari, Bari, Italy; 81100302537, Paolo Buono, Universit&#224; di Bari, Bari, Italy; 81100431226, Thomas Pederson, Ume&#229; University, Ume&#229;, Sweden; "
"CHI","08","http://dx.doi.org/10.1145/1357054.1357081","Pause, predict, and ponder: use of narrative videos to improve cultural discussion and learning","5 ","4","38","464","computer uses in education; educational technology; ill-defined domains; multimedia","8","81350583567, Amy Ogan, Carnegie Mellon University, Pittsburgh, PA, USA; 81100516901, Vincent Aleven, Carnegie Mellon University, Pittsburgh, PA, USA; 81384591658, Christopher Jones, Carnegie Mellon University, Pittsburgh, PA, USA; "
"CHI","08","http://dx.doi.org/10.1145/1357054.1357082","WallCology: designing interaction affordances for learner engagement in authentic science inquiry","3 ","4","164","886","computer uses in education; embedded phenomena; human factors; ubiquitous computing","10","81100538646, Tom Moher, University of Illinois at Chicago, Chicago, IL, USA; 81385598153, Brian Uphoff, University of Illinois at Chicago, Chicago, IL, USA; 81385595807, Darshan Bhatt, University of Illinois at Chicago, Chicago, IL, USA; 81385596012, Brenda L&#243;pez Silva, University of Illinois at Chicago, Chicago, IL, USA; 81385599502, Peter Malcolm, University of Illinois at Chicago, Chicago, IL, USA; "
"CHI","08","http://dx.doi.org/10.1145/1357054.1357084","Measuring trust in wi-fi hotspots","7 ","1","48","869","experimentation; human factors; phishing; security; security and protection; trust","10","81100650307, Tim Kindberg, Hewlett-Packard Laboratories, Bristol, Bristol, United Kingdom; 81100041277, Eamonn O'Neill, University of Bath, Bath, UK; 81414600496, Chris Bevan, University of Bath, Bath, UK; 81100283202, Vassilis Kostakos, University of Bath, Bath, UK; 81436596733, Dana&#235; Stanton Fraser, University of Bath, Bath, UK; 81363602590, Tim Jay, University of Bath, Bath, UK; "
"CHI","08","http://dx.doi.org/10.1145/1357054.1357085","Undercover: authentication usable in front of prying eyes","21 ","12","70","807","haptic i/o; multisensory processes; security; usability","10","81547095256, Hirokazu Sasamoto, Carnegie Mellon University and Sharp Corporation, Kobe, Japan; 81100131105, Nicolas Christin, Carnegie Mellon University, Kobe, Japan; 81371593190, Eiji Hayashi; "
"CHI","08","http://dx.doi.org/10.1145/1357054.1357086","Access control by testing for shared knowledge","5 ","2","29","487","access control; human factors; privacy; user interfaces","4","81350578147, Michael Toomim, University of Washington, Seattle, WA, USA; 81350581108, Xianhang Zhang, University of Washington, Seattle, WA, USA; 81100142271, James Fogarty, University of Washington, Seattle, USA; 81100103519, James A. Landay, University of Washington, Seattle, WA, USA; "
"CHI","08","http://dx.doi.org/10.1145/1357054.1357087","Love and authentication","12 ","2","43","697","authentication; evaluation/methodology; human factors; reset; security","4","81100035930, Markus Jakobsson, Palo Alto Research Center, Palo Alto, CA, USA; 81100118833, Erik Stolterman, Indiana University, Bloomington, IN, USA; 81100092722, Susanne Wetzel, Stevens Institute of Technology, Hoboken, NJ, USA; 81350571494, Liu Yang, Stevens Institute of Technology, Hoboken, NJ, USA; "
"CHI","08","http://dx.doi.org/10.1145/1357054.1357089","Reality-based interaction: a framework for post-WIMP interfaces","126 ","56","484","3,634","context-aware; interaction styles; next-generation; reality-based interaction; ubiquitous computing; user/machine systems","10","81100438120, Robert J.K. Jacob, Tufts University, Medford, MA, USA; 81324489772, Audrey Girouard, Tufts University, Medford, MA, USA; 81324490057, Leanne M. Hirshfield, Tufts University, Medford, MA, USA; 81328488785, Michael S. Horn, Tufts University, Medford, MA, USA; 81100216740, Orit Shaer, Tufts University, Medford, MA, USA; 81324494052, Erin Treacy Solovey, Tufts University, Medford, MA, USA; 81311481073, Jamie Zigelbaum, MIT Media Lab, Cambridge, MA, USA; "
"CHI","08","http://dx.doi.org/10.1145/1357054.1357090","Inflatable mouse: volume-adjustable mouse with air-pressure-sensitive input and haptic feedback","18 ","9","100","1,134","design; haptic i/o; input devices; input devices and strategies","14","81324491023, Seoktae Kim, Korea Advanced Institute of Science and Technology, Daejeon, South Korea; 81452601021, Hyunjung Kim, Korea Advanced Institute of Science and Technology, Daejeon, South Korea; 81350583269, Boram Lee, Korea Advanced Institute of Science and Technology, Daejeon, South Korea; 81100320511, Tek-Jin Nam, Korea Advanced Institute of Science and Technology, Daejeon, South Korea; 81100384795, Woohun Lee, Korea Advanced Institute of Science and Technology, Daejeon, South Korea; "
"CHI","08","http://dx.doi.org/10.1145/1357054.1357091","MightyTrace: multiuser tracking technology on lc-displays","3 ","1","36","611","cscw; input technology; miscellaneous; tangible user interfaces","4","81350579036, Ramon Hofer, Inspire AG, ETH Zurich, Zurich, Switzerland; 81350570558, Patrick Kaplan, Technical University Munich, Munich, Germany; 81100548693, Andreas Kunz, Inspire AG, ETH Zurich, Zurich, Switzerland; "
"CHI","08","http://dx.doi.org/10.1145/1357054.1357092","Quickdraw: the impact of mobility and on-body placement on device access time","14 ","9","47","503","access time; experimentation; input devices and strategies; mobile phones; performance","4","81100147905, Daniel L. Ashbrook, Georgia Tech, Atlanta, GA, USA; 81100469379, James R. Clawson, Georgia Tech, Atlanta, GA, USA; 81100493601, Kent Lyons, Intel Research, Santa Clara, CA, USA; 81100175439, Thad E. Starner, Georgia Tech, Atlanta, GA, USA; 81100489850, Nirmal Patel, Georgia Tech, Atlanta, GA, USA; "
"CHI","08","http://dx.doi.org/10.1145/1357054.1357093","Using tags to assist near-synchronous communication","5 ","0","24","519","computer-supported cooperative work; human factors; instant messaging","4","81343495056, Gary Hsieh, Carnegie Mellon University, Pittsburgh, PA, USA; 81452599499, Jennifer Lai, IBM, Hawthorne, NY, USA; 81328488846, Scott E. Hudson, Carnegie Mellon University, Pittsburgh, PA, USA; 81328489038, Robert Kraut, Carnegie Mellon University, Pittsburgh, PA, USA; "
"CHI","08","http://dx.doi.org/10.1145/1357054.1357095","Improving meeting capture by applying television production principles with audio and motion detection","16 ","1","206","812","automated camera control; meeting capture; video","10","81100330306, Abhishek Ranjan, University of Toronto, Toronto, Canada; 81100651315, Jeremy Birnholtz, University of Toronto, Toronto, Canada and Cornell University, Ithaca, NY, USA; 81100503904, Ravin Balakrishnan, University of Toronto, Toronto, Canada; "
"CHI","08","http://dx.doi.org/10.1145/1357054.1357096","Video browsing by direct manipulation","35 ","33","345","1,453","design; graphical user interfaces; interaction styles","10","81502723138, Pierre Dragicevic, University of Toronto, Toronto, Canada; 81100092787, Gonzalo Ramos, University of Toronto, Toronto, Canada; 81350585393, Jacobo Bibliowitcz, University of Toronto, Toronto, Canada; 81319498527, Derek Nowrouzezahrai, University of Toronto, Toronto, Canada; 81100503904, Ravin Balakrishnan, University of Toronto, Toronto, Canada; 81100278455, Karan Singh; "
"CHI","08","http://dx.doi.org/10.1145/1357054.1357097","DRAGON: a direct manipulation interface for frame-accurate in-scene video navigation","17 ","16","309","1,095","algorithms; direct manipulation; human factors; interaction styles; object dragging; video","4","81310482207, Thorsten Karrer, RWTH Aachen University, Aachen, Germany; 81414605252, Malte Weiss, RWTH Aachen University, Aachen, Germany; 81100385689, Eric Lee, Apple Inc., Cupertino, CA, USA; 81100443423, Jan Borchers, RWTH Aachen University, Aachen, Germany; "
"CHI","08","http://dx.doi.org/10.1145/1357054.1357098","Handsaw: tangible exploration of volumetric data by direct cut-plane projection","4 ","15","189","794","cross-section; human factors; interior design; miscellaneous; product design; tangible user interface","4","81100186035, Leonardo Bonanni, MIT Media Laboratory, Cambridge, MA, USA; 81317490579, Jason Alonso, MIT Media Laboratory, Cambridge, MA, USA; 81414611963, Neil Chao, MIT, Cambridge, MA, USA; 81350574903, Greg Vargas, MIT, Cambridge, MA, USA; 81100363076, Hiroshi Ishii, MIT Media Laboratory, Cambridge, MA, USA; "
"CHI","08","http://dx.doi.org/10.1145/1357054.1357100","Do I live in a flood basin?: synthesizing ten thousand maps","3 ","1","52","624","gis; mashups; online maps","10","81350583748, Miguel Elias, University of Chile, Santiago, Chile; 81100614750, Jeremy Elson, Microsoft Research, Redmond, WA, USA; 81309487122, Danyel Fisher, Microsoft Research, Redmond, WA, USA; 81100070011, Jon Howell, Microsoft Research, Redmond, WA, USA; "
"CHI","08","http://dx.doi.org/10.1145/1357054.1357101","Integrating statistics and visualization: case studies of gaining clarity during exploratory data analysis","34 ","28","196","1,879","case studies; evaluation; exploratory data analysis; human factors; measurement; statistics","10","81100462318, Adam Perer, University of Maryland, College Park, MD, USA; 81100146468, Ben Shneiderman, University of Maryland, College Park, MD, USA; "
"CHI","08","http://dx.doi.org/10.1145/1357054.1357102","Your place or mine?: visualization as a community component","18 ","4","73","927","communication; graphical user interfaces; social data analysis","10","81100064306, Catalina M. Danis, IBM, T.J. Watson Resear h Center, Yorktown Heights, NY, USA; 81100539968, Fernanda B. Viegas, IBM, T.J. Watson Resear h Center, Cambridge, MA, USA; 81100331534, Martin Wattenberg, IBM, T.J. Watson Resear h Center, Cambridge, MA, USA; 81339510798, Jesse Kriss; "
"CHI","08","http://dx.doi.org/10.1145/1357054.1357104","Escape: a target selection technique using visually-cued gestures","28 ","13","122","1,449","finger gesture; input devices and strategies; mobile device; touch screen","10","81100158260, Koji Yatani, University of Toronto, Toronto, ON, Canada; 81100558733, Kurt Partridge, Palo Alto Research Center, Inc., Palo Alto, CA, USA; 81339490239, Marshall Bern, Palo Alto Research Center, Inc., Palo Alto, CA, USA; 81406594629, Mark W. Newman, University of Michigan, Ann Arbor, MI, USA; "
"CHI","08","http://dx.doi.org/10.1145/1357054.1357105","Rubbing and tapping for precise and rapid selection on touch-screen displays","43 ","17","111","2,153","graphical user interfaces; input devices and strategies; interaction techniques; rub-pointing; rubbing; touch screens","10","81309497296, Alex Olwal, Royal Institute of Technology (KTH), Stockholm, Sweden; 81100427474, Steven Feiner, Columbia University, New York, NY, USA; 81350585383, Susanna Heyman, Royal Institute of Technology (KTH), Stockholm, Sweden; "
"CHI","08","http://dx.doi.org/10.1145/1357054.1357106","Graffiti vs. unistrokes: an empirical comparison","11 ","6","59","695","empirical study; graffiti; performance; text entry","4","81350585002, Steven J. Castellucci, York University, Toronto, ON, Canada; 81100367406, I. Scott MacKenzie, York University, Toronto, ON, Canada; "
"CHI","08","http://dx.doi.org/10.1145/1357054.1357107","The cone and the lazy bubble: two efficient alternatives between the point cursor and the bubble cursor","3 ","2","49","613","bubble cursor; evaluation/methodology; graphical user interfaces; input devices and strategies; performance","4","81350583961, Joona Laukkanen, University of Tampere, Tampere, Finland; 81100311272, Poika Isokoski, University of Tampere, Tampere, Finland; 81100052864, Kari-Jouko R&#228;ih&#228;, University of Tampere, Tampere, Finland; "
"CHI","08","http://dx.doi.org/10.1145/1357054.1357109","A bright green perspective on sustainable choices","59 ","29","150","1,697","domestic technology; green; miscellaneous; sustainable interaction design","10","81100327302, Allison Woodruff, Intel Research, Berkeley, CA, USA; 81350568406, Jay Hasbrouck, Intel, Beaverton, OR, USA; 81350567614, Sally Augustin; "
"CHI","08","http://dx.doi.org/10.1145/1357054.1357110","Breaking the disposable technology paradigm: opportunities for sustainable interaction design for mobile phones","35 ","37","203","1,682","design; e-waste; mobile phones; sustainability","10","81100080130, Elaine M. Huang, RWTH Aachen University, Motorola Labs, Schaumburg, IL, USA; 81339532748, Khai N. Truong, University of Toronto, Toronto, ON, Canada; "
"CHI","08","http://dx.doi.org/10.1145/1357054.1357111","Sustainable millennials: attitudes towards sustainability and the material effects of interactive technologies","22 ","27","209","1,506","consumer products; design; markets; sid; sustainable interaction design","10","81350575877, Kristin Hanks, Indiana University at Bloomington, Bloomington, IN, USA; 81350582655, William Odom, Indiana University at Bloomington, Bloomington, IN, USA; 81339524704, David Roedl, Indiana University at Bloomington, Bloomington, IN, USA; 81100365314, Eli Blevis, Indiana University at Bloomington, Bloomington, IN, USA; "
"CHI","08","http://dx.doi.org/10.1145/1357054.1357113","Children attribute moral standing to a personified agent","3 ","1","29","506","children; experimentation; personified software agent; user-centered design; value sensitive design","10","81100563869, Nathan G. Freier, Rensselaer Polytechnic Institute, Troy, NY, USA; "
"CHI","08","http://dx.doi.org/10.1145/1357054.1357114","Mischief: supporting remote teaching in developing regions","22 ","11","67","661","children; cscw; human factors; input devices and strategies","10","81100082877, Neema Moraveji, Microsoft Research Asia, Beijing, China; 81350574848, Taemie Kim, Microsoft Research Asia, Beijing, China; 81350569102, James Ge, Microsoft Research Asia, Beijing, China; 81314484899, Udai Singh Pawar, Microsoft Research India, Bangalore, India; 81350583844, Kathleen Mulcahy, Microsoft Corp., Redmond, WA, USA; 81100519232, Kori Inkpen, Microsoft Research, Redmond, WA, USA; "
"CHI","08","http://dx.doi.org/10.1145/1357054.1357115","Playful toothbrush: ubicomp technology for teaching tooth brushing to kindergarten children","16 ","15","119","1,068","children; occupational therapy; tooth brushing.; user interfaces","10","81350574854, Yu-Chen Chang, National Taiwan University, Taipei, Taiwan Roc; 81384604365, Jin-Ling Lo, National Taiwan University, Taipei, Taiwan Roc; 81350582714, Chao-Ju Huang, National Taiwan University, Taipei, Taiwan Roc; 81350579621, Nan-Yi Hsu, National Taiwan University, Taipei, Taiwan Roc; 81100141352, Hao-Hua Chu, National Taiwan University, Taipei, Taiwan Roc; 81350581054, Hsin-Yen Wang, National Taiwan University, Taipei, Taiwan Roc; 81416596840, Pei-Yu Chi, National Taiwan University, Taipei, Taiwan Roc; 81350577632, Ya-Lin Hsieh, National Taiwan University, Taipei, Taiwan Roc; "
"CHI","08","http://dx.doi.org/10.1145/1357054.1357117","Collaborative editing for improved usefulness and usability of transcript-enhanced webcasts","4 ","4","48","640","automatic speech recognition; experimentation; human factors; navigational tools; user interfaces; wiki","10","81100559377, Cosmin Munteanu, University of Toronto, Toronto, ON, Canada; 81100448368, Ron Baecker, University of Toronto, Toronto, ON, Canada; 81100263138, Gerald Penn, University of Toronto, Toronto, ON, Canada; "
"CHI","08","http://dx.doi.org/10.1145/1357054.1357118","Collaborative interaction with volumetric displays","8 ","9","74","1,060","collaborative interaction; human factors; volumetric displays","10","81100477897, Tovi Grossman, University of Toronto, Toronto, ON, Canada; 81100503904, Ravin Balakrishnan, University of Toronto, Toronto, ON, Canada; "
"CHI","08","http://dx.doi.org/10.1145/1357054.1357119","Multimodal collaborative handwriting training for visually-impaired people","12 ","9","95","949","haptic i/o; human factors; signature training","10","81100596526, Beryl Plimmer, University of Auckland, Auckland, New Zealand; 81100494227, Andrew Crossan, University of Glasgow, Glasgow, United Kingdom; 81100359199, Stephen A. Brewster, University of Glasgow, Glasgow, United Kingdom; 81350585590, Rachel Blagojevic, University of Auckland, Auckland, New Zealand; "
"CHI","08","http://dx.doi.org/10.1145/1357054.1357121","ArtLinks: fostering social awareness and reflection in museums","12 ","8","75","798","design; miscellaneous; reflective design; spiritual computing","10","81100288358, Dan Cosley, Cornell University, Ithaca, NY, USA; 81351604046, Joel Lewenstein, Cornell University, Ithaca, NY, USA; 81100574194, Andrew Herman, Cornell University, Ithaca, NY, USA; 81350574327, Jenna Holloway, Cornell University, Ithaca, NY, USA; 81545068356, Jonathan Baxter, Cornell University, Ithaca, NY, USA; 81342505963, Saeko Nomura, Cornell University, Ithaca, NY, USA; 81100556191, Kirsten Boehner, Cornell University, Ithaca, NY, USA; 81367597457, Geri Gay, Cornell University, Ithaca, NY, USA; "
