"conference","year","doi","title","citationCount","download6weeks","download12months","downloadAll","keywords","pageNumber","authors"
"CHI","08","http://dx.doi.org/10.1145/1357054.1357122","K-sketch: a 'kinetic' sketch pad for novice animators","20 ","11","118","831","animation; experimentation; human factors; pen-based user interfaces","10","81416597118, Richard C. Davis, University of California, Berkeley, Berkeley, CA, USA; 81350574651, Brien Colwell, University of Washington, Seattle, WA, USA; 81100103519, James A. Landay, University of Washington, Seattle, WA, USA; "
"CHI","08","http://dx.doi.org/10.1145/1357054.1357123","The LilyPad Arduino: using computational textiles to investigate engagement, aesthetics, and diversity in computer science education","61 ","36","289","1,554","computational textiles; design; electronic textiles; general; lilypad arduino; smart textiles","10","81309510031, Leah Buechley, University of Colorado at Boulder, Boulder, CO, USA; 81322492935, Mike Eisenberg, University of Colorado at Boulder, Boulder, CO, USA; 81350583733, Jaime Catchen, University of Colorado at Boulder, Boulder, CO, USA; 81350585636, Ali Crockett, University of Colorado at Boulder, Boulder, CO, USA; "
"CHI","08","http://dx.doi.org/10.1145/1357054.1357125","A diary study of mobile information needs","82 ","30","347","2,529","diary study; miscellaneous; user requirements","10","81317500764, Timothy Sohn, University of California at San Diego, La Jolla, CA, USA; 81350578803, Kevin A. Li, University of California at San Diego, La Jolla, CA, USA; 81100428731, William G. Griswold, University of California at San Diego, La Jolla, CA, USA; 81332504463, James D. Hollan, University of California at San Diego, La Jolla, CA, USA; "
"CHI","08","http://dx.doi.org/10.1145/1357054.1357126","Tracking real-time user experience (TRUE): a comprehensive instrumentation solution for complex systems","42 ","17","171","1,545","human factors; miscellaneous; usability","10","81406599693, Jun H. Kim, Microsoft Game Studios, Redmond, WA, USA; 81350574120, Daniel V. Gunn, Microsoft Game Studios, Redmond, WA, USA; 81350586532, Eric Schuh, Microsoft Game Studios, Redmond, WA, USA; 81100520078, Bruce Phillips, Microsoft Game Studios, Redmond, WA, USA; 81100219516, Randy J. Pagulayan, Microsoft Game Studios, Redmond, WA, USA; 81100285993, Dennis Wixon, Microsoft Game Studios, Redmond, WA, USA; "
"CHI","08","http://dx.doi.org/10.1145/1357054.1357127","Crowdsourcing user studies with Mechanical Turk","235 ","172","1,250","5,207","evaluation/methodology; human factors; mechanical turk; remote user study; wikipedia","4","81350583094, Aniket Kittur, PARC, Palo Alto, CA, USA; 81100330316, Ed H. Chi, PARC, Palo Alto, CA, USA; 81100623883, Bongwon Suh, PARC, Palo Alto, CA, USA; "
"CHI","08","http://dx.doi.org/10.1145/1357054.1357129","Aligning temporal data by sentinel events: discovering patterns in electronic health records","27 ","13","170","1,321","electronic health record; human factors; search; uncertainty","10","81350582074, Taowei David Wang, University of Maryland, College Park, MD, USA; 81100041782, Catherine Plaisant, University of Maryland, College Park, MD, USA; 81350575817, Alexander J. Quinn, University of Maryland, College Park, MD, USA; 81350584359, Roman Stanchak, University of Maryland, College Park, MD, USA; 81541967756, Shawn Murphy, Massachusetts General Hospital, Boston, MA, USA; 81100146468, Ben Shneiderman, University of Maryland, College Park, MD, USA; "
"CHI","08","http://dx.doi.org/10.1145/1357054.1357130","Celebratory technology: new directions for food research in HCI","41 ","19","161","1,425","cooking; eating; human factors; smart homes","10","81100507646, Andrea Grimes, Microsoft Research, Cambridge, United Kingdom; 81452613064, Richard Harper; "
"CHI","08","http://dx.doi.org/10.1145/1357054.1357131","MAHI: investigation of social scaffolding for reflective thinking in diabetes management","58 ","8","133","988","chronic disease management; design; human factors; ubiquitous computing","10","81100538787, Lena Mamykina, Siemens Corporate Research Inc., Princeton, NJ, USA; 81100331104, Elizabeth Mynatt, Georgia Institute of Technology, Atlanta, GA, USA; 81350573589, Patricia Davidson; 81538279656, Daniel Greenblatt; "
"CHI","08","http://dx.doi.org/10.1145/1357054.1357133","Accountabilities of presence: reframing location-based systems","22 ","6","66","948","body; human factors; location; mobility; privacy; time","10","81350586371, Emily Troshynski, University of California, Irvine, Irvine, CA, USA; 81320491691, Charlotte Lee, University of California, Irvine, Irvine, CA, USA; 81100521529, Paul Dourish, University of California, Irvine, Irvine, CA, USA; "
"CHI","08","http://dx.doi.org/10.1145/1357054.1357134","From awareness to repartee: sharing location within social groups","64 ","17","165","1,782","human factors; miscellaneous; user studies","10","81331488921, Louise Barkhuus, University of California, San Diego, La Jolla, CA, USA; 81100013375, Barry Brown, University of California, San Diego, La Jolla, CA, USA; 81100405925, Marek Bell, University of Glasgow, Glasgow, United Kingdom; 81100522350, Scott Sherwood, University of Glasgow, Glasgow, United Kingdom; 81100012107, Malcolm Hall, University of Glasgow, Glasgow, United Kingdom; 81100086432, Matthew Chalmers, University of Glasgow, Glasgow, United Kingdom; "
"CHI","08","http://dx.doi.org/10.1145/1357054.1357135","Lean and zoom: proximity-aware user interface and content magnification","15 ","6","52","710","assistive technology; human factors; lean; posture; semantic zooming; user interfaces","4","81350573130, Chris Harrison, Carnegie Mellon University, Pittsburgh, PA, USA; 81100327371, Anind K. Dey, Carnegie Mellon University, Pittsburgh, PA, USA; "
"CHI","08","http://dx.doi.org/10.1145/1357054.1357136","Stirring up experience through movement in game play: effects on engagement and social behaviour","27 ","11","131","1,162","affordance; co-presence; experimentation; human factors; input devices; social behaviour","4","81100028041, Si&#226;n E. Lindley, Microsoft Research Cambridge, Cambridge, United Kingdom; 81350585311, James Le Couteur, University College London, London, United Kingdom; 81350585889, Nadia L. Berthouze, University College London, London, United Kingdom; "
"CHI","08","http://dx.doi.org/10.1145/1357054.1357138","Demonstrating the feasibility of using forearm electromyography for muscle-computer interfaces","21 ","12","109","906","channels and controllers; emg; input; interaction","10","81100324651, T Scott Saponas, University of Washington, Seattle, WA, USA; 81100255664, Desney S. Tan, Microsoft Research, Redmond, WA, USA; 81405594249, Dan Morris, Microsoft Research, Redmond, WA, USA; 81100503904, Ravin Balakrishnan, University of Toronto, Toronto, ON, Canada; "
"CHI","08","http://dx.doi.org/10.1145/1357054.1357139","Improving eye cursor's stability for eye pointing tasks","12 ","12","85","808","algorithms; eye cursor; eye pointing; input devices and strategies","10","81309486006, Xinyong Zhang, Kochi University of Technology, Kochi, Japan; 81100597892, Xiangshi Ren, Kochi University of Technology, Kochi, Japan; 81100528812, Hongbin Zha, Peking University, Beijing, China; "
"CHI","08","http://dx.doi.org/10.1145/1357054.1357140","Detecting the direction of listening with the emg signals measured behind ears","0 ","3","27","362","algorithms; ear tracking; human factors","4","81539954356, Naoto Kaneko, Nokia Research Center, Tokyo, Japan; "
"CHI","08","http://dx.doi.org/10.1145/1357054.1357141","Predicting postcompletion errors using eye movements","4 ","3","35","466","errors; eye tracking; human factors","4","81350583314, Raj M. Ratwani, George Mason University, Fairax, VA, USA; 81350583559, J. Malcolm McCurry, Naval Research Laboratory, Washington, D.C., DC, USA; 81100061774, J. Gregory Trafton, Naval Research Laboratory, Washington, D.C., DC, USA; "
"CHI","08","http://dx.doi.org/10.1145/1357054.1357143","A user study of policy creation in a flexible access-control system","12 ","2","48","621","access control; computer-supported collaborative work; distributed access control; human factors; policy creation; smartphones","10","81350570444, Lujo Bauer, Carnegie Mellon University, Pittsburgh, PA, USA; 81100472223, Lorrie Faith Cranor, Carnegie Mellon University, Pittsburgh, PA, USA; 81100651314, Robert W. Reeder, Carnegie Mellon University, Pittsburgh, PA, USA; 81387594159, Michael K. Reiter, University of North Carolina, Chapel Hill, NC, USA; 81335498861, Kami Vaniea, Carnegie Mellon University, Pittsburgh, PA, USA; "
"CHI","08","http://dx.doi.org/10.1145/1357054.1357144","Competence articulation: alignment of competences and responsibilities in synchronous telemedical collaboration","0 ","2","43","422","competence; cscw; human factors; telemedicine","10","81350597492, Simon B. Larsen, University of Aarhus, Aarhus, Denmark; 81100082111, Jakob E. Bardram, IT University of Copenhagen, Copenhagen, Denmark; "
"CHI","08","http://dx.doi.org/10.1145/1357054.1357145","Results from deploying a participation incentive mechanism within the enterprise","26 ","8","88","740","design; evaluation/methodology; human factors; reputation","10","81100481327, Rosta Farzan, University of Pittsburgh, Pittsburgh, PA, USA; 81100057928, Joan M. DiMicco, IBM, Cambridge, MA; 81100086599, David R. Millen, IBM, Cambridge, MA; 81340488769, Casey Dugan, IBM, Cambridge, MA; 81100543332, Werner Geyer, IBM, Cambridge, MA; 81540030356, Elizabeth A. Brownholtz, IBM, Cambridge, MA; "
"CHI","08","http://dx.doi.org/10.1145/1357054.1357147","Automatic whiteout++: correcting mini-QWERTY typing errors using keypress timing","6 ","3","48","556","error correction; human factors; keyboard input; mobile phones; mobile text input","10","81100469379, James Clawson, Georgia Institute of Technology, Atlanta, GA, USA; 81100493601, Kent Lyons, Intel Research, Santa Clara, CA, USA; 81350586630, Alex Rudnick, Georgia Institute of Technology, Atlanta, GA, USA; 81545165756, Robert A. Iannucci, Jr., Georgia Institute of Technology, Atlanta, GA, USA; 81100175439, Thad Starner, Georgia Institute of Technology, Atlanta, GA, USA; "
"CHI","08","http://dx.doi.org/10.1145/1357054.1357148","EdgeWrite with integrated corner sequence help","3 ","1","28","354","character chart; experimentation; human factors; performance; visualization","10","81100390275, Beno&#238;t Martin, University Paul Verlaine - Metz, Metz, France; 81100311272, Poika Isokoski, University of Tampere, Tampere, Finland; "
"CHI","08","http://dx.doi.org/10.1145/1357054.1357149","Interlaced QWERTY: accommodating ease of visual search and input flexibility in shape writing","5 ","5","67","590","human factors; interactive systems; mobile; text input","4","81408591988, Shumin Zhai, IBM Almaden Research Center, San Jose, CA, USA; 81100362804, Per Ola Kristensson, University of Cambridge, Cambridge, United Kingdom; "
"CHI","08","http://dx.doi.org/10.1145/1357054.1357151","Design, adoption, and assessment of a socio-technical environment supporting independence for persons with cognitive disabilities","13 ","6","54","701","assistive technologies for persons with disabilities; cognitive disabilities; distributed intelligence; ethnographic methods; independence; socio-technical environments","10","81100487055, Stefan Parry Carmien, Fraunhofer Institute for Applied Information Technology, Sankt Augustin, Germany; 81409592298, Gerhard Fischer, University of Colorado at Boulder, Boulder, CO, USA; "
"CHI","08","http://dx.doi.org/10.1145/1357054.1357152","Ingimp: introducing instrumentation to an end-user open source application","10 ","0","34","496","avatars; evaluation/methodology; gimp; measurement; oss","10","81100295906, Michael Terry, University of Waterloo, Waterloo, ON, Canada; 81350579902, Matthew Kay, University of Waterloo, Waterloo, ON, Canada; 81350586267, Brad Van Vugt, University of Waterloo, Waterloo, ON, Canada; 81350586314, Brandon Slack, University of Waterloo, Waterloo, ON, Canada; 81332520303, Terry Park, University of Waterloo, Waterloo, ON, Canada; "
"CHI","08","http://dx.doi.org/10.1145/1357054.1357153","Testing vs. code inspection vs. what else?: male and female end users' debugging strategies","20 ","8","84","680","debugging; end-user software engineering; human factors; strategy","10","81314486232, Neeraja Subrahmaniyan, Oregon State University, Corvallis, OR, USA; 81100022759, Laura Beckwith, Oregon State University, Corvallis, OR, USA; 81319492891, Valentina Grigoreanu, Oregon State University, Corvallis, OR, USA; 81100337865, Margaret Burnett, Oregon State University, Corvallis, OR, USA; 81100387125, Susan Wiedenbeck, Drexel University, Philadelphia, PA, USA; 81323494388, Vaishnavi Narayanan, Oregon State University, Corvallis, OR, USA; 81350586119, Karin Bucht, Oregon State University, Corvallis, OR, USA; 81342493307, Russell Drummond, Oregon State University, Corvallis, OR, USA; 81100360432, Xiaoli Fern, Oregon State University, Corvallis, OR, USA; "
"CHI","08","http://dx.doi.org/10.1145/1357054.1357155","Designs on dignity: perceptions of technology among the homeless","29 ","15","138","1,132","at-risk populations; homeless; social issues; value sensitive design","10","81367592039, Christopher A. Le Dantec, Georgia Institute of Technology, Atlanta, GA, USA; 81100595699, W. Keith Edwards, Georgia Institute of Technology, Atlanta, GA, USA; "
"CHI","08","http://dx.doi.org/10.1145/1357054.1357156","Empathy and experience in HCI","49 ","70","578","3,226","design methods; experience-centred design; miscellaneous; user experience","10","81332536218, Peter Wright, Sheffield Hallam University, Sheffield, United Kingdom; 81406600199, John McCarthy, University College Cork, Cork, Ireland; "
"CHI","08","http://dx.doi.org/10.1145/1357054.1357157","Interactional empowerment","20 ","7","65","960","affective interaction; emotional computing; social factors","10","81341491415, Kristina H&#246;&#246;k, Mobile Life center at Stockholm University, Kista, Sweden; 81100377942, Anna St&#229;hl, Swedish Institute of Computer Science, Kista, Sweden; 81100597574, Petra Sundstr&#246;m, Mobile Life center at Stockholm University, Kista, Sweden; 81350584936, Jarmo Laaksolaahti, Swedish Institute of Computer Science, Kista, Sweden; "
"CHI","08","http://dx.doi.org/10.1145/1357054.1357159","Experience sampling for building predictive user models: a comparative study","17 ","9","82","717","decision-theory; human factors; user interfaces","10","81100301388, Ashish Kapoor, Microsoft Research, Redmond, WA, USA; 81100323543, Eric Horvitz, Microsoft Research, Redmond, WA, USA; "
"CHI","08","http://dx.doi.org/10.1145/1357054.1357160","Investigating statistical machine learning as a tool for software development","13 ","1","37","555","human factors; software development; user interfaces","10","81350576909, Kayur Patel, University of Washington, Seattle, WA, USA; 81100142271, James Fogarty, University of Washington, Seattle, WA, USA; 81100103519, James A. Landay, University of Washington, Seattle, WA, USA; 81100010116, Beverly Harrison, Intel Research Seattle, Seattle, WA, USA; "
"CHI","08","http://dx.doi.org/10.1145/1357054.1357161","CiteSense: supporting sensemaking of research literature","7 ","8","42","565","design; light weight interaction","4","81316491376, Xiaolong Zhang, Pennsylvania State University, University Park, PA, USA; 81100337837, Yan Qu, University of Maryland, College Park, MD, USA; 81100126614, C. Lee Giles, Pennsylvania State University, University Park, PA, USA; 81350568008, Piyou Song, Pennsylvania State University, University Park, PA, USA; "
"CHI","08","http://dx.doi.org/10.1145/1357054.1357162","The personal project planner: planning to organize personal information","6 ","3","42","706","design; personal information management; project planning","4","81100554899, William Jones, University of Washington, Seattle, WA, USA; 81407594537, Predrag Klasnja, University of Washington, Seattle, WA, USA; 81309507374, Andrea Civan, University of Washington, Seattle, WA, USA; 81350580099, Michael L. Adcock, University of Washington, Seattle, WA, USA; "
"CHI","08","http://dx.doi.org/10.1145/1357054.1357164","CareLog: a selective archiving tool for behavior management in schools","27 ","3","63","607","capture and access; human factors; selective archiving","10","81100592620, Gillian R. Hayes, University of California, Irvine, Irvine, CA, USA; 81435603007, Lamar M. Gardere, Georgia Institute of Technology, Atlanta, GA, USA; 81100251687, Gregory D. Abowd, Georgia Institute of Technology, Atlanta, GA, USA; 81339532748, Khai N. Truong, University of Toronto, Toronto, ON, Canada; "
"CHI","08","http://dx.doi.org/10.1145/1357054.1357165","Observing presenters' use of visual aids to inform the design of classroom presentation software","11 ","2","73","725","design; human factors; multi-screen displays","10","81350574181, Joel Lanir, University of British Columbia, Vancouver, BC, Canada; 81100170154, Kellogg S. Booth, University of British Columbia, Vancouver, BC, Canada; 81100170743, Leah Findlater, University of British Columbia, Vancouver, BC, Canada; "
"CHI","08","http://dx.doi.org/10.1145/1357054.1357166","Readability of scanned books in digital libraries","7 ","5","57","725","design; document navigation; human factors; readability; user interfaces","10","81350575817, Alexander J. Quinn, University of Maryland, College Park, MD, USA; 81350567642, Chang Hu, University of Maryland, College Park, MD, USA; 81350574439, Takeshi Arisaka, Hitachi, Ltd., Kawasaki, Japan; 81100480790, Anne Rose, University of Maryland, College Park, MD, USA; 81100083927, Benjamin B. Bederson, University of Maryland, College Park, MD, USA; "
"CHI","08","http://dx.doi.org/10.1145/1357054.1357168","Choice: abidcating or exercising?","11 ","7","46","534","abdicating choice; human factors; non-instrumental needs; shuffle listening","10","81309491918, Tuck Leong, The University of Melbourne, Melbourne, Australia; 81100328802, Steve Howard, The University of Melbourne, Melbourne, Australia; 81100490463, Frank Vetere, The University of Melbourne, Melbourne, Australia; "
"CHI","08","http://dx.doi.org/10.1145/1357054.1357169","MySong: automatic accompaniment generation for vocal melodies","17 ","6","62","584","hidden markov models; methodologies and techniques; music; systems","10","81387596086, Ian Simon, University of Washington, Seattle, WA, USA; 81405594249, Dan Morris, Microsoft Research, Redmond, WA, USA; 81100645745, Sumit Basu, Microsoft Research, Redmond, WA, USA; "
"CHI","08","http://dx.doi.org/10.1145/1357054.1357170","PlaceAndPlay: a digital tool for children to create and record music","1 ","2","34","432","audio input/output; design; multi-modal interfaces","4","81365592406, Yasushi Akiyama, Dalhousie University, Halifax, NS, Canada; 81100345503, Sageev Oore, Saint Mary's University, Halifax NS Canada; "
"CHI","08","http://dx.doi.org/10.1145/1357054.1357171","The sound of touch: physical manipulation of digital sound","2 ","4","46","673","auditory feedback; digital convolution; input devices and strategies; materials; sensing; sound design; tangible user interface","4","81328489350, David Merrill, Massachusetts Institute of Technology, Cambridge, MA, USA; 81100381813, Hayes Raffle, Massachusetts Institute of Technology, Cambridge, MA, USA; 81100488115, Roberto Aimi; "
"CHI","08","http://dx.doi.org/10.1145/1357054.1357173","Asynchronous remote medical consultation for Ghana","16 ","4","58","668","developing regions; human factors; organizational interfaces; telemedicine","10","81350568454, Rowena Luk, Intel Research, Berkeley, CA, USA; 81100316952, Melissa Ho, University of California, Berkeley, Berkeley, CA, USA; 81100590142, Paul M. Aoki, Intel Research, Berkeley, CA, USA; "
"CHI","08","http://dx.doi.org/10.1145/1357054.1357174","E-imci: improving pediatric health care in low-income countries","27 ","12","103","653","automation; experimentation; miscellaneous; tanzania","10","81316488426, Brian DeRenzi, University of Washington, Seattle, WA, USA; 81100469781, Neal Lesh, University of California, Berkeley, Berkeley , CA, USA; 81100298867, Tapan Parikh, Ifakara Health Research & Development Centre, Dar es Salaam, Tanzania; 81350579853, Clayton Sims, Ifakara Health Research & Development Centre, Dar es Salaam, Tanzania; 81350586994, Werner Maokla, Ifakara Health Research & Development Centre, Dar es Salaam, Tanzania; 81350585637, Mwajuma Chemba, Ifakara Health Research & Development Centre, Dar es Salaam, Tanzania; 81350583343, Yuna Hamisi, D-tree International \ Harvard University, Boston, MA, USA; 81350585535, David S hellenberg, University of Washington, Seattle, WA, USA; 81407593846, Marc Mitchell; 81100123081, Gaetano Borriello; "
"CHI","08","http://dx.doi.org/10.1145/1357054.1357175","Participant and interviewer attitudes toward handheld computers in the context of HIV/AIDS programs in sub-Saharan Africa","3 ","0","37","472","design; experimentation; hiv/aids; paper surveys; social issues; user study","4","81350575188, Karen G. Cheng, Charles R. Drew University of Medicine and Science, Los Angeles, CA, USA; 81350587414, Francisco Ernesto, University of Toronto, Toronto, ON, Canada; 81339532748, Khai N. Truong; "
"CHI","08","http://dx.doi.org/10.1145/1357054.1357177","It's on my other computer!: computing with multiple devices","36 ","24","196","1,647","cross device interaction; miscellaneous; personal computing; user study","10","81100428285, David Dearman, University of Toronto, Toronto, ON, Canada; 81100303065, Jeffery S. Pierce, IBM Research, San Jose, CA, USA; "
"CHI","08","http://dx.doi.org/10.1145/1357054.1357178","Targeting across displayless space","7 ","5","69","738","displayless space; halo; input devices and strategies; multi-display environments; off-screen feedback","10","81100377766, Miguel A. Nacenta, University of Saskatchewan, Saskatoon, SK, Canada; 81100231855, Regan L. Mandryk, University of Saskatchewan, Saskatoon, SK, Canada; 81100275704, Carl Gutwin, University of Saskatchewan, Saskatoon, SK, Canada; "
"CHI","08","http://dx.doi.org/10.1145/1357054.1357179","Wedge: clutter-free visualization of off-screen locations","38 ","13","168","1,274","design; human factors; off-screen; small screens; visualization","10","81350569912, Sean Gustafson, University of Manitoba, Winnipeg, MAN, Canada; 81100137268, Patrick Baudisch, Microsoft Research, Redmond, WA, USA; 81100275704, Carl Gutwin, University of Saskatchewan, Saskatoon, SK, Canada; 81100459517, Pourang Irani, University of Manitoba, Winnipeg, MAN, Canada; "
"CHI","08","http://dx.doi.org/10.1145/1357054.1357181","Assessing attractiveness in online dating profiles","9 ","57","343","1,727","asynchronous interaction; computer-mediated communication; online dating; relationships","10","81100191981, Andrew T. Fiore, University of California, Berkeley, Berkeley, CA, USA; 81350579071, Lindsay Shaw Taylor, University of California, Berkeley, Berkeley, CA, USA; 81100312493, G.A. Mendelsohn, University of California, Berkeley, Berkeley, CA, USA; 81100612246, Marti Hearst, University of California, Berkeley, Berkeley, CA, USA; "
"CHI","08","http://dx.doi.org/10.1145/1357054.1357182","Keeping in touch by technology: maintaining friendships after a residential move","5 ","19","99","757","cmc; computer conferencing, teleconferencing, and videoconferencing; friendship; mobility","10","81100288406, Irina Shklovski, University of California Irvine, Irvine, CA, USA; 81328489038, Robert Kraut, Carnegie Mellon University, Pittsburgh, PA, USA; 81100088002, Jonathon Cummings, Duke University, Durham, NC, USA; "
"CHI","08","http://dx.doi.org/10.1145/1357054.1357183","Friends and foes: ideological social networking","15 ","13","83","911","asynchronous interaction; essembly; online communities; sociology","4","81309505971, Michael J. Brzozowski, Hewlett Packard Laboratories, Palo Alto, CA, USA; 81100540905, Tad Hogg, Hewlett Packard Laboratories, Palo Alto, CA, USA; 81350575425, Gabor Szabo, Hewlett Packard Laboratories, Palo Alto, CA, USA; "
"CHI","08","http://dx.doi.org/10.1145/1357054.1357184","Life scheduling to support multiple social roles","7 ","2","38","438","calendars; groupware; social roles","4","81100507646, Andrea Grimes, Georgia Institute of Technology, Atlanta, GA, USA; 81332491415, A.J. Brush, Microsoft Research, Redmond, WA, USA; "
"CHI","08","http://dx.doi.org/10.1145/1357054.1357186","Collaborating to remember: a distributed cognition account of families coping with memory impairments","7 ","5","75","731","amnesia; assistive technology; design; distributed cognition; family; theory","10","81100657783, Mike Wu, The University of Toronto, Toronto, ON, Canada; 81100651315, Jeremy Birnholtz, Cornell University, Ithaca, NY, USA; 81543129856, Brian Richards, The University of Toronto, Toronto, ON, Canada; 81100448368, Ronald Baecker, The University of Toronto, Toronto, ON, Canada; 81100219924, Mike Massimi; "
"CHI","08","http://dx.doi.org/10.1145/1357054.1357187","Feasibility and pragmatics of classifying working memory load with an electroencephalograph","21 ","8","76","662","brain-computer interface; classification; electroencephalography; human factors; memory load","10","81310502982, David Grimes, University of Washington, Seattle, WA, USA; 81100255664, Desney S. Tan, Microsoft Research, Redmond, WA, USA; 81328488846, Scott E. Hudson, Carnegie Mellon University, Pittsburgh, PA, USA; 81337493710, Pradeep Shenoy, University of Washington, Seattle, WA, USA; 81100591880, Rajesh P.N. Rao, University of Washington, Seattle, WA, USA; "
