"conference","year","doi","title","citationCount","download6weeks","download12months","downloadAll","keywords","pageNumber","authors"
"CHI","01","http://dx.doi.org/10.1145/365024.365124","The dynamics of mass online marketplaces: a case study of an online auction","6 ","3","48","1,847","design; electronic marketplaces; information overload; management; market technostructure; measurement; performance; user interfaces","8","81100617612, Jungpil Hahn, Information and Decision Sciences, University of Minnesota, Minneapolis, MN; "
"CHI","01","http://dx.doi.org/10.1145/365024.365126","Digital family portraits: supporting peace of mind for extended family members","178 ","14","207","2,355","aging; awareness; home; light-weight interaction; performance; ubiquitous computing; visualization","8","81100331104, Elizabeth D. Mynatt, Everyday Computing Lab, Graphics, Visualization and Usability Center, Georgia Institute of Technology, Atlanta, GA; 81100302436, Jim Rowan, Everyday Computing Lab, Graphics, Visualization and Usability Center, Georgia Institute of Technology, Atlanta, GA; 81100526497, Sarah Craighill, Everyday Computing Lab, Graphics, Visualization and Usability Center, Georgia Institute of Technology, Atlanta, GA; 81100068716, Annie Jacobs, Everyday Computing Lab, Graphics, Visualization and Usability Center, Georgia Institute of Technology, Atlanta, GA; "
"CHI","01","http://dx.doi.org/10.1145/365024.365130","Social navigation of food recipes","26 ","8","68","1,693","awareness; electronic commerce; management; performance; privacy; security; theory; web-based services","8","81100551494, Martin Svensson, HUMLE, SICS, Box 1263, S-164 29 Kista, Sweden; 81341491415, Kristina H&#246;&#246;k, HUMLE, SICS, Box 1263, S-164 29 Kista, Sweden; 81100629235, Jarmo Laaksolahti, HUMLE, SICS, Box 1263, S-164 29 Kista, Sweden; 81100020339, Annika Waern, HUMLE, SICS, Box 1263, S-164 29 Kista, Sweden; "
"CHI","01","http://dx.doi.org/10.1145/365024.365298","Chinese input with keyboard and eye-tracking: an anatomical study","25 ","10","69","1,152","chinese text input; documentation; evaluation/methodology; eye-tracking; gaze-tracking; human factors; interaction styles; languages; measurement; natural language; performance modeling; theory","8","81100233343, Jingtao Wang, IBM China Research Lab, No. 7, 5th Street, Shangdi, Beijing, 100085, P. R. China; 81408591988, Shumin Zhai, IBM Almaden Research Center, 650 Harry Road, San Jose, CA; 81339530542, Hui Su, IBM China Research Lab, No. 7, 5th Street, Shangdi, Beijing, 100085, P. R. China; "
"CHI","01","http://dx.doi.org/10.1145/365024.365299","Model for unistroke writing time","13 ","6","20","573","design; handwriting; input devices and strategies; measurement; pen input; theory","8","81100311272, Poika Isokoski, Computer-Human Interaction Group, Dept. of Computer and Information Sciences, FIN-33014 University of Tampere, Finland; "
"CHI","01","http://dx.doi.org/10.1145/365024.365300","Text input for mobile devices: comparing model prediction to actual performance","64 ","15","164","3,153","design; human factors; keypad input; measurement; mobile systems; performance modeling; reliability; theory","7","81100415127, Christina L. James; 81332522999, Kelly M. Reischel; "
"CHI","01","http://dx.doi.org/10.1145/365024.365301","Better home shopping or new democracy?: evaluating community network outcomes","13 ","4","34","1,204","assistive technologies for persons with disabilities; community networks; design; evaluation/methodology; human factors; measurement; performance evaluation; sociology; web-based services","8","81350576124, John M. Carroll, Center for Human-Computer Interaction and Department of Computer Science, Virginia Tech, Blacksburg, VA; 81335496622, Mary Beth Rosson, Center for Human-Computer Interaction and Department of Computer Science, Virginia Tech, Blacksburg, VA; "
"CHI","01","http://dx.doi.org/10.1145/365024.365302","Identity construction environments: supporting a virtual therapeutic community of pediatric patients undergoing dialysis","15 ","2","34","740","artificial, augmented, and virtual realities; dialysis; human factors; management; medicine and science; pediatric patients; storytelling; therapy; virtual reality","8","81100457566, Marina U. Bers, MIT Media Laboratory, Cambridge, MA; 81100139403, Joseph Gonzalez-Heydrich, Children's Hospital, Boston, MA; 81100152567, David Ray DeMaso, Children's Hospital, Boston, MA; "
"CHI","01","http://dx.doi.org/10.1145/365024.365303","GeneyTM: designing a collaborative activity for the palmTM handheld computer","43 ","1","39","1,241","children; cscl; design; genetics; handheld computing; management; performance; theory; user-centered design","8","81538105656, Arman Danesh, School of Computing Science, Simon Fraser University; 81100519232, Kori Inkpen, School of Computing Science, Simon Fraser University; 81538470456, Felix Lau, School of Computing Science, Simon Fraser University; 81100206506, Keith Shu, School of Computing Science, Simon Fraser University; 81100170154, Kellogg Booth, Department of Computer Science, University of British Columbia; "
"CHI","01","http://dx.doi.org/10.1145/365024.365304","Relational agents: a model and implementation of building user trust","63 ","17","89","1,628","design; human factors; management; natural language; natural language interfaces; personality; social interface; trust","8","81100360895, Timothy Bickmore, MIT Media Lab, 20 Ames St., E15-320, Cambridge, MA; 81100435029, Justine Cassell, MIT Media Lab, 20 Ames St., E15-320, Cambridge, MA; "
"CHI","01","http://dx.doi.org/10.1145/365024.365305","An empirical study of human Web assistants: implications for user support in Web information systems","13 ","3","32","1,002","attitude; design guidelines; field study; management; performance; training, help, and documentation; user support; web-based interaction","8","81100216445, Johan Aberg; 81100181796, Nahid Shahmehri; "
"CHI","01","http://dx.doi.org/10.1145/365024.365306","Social presence in Web surveys","1 ","3","31","1,080","design; human factors; measurement; social desirability; theory; web-based interaction","6","81100333345, Mick P. Couper, University of Michigan, P.O. Box 1248, Ann Arbor, MI; 81100538591, Roger Tourangeau, University of Michigan, P.O. Box 1248, Ann Arbor, MI; 81100632144, Darby M. Steiger; "
"CHI","01","http://dx.doi.org/10.1145/365024.365307","Exploring 3D navigation: combining speed-coupled flying with orbiting","63 ","27","157","1,647","3d virtual environments; design; experimentation; interaction styles; management; performance; user studies","8","81100255664, Desney S. Tan, Carnegie Mellon University School of Computer Science, 5000 Forbes Ave., Pittsburgh, PA and Microsoft Research, One Microsoft Way, Redmond, WA; 81452612822, George G. Robertson, Microsoft Research, One Microsoft Way, Redmond, WA; 81100280834, Mary Czerwinski, Microsoft Research, One Microsoft Way, Redmond, WA; "
"CHI","01","http://dx.doi.org/10.1145/365024.365308","Reaching movements to augmented and graphic objects in virtual environments","11 ","2","40","728","artificial, augmented, and virtual realities; design; evaluation/methodology; fitts' law; haptic i/o; human performance; kinematic data; measurement; performance; sensory manipulation; virtual reality","8","81100341017, Andrea H. Mason, School of Kinesiology, Simon Fraser University, Burnaby, B.C. V5A 1S6, Canada; 81100480460, Masuma A. Walji, School of Kinesiology, Simon Fraser University, Burnaby, B.C. V5A 1S6, Canada; 81100385764, Elaine J. Lee, School of Kinesiology, Simon Fraser University, Burnaby, B.C. V5A 1S6, Canada; 81100367227, Christine L. MacKenzie, School of Kinesiology, Simon Fraser University, Burnaby, B.C. V5A 1S6, Canada; "
"CHI","01","http://dx.doi.org/10.1145/365024.365309","3D or not 3D?: evaluating the effect of the third dimension in a document management system","34 ","11","94","1,753","3d user interfaces; design; documentation; general; information visualisation; measurement; spatial memory; three-dimensional graphics and realism","8","81100607754, Andy Cockburn, Department of Computer Science, University of Canterbury, Christchurch, New Zealand; 81100017816, Bruce McKenzie, Department of Computer Science, University of Canterbury, Christchurch, New Zealand; "
"CHI","01","http://dx.doi.org/10.1145/365024.365310","Automating camera management for lecture room environments","16 ","2","36","1,342","audio input/output; design; management; performance; speaker tracking; tracking; video production rules","8","81100525820, Qiong Liu, Collaboration and Multimedia Systems Group, Microsoft Research, One Microsoft Way, Redmond, WA; 81100018204, Yong Rui, Collaboration and Multimedia Systems Group, Microsoft Research, One Microsoft Way, Redmond, WA; 81452611908, Anoop Gupta, Collaboration and Multimedia Systems Group, Microsoft Research, One Microsoft Way, Redmond, WA; 81100025873, J. J. Cadiz, Collaboration and Multimedia Systems Group, Microsoft Research, One Microsoft Way, Redmond, WA; "
"CHI","01","http://dx.doi.org/10.1145/365024.365311","Viewing meeting captured by an omni-directional camera","17 ","2","27","624","computer conferencing, teleconferencing, and videoconferencing; human factors; measurement; omni-directional camera systems; performance; user/machine systems","8","81100018204, Yong Rui, Collaboration and Multimedia Systems Group, Microsoft Research, One Microsoft Way, Redmond, WA; 81452611908, Anoop Gupta, Collaboration and Multimedia Systems Group, Microsoft Research, One Microsoft Way, Redmond, WA; 81100025873, J. J. Cadiz, Collaboration and Multimedia Systems Group, Microsoft Research, One Microsoft Way, Redmond, WA; "
"CHI","01","http://dx.doi.org/10.1145/365024.365312","Partitioning digital worlds: focal and peripheral awareness in multiple monitor use","118 ","25","141","1,625","awareness; displays; management; multiple monitors; theory; user/machine systems","8","81100031531, Jonathan Grudin, Microsoft Research, One Microsoft Way, Redmond, WA; "
"CHI","01","http://dx.doi.org/10.1145/365024.365316","Folk computing: revisiting oral tradition as a scaffold for co-present communities","5 ","2","16","522","community; education; folklore; group and organization interfaces; handheld; management; pda; social computing; ubiquitous computing","8","81100002852, Rick Borovoy, MIT Media Lab, 20 Ames Street, Room E15-120B, Cambridge, MA; 81100001812, Brian Silverman, MIT Media Lab, 20 Ames Street, Room E15-120B, Cambridge, MA; 81100371481, Tim Gorton, MIT Media Lab, 20 Ames Street, Room E15-120B, Cambridge, MA; 81100510429, Matt Notowidigdo, MIT Media Lab, 20 Ames Street, Room E15-120B, Cambridge, MA; 81100013114, Brian Knep, MIT Media Lab, 20 Ames Street, Room E15-120B, Cambridge, MA; 81331502299, Mitchel Resnick, MIT Media Lab, 20 Ames Street, Room E15-120B, Cambridge, MA; 81332509115, Jeff Klann, MIT Media Lab, 20 Ames Street, Room E15-120B, Cambridge, MA; "
"CHI","01","http://dx.doi.org/10.1145/365024.365317","Designing palaver tree online: supporting social roles in a community of oral history","16 ","0","38","685","children; design; management; performance; user-centered design; user/machine systems","8","81332497475, Jason B. Ellis, College of Computing, Georgia Institute of Technology, Atlanta, GA; 81100562702, Amy S. Bruckman, College of Computing, Georgia Institute of Technology, Atlanta, GA; "
"CHI","01","http://dx.doi.org/10.1145/365024.365322","Classroom collaboration in the design of tangible interfaces for storytelling","59 ","10","101","1,932","children; general; management; performance; tangibles; user-centered design","8","81100250935, Danae Stanton, Mixed Reality Laboratory, University of Nottingham, Nottingham, UK; 81100371655, Victor Bayon, Mixed Reality Laboratory, University of Nottingham, Nottingham, UK; 81100165082, Helen Neale, Mixed Reality Laboratory, University of Nottingham, Nottingham, UK; 81100403313, Ahmed Ghali, Mixed Reality Laboratory, University of Nottingham, Nottingham, UK; 81100619971, Steve Benford, Mixed Reality Laboratory, University of Nottingham, Nottingham, UK; 81100349341, Sue Cobb, Mixed Reality Laboratory, University of Nottingham, Nottingham, UK; 81100067150, Rob Ingram, Mixed Reality Laboratory, University of Nottingham, Nottingham, UK; 81409593242, Claire O'Malley, Mixed Reality Laboratory, University of Nottingham, Nottingham, UK; 81100533516, John Wilson, Mixed Reality Laboratory, University of Nottingham, Nottingham, UK; 81100377785, Tony Pridmore, Mixed Reality Laboratory, University of Nottingham, Nottingham, UK; "
"CHI","01","http://dx.doi.org/10.1145/365024.365325","Using information scent to model user information needs and actions and the Web","103 ","17","160","2,932","algorithms; data mining; human factors; information retrieval; management; performance; theory; web-based interaction; world wide web","8","81100330316, Ed H. Chi, Xerox Palo Alto Research Center, 3333 Coyote Hill Road, Palo Alto, CA; 81100252735, Peter Pirolli, Xerox Palo Alto Research Center, 3333 Coyote Hill Road, Palo Alto, CA; 81100107326, Kim Chen, Xerox Palo Alto Research Center, 3333 Coyote Hill Road, Palo Alto, CA; 81100299516, James Pitkow, Xerox Palo Alto Research Center, 3333 Coyote Hill Road, Palo Alto, CA; "
"CHI","01","http://dx.doi.org/10.1145/365024.365331","Information scent as a driver of Web behavior graphs: results of a protocol analysis method for Web usability","42 ","14","93","1,851","design; information foraging; management; performance; standardization; theory; web usability; web-eyemapper","8","81406592524, Stuart K. Card, Xerox Palo Alto Research Center, 3333 Coyote Hill Road, Palo Alto, California; 81100252735, Peter Pirolli, Xerox Palo Alto Research Center, 3333 Coyote Hill Road, Palo Alto, California; 81100269681, Mija Van Der Wege, Xerox Palo Alto Research Center, 3333 Coyote Hill Road, Palo Alto, California; 81100423179, Julie B. Morrison, Xerox Palo Alto Research Center, 3333 Coyote Hill Road, Palo Alto, California; 81100651314, Robert W. Reeder, Xerox Palo Alto Research Center, 3333 Coyote Hill Road, Palo Alto, California; 81100097460, Pamela K. Schraedley, Xerox Palo Alto Research Center, 3333 Coyote Hill Road, Palo Alto, California; 81100595029, Jenea Boshart, Xerox Palo Alto Research Center, 3333 Coyote Hill Road, Palo Alto, California; "
"CHI","01","http://dx.doi.org/10.1145/365024.365337","Visual information foraging in a focus + context visualization","46 ","44","115","1,817","code theory of visual attention; focus+context; hyperbolic tree; information scent; interaction styles; measurement; search process; visual attention","8","81100252735, Peter Pirolli, Xerox PARC, 3333 Coyote Hill Road, Palo Alto, CA; 81406592524, Stuart K. Card, Xerox PARC, 3333 Coyote Hill Road, Palo Alto, CA; 81100269681, Mija M. Van Der Wege, Xerox PARC, 3333 Coyote Hill Road, Palo Alto, CA; "
"CHI","01","http://dx.doi.org/10.1145/365024.365339","The notification collage: posting information to public and personal displays","110 ","7","148","2,133","awareness; group and organization interfaces; human factors; management; messaging; theory","8","81100197069, Saul Greenberg, Department of Computer Science, University of Calgary, Calgary, Alberta, Canada T2N 1N4; 81100065366, Michael Rounding, Department of Computer Science, University of Calgary, Calgary, Alberta, Canada T2N 1N4; "
"CHI","01","http://dx.doi.org/10.1145/365024.365349","Single display privacyware: augmenting public displays with private information","37 ","11","98","1,135","awareness; cscw; groupware; management; performance; privacy; single display groupware; theory","8","81100596912, Garth B. D. Shoemaker, EDGE Lab, School of Computing Science, Simon Fraser University, Burnaby, Canada; 81100519232, Kori M. Inkpen, EDGE Lab, School of Computing Science, Simon Fraser University, Burnaby, Canada; "
"CHI","01","http://dx.doi.org/10.1145/365024.365352","Linking public spaces: technical and social issues","34 ","4","61","1,261","computer conferencing, teleconferencing, and videoconferencing; human factors; management; privacy; security; videoconferencing","8","81100269038, Gavin Jancke, Microsoft Research, One Microsoft Way, Redmond, WA; 81100190815, Gina Danielle Venolia, Microsoft Research, One Microsoft Way, Redmond, WA; 81100031531, Jonathan Grudin, Microsoft Research, One Microsoft Way, Redmond, WA; 81100025873, J. J. Cadiz, Microsoft Research, One Microsoft Way, Redmond, WA; 81452611908, Anoop Gupta, Microsoft Research, One Microsoft Way, Redmond, WA; "
"CHI","01","http://dx.doi.org/10.1145/365024.383749","Casablanca: designing social communication devices for the home","103 ","7","84","2,258","design; social issues","8","81100031847, Debby Hindus, Interval Research Corp.; 81100420884, Scott D. Mainwaring, Interval Research Corp.; 81100382213, Nicole Leduc, Interval Research Corp.; 81100589811, Anna Elizabeth Hagstr&#246;m, Interval Research Corp.; 81100076840, Oliver Bayley, Interval Research Corp.; "
