"conference","year","doi","title","citationCount","download6weeks","download12months","downloadAll","keywords","pageNumber","authors"
"CHI","08","http://dx.doi.org/10.1145/1357054.1357188","Human-aided computing: utilizing implicit human processing to classify images","10 ","3","51","672","brain-computer interface; human cognition; image classification; input devices and strategies; visual attention","10","81337493710, Pradeep Shenoy, University of Washington, Seattle, WA, USA; 81100255664, Desney S. Tan, Microsoft Resear h, Redmond, WA, USA; "
"CHI","08","http://dx.doi.org/10.1145/1357054.1357190","Framing the user experience: information biases on website quality judgement","9 ","22","151","1,499","design; human factors; quality models; theory and methods","10","81328488619, Jan Hartmann, University of Manchester, Manchester, United Kingdom; 81100647415, Antonella De Angeli, University of Manchester, Manchester, United Kingdom; 81100269401, Alistair Sutcliffe, University of Manchester, Manchester, United Kingdom; "
"CHI","08","http://dx.doi.org/10.1145/1357054.1357191","Predictors of answer quality in online Q&amp;A sites","63 ","26","236","1,756","design; experimentation; human factors; information quality; online community; web-based interaction","10","81320490116, F. Maxwell Harper, University of Minnesota, Minneapolis, MN, USA; 81310487460, Daphne Raban, University of Haifa, Haifa, Israel; 81100505446, Sheizaf Rafaeli, University of Haifa, Haifa, Israel; 81100049091, Joseph A. Konstan, University of Minnesota, Minneapolis, MN, USA; "
"CHI","08","http://dx.doi.org/10.1145/1357054.1357192","AutoCardSorter: designing the information architecture of a web site using latent semantic analysis","4 ","5","64","571","algorithms; automated tools; clustering algorithms; evaluation/methodology; information architecture; navigation; user issues","4","81385601450, Christos Katsanos, University of Patras, Rio, Greece; 81100045246, Nikolaos Tselios, University of Patras, Rio, Greece; 81100274753, Nikolaos Avouris, University of Patras, Rio, Greece; "
"CHI","08","http://dx.doi.org/10.1145/1357054.1357193","Designing for bystanders: reflections on building a public digital forum","12 ","2","48","512","bystanders; human factors; large displays; mobile computing","4","81100640680, Anthony Tang, University of British Columbia, Vancouver, Canada; 81316488225, Mattias Finke, University of British Columbia, Vancouver, Canada; 81331489198, Michael Blackstock, University of British Columbia, Vancouver, Canada; 81350574362, Rock Leung, University of British Columbia, Vancouver, Canada; 81309501892, Meghan Deutscher, University of British Columbia, Vancouver, Canada; 81100271687, Rodger Lea, University of British Columbia, Vancouver, Canada; "
"CHI","08","http://dx.doi.org/10.1145/1357054.1357195","Electronic voting machines versus traditional methods: improved preference, similar performance","5 ","27","314","1,275","dre; graphical user interfaces; preference; usability","10","81100122064, Sarah P. Everett, Rice University, Houston, TX, USA; 81342495997, Kristen K. Greene, Rice University, Houston, TX, USA; 81341488770, Michael D. Byrne, Rice University, Houston, TX, USA; 81100639714, Dan S. Wallach, Rice University, Houston, TX, USA; 81350573148, Kyle Derr, Rice University, Houston, TX, USA; 81384610263, Daniel Sandler, Rice University, Houston, TX, USA; 81350586356, Ted Torous, Rice University, Houston, TX, USA; "
"CHI","08","http://dx.doi.org/10.1145/1357054.1357196","Introducing item response theory for measuring usability inspection processes","7 ","8","158","873","evaluation/methodology; human factors; latent trait model; quality process","10","81100471216, Martin Schmettow, University Passau, Passau, Germany; 81350585368, Wolfgang Vietze, University Passau, Passau, Germany; "
"CHI","08","http://dx.doi.org/10.1145/1357054.1357197","Making use of business goals in usability evaluation: an experiment with novice evaluators","3 ","9","154","1,588","business goals; evaluation/methodology; human factors; usability evaluation; user interfaces","10","81100047223, Kasper Hornb&#230;k, University of Copenhagen, DK-2100 Copenhagen, Denmark; 81100265136, Erik Fr&#248;kj&#230;r, University of Copenhagen, DK-2100 Copenhagen, Denmark; "
"CHI","08","http://dx.doi.org/10.1145/1357054.1357199","Evaluating visual cues for window switching on large screens","8 ","1","41","717","attention; graphical user interfaces; large displays; window switching","10","81350572145, Raphael Hoffmann, University of Washington, Seattle, USA; 81100137268, Patrick Baudisch, Microsoft Research, Seattle, USA; 81100087768, Daniel S. Weld, University of Washington, Seattle, USA; "
"CHI","08","http://dx.doi.org/10.1145/1357054.1357200","Impromptu: a new interaction framework for supporting collaboration in multiple display environments and its field evaluation for co-located software development","27 ","5","114","1,269","collaborative computing; experimentation; group software development; human factors","10","81100607745, Jacob T. Biehl, University of Illinois, Urbana, IL, USA; 81350573453, William T. Baker, University of Illinois, Urbana, IL, USA; 81100615948, Brian P. Bailey, University of Illinois, Urbana, IL, USA; 81100255664, Desney S. Tan, Microsoft Research, Redmond, WA, USA; 81100519232, Kori M. Inkpen, Microsoft Research, Redmond, WA, USA; 81100280834, Mary Czerwinski, Microsoft Research, Redmond, WA, USA; "
"CHI","08","http://dx.doi.org/10.1145/1357054.1357201","Ninja cursors: using multiple cursors to assist target acquisition on large screens","24 ","11","68","976","fitts' law; human factors; multiple cursors","10","81338489739, Masatomo Kobayashi, The University of Tokyo, Tokyo, Japan; 81100444444, Takeo Igarashi, The University of Tokyo, Tokyo, Japan; "
"CHI","08","http://dx.doi.org/10.1145/1357054.1357203","Generalized selection via interactive query relaxation","9 ","5","52","555","annotation; graphical user interfaces; information visualization; pointing; reference","10","81100465553, Jeffrey Heer, University of California, Berkeley, Berkeley, CA, USA; 81100346089, Maneesh Agrawala, University of California, Berkeley, Berkeley, CA, USA; 81350572817, Wesley Willett, University of California, Berkeley, Berkeley, CA, USA; "
"CHI","08","http://dx.doi.org/10.1145/1357054.1357204","Implicit user-adaptive system engagement in speech and pen interfaces","6 ","0","37","589","educational interface; human factors; input devices and strategies; natural language; speech amplitude; theory and methods; user-centered design","10","81100656112, Sharon Oviatt, Adapx, Seattle, WA, USA; 81100548789, Colin Swindells; 81318497716, Alex Arthur; "
"CHI","08","http://dx.doi.org/10.1145/1357054.1357205","Mixed-initiative dialog management for speech-based interaction with graphical user interfaces","1 ","0","46","531","algorithms; command-and-control; speech-controlled gui","10","81350583836, Andreas L&#246;hr, Technische Universit&#228;t M&#252;nchen, Munich, Germany; 81322489999, Bernd Br&#252;gge; "
"CHI","08","http://dx.doi.org/10.1145/1357054.1357207","Augmented information assimilation: social and algorithmic web aids for the information long tail","6 ","1","33","742","augmented information assimilation; information diet; long tail; sensemaking; social web; theory and models; web-based interaction","10","81350572289, Brynn Evans, University of California, San Diego, San Diego, CA, USA; 81406592524, Stuart Card, Palo Alto Resear h Center, Palo Alto, CA, USA; "
"CHI","08","http://dx.doi.org/10.1145/1357054.1357208","What to do when search fails: finding information by association","16 ","2","46","841","associative information retrieval; experimentation; information search and retrieval; interaction techniques; personal information management","10","81311482767, Duen Horng Chau, Carnegie Mellon University, Pittsburgh, PA, USA; 81100013136, Brad Myers, Carnegie Mellon University, Pittsburgh, PA, USA; 81100067252, Andrew Faulring, Carnegie Mellon University, Pittsburgh, PA, USA; "
"CHI","08","http://dx.doi.org/10.1145/1357054.1357209","Conversation pivots and double pivots","2 ","1","22","291","conversation; drupal; online discussion; pivot; user interfaces","4","81416599670, Daniel Xiaodan Zhou, University of Michigan, Ann Arbor, MI, USA; 81350579380, Nathan Oostendorp, University of Michigan, Ann Arbor, MI, USA; 81100319674, Michael Hess, University of Michigan, Ann Arbor, MI, USA; 81350585817, Paul Resni k, University of Michigan, Ann Arbor, MI, USA; "
"CHI","08","http://dx.doi.org/10.1145/1357054.1357210","Query suggestions for mobile search: understanding usage patterns","11 ","6","52","661","graphical user interfaces; mobile search; text entry","4","81311484362, Maryam Kamvar, GoogleInc./Columbia University, Mountain View, CA, USA; 81408603160, Shumeet Baluja, Google Inc., Mountain View, CA, USA; "
"CHI","08","http://dx.doi.org/10.1145/1357054.1357212","Harvesting with SONAR: the value of aggregating social network information","34 ","16","103","1,295","aggregation; computer-supported cooperative work; human factors; sna; social networks","10","81321492044, Ido Guy, IBM Haifa Research Lab, Haifa, Israel; 81100095688, Michal Jacovi, IBM Haifa Research Lab, Haifa, Israel; 81342510891, Elad Shahar, IBM Haifa Research Lab, Haifa, Israel; 81350575680, Noga Meshulam, IBM Haifa Research Lab, Haifa, Israel; 81100504047, Vladimir Soroka, IBM Haifa Research Lab, Haifa, Israel; 81538442856, Stephen Farrell, IBM Almaden Research Center, San Jose, CA, USA; "
"CHI","08","http://dx.doi.org/10.1145/1357054.1357213","Looking at, looking up or keeping up with people?: motives and use of facebook","124 ","396","2,844","18,470","communication; human factors; motivation; uses and gratifications","10","81100339752, Adam N. Joinson, University of Bath, Bath, United Kingdom; "
"CHI","08","http://dx.doi.org/10.1145/1357054.1357214","Lifting the veil: improving accountability and social transparency in Wikipedia with wikidashboard","39 ","11","75","830","accountability; collaborative computing; computer-supported cooperative work; human factors; trust; web-based interaction; wiki; wikipedia","4","81100623883, Bongwon Suh, Palo Alto Research Center, Palo Alto, CA, USA; 81100330316, Ed H. Chi, Palo Alto Research Center, Palo Alto, CA, USA; 81350583094, Aniket Kittur, Palo Alto Research Center, Palo Alto, CA, USA; 81328489834, Bryan A. Pendleton, Palo Alto Research Center, Palo Alto, CA, USA; "
"CHI","08","http://dx.doi.org/10.1145/1357054.1357215","Social tagging roles: publishers, evangelists, leaders","20 ","15","74","1,094","audience; group and organization interfaces; social roles; tagging","4","81100334243, Jennifer Thom-Santelli, Cornell University, Ithaca, NY, USA; 81332517372, Michael J. Muller, IBM T.J. Watson Research, Cambridge, USA; 81100086599, David R. Millen, IBM T.J. Watson Research, Cambridge, USA; "
"CHI","08","http://dx.doi.org/10.1145/1357054.1357217","Sesame: informing user security decisions with system visualization","11 ","4","118","811","design; security interface design; system visualization","10","81331504513, Jennifer Stoll, Georgia Institute of Technology, Atlanta, GA, USA; 81318498515, Craig S. Tashman, Georgia Institute of Technology, Atlanta, GA, USA; 81100595699, W. Keith Edwards, Georgia Institute of Technology, Atlanta, GA, USA; 81350583995, Kyle Spafford, Georgia Institute of Technology, Atlanta, GA, USA; "
"CHI","08","http://dx.doi.org/10.1145/1357054.1357218","Talc: using desktop graffiti to fight software vulnerability","2 ","1","81","558","graffiti; home users; internet security; miscellaneous; security; software vulnerabilities","10","81350584601, Kandha Sankarpandian, Georgia Institute of Technology, Atlanta, GA, USA; 81350578111, Travis Little, Georgia Institute of Technology, Atlanta, GA, USA; 81100595699, W. Keith Edwards, Georgia Institute of Technology, Atlanta, GA, USA; "
"CHI","08","http://dx.doi.org/10.1145/1357054.1357219","You've been warned: an empirical study of the effectiveness of web browser phishing warnings","67 ","34","314","1,657","human factors; phishing; usable privacy and security; user/machine systems","10","81315488724, Serge Egelman, Carnegie Mellon University, Pittsburgh, PA, USA; 81100472223, Lorrie Faith Cranor, Carnegie Mellon University, Pittsburgh, PA, USA; 81408598366, Jason Hong, Carnegie Mellon University, Pittsburgh, PA, USA; "
"CHI","08","http://dx.doi.org/10.1145/1357054.1357221","The adaptation of visual search strategy to expected information gain","6 ","4","70","752","cognitive models; density; eye movement; human information processing; selection process; strategy; theory and methods; visual exploration","10","81350572914, Yuan-Chi Tseng, The University of Manchester, Manchester, United Kingdom; 81100489674, Andrew Howes, The University of Manchester, Manchester, United Kingdom; "
"CHI","08","http://dx.doi.org/10.1145/1357054.1357222","PeerChooser: visual interactive recommendation","11 ","2","38","575","algorithms; collaborative filtering; interaction; recommender systems","4","81100659770, John O'Donovan, University College Dublin, Ireland; 81100297638, Barry Smyth, University College Dublin, Ireland; 81350587202, Brynjar Gretarsson, University of California, Santa Barbara, CA; 81350584696, Svetlin Bostandjiev, University of California, Santa Barbara, CA; 81100002957, Tobias H&#246;llerer, University of California, Santa Barbara, CA; "
"CHI","08","http://dx.doi.org/10.1145/1357054.1357223","Pick me!: link selection in expertise search results","13 ","1","30","523","design; expertise search; people search","4","81100499118, N. Sadat Shami, Cornell University, Ithaca, NY, USA; 81331492075, Kate Ehrlich, IBM TJ Watson Research Center, Cambridge, MA, USA; 81100086599, David R. Millen, IBM TJ Watson Research Center, Cambridge, MA, USA; "
"CHI","08","http://dx.doi.org/10.1145/1357054.1357224","Searching for expertise","13 ","5","51","685","design; expertise locator tools; general","4","81331492075, Kate Ehrlich, IBM, Cambridge, MA, USA; 81100499118, N. Sadat Shami, Cornell University, Ithaca, NY, USA; "
"CHI","08","http://dx.doi.org/10.1145/1357054.1357225","What drives content tagging: the case of photos on Flickr","30 ","12","120","1,242","flickr; miscellaneous; photo sharing; tags","4","81339520089, Oded Nov, Polytechnic University, New York, New York, USA; 81100585927, Mor Naaman, Yahoo! Inc., Berkeley, USA; 81350581424, Chen Ye, University of Illinois at Chicago, Chicago, IL, USA; "
"CHI","08","http://dx.doi.org/10.1145/1357054.1357227","Don't look now, but we've created a bureaucracy: the nature and roles of policies and rules in wikipedia","37 ","26","110","1,026","collaboration; computer-supported collaborative work; dynamics; policy; theory; wikis","10","81100547938, Brian Butler, University of Pittsburgh, Pittsburgh, PA, USA; 81311485327, Elisabeth Joyce, Edinboro University of Pennsylvania, Edinboro, PA, USA; 81350567384, Jacqueline Pike, University of Pittsburgh, Pittsburgh, PA, USA; "
"CHI","08","http://dx.doi.org/10.1145/1357054.1357228","Exploring the role of the reader in the activity of blogging","14 ","10","103","1,628","blog readers; human factors; miscellaneous","10","81311485671, Eric Baumer, University of California, Irvine, Irvine, CA, USA; 81350586781, Mark Sueyoshi, University of California, Irvine, Irvine, CA, USA; 81100457381, Bill Tomlinson, University of California, Irvine, Irvine, CA, USA; "
"CHI","08","http://dx.doi.org/10.1145/1357054.1357229","Emotion rating from short blog texts","8 ","9","66","893","affect; emotion; human factors; miscellaneous","4","81384619623, Alastair J. Gill, Northwestern University, Evanston, IL, USA; 81100246470, Darren Gergle, Northwestern University, Evanston, IL, USA; 81100290280, Robert M. French, University of Burgundy, Dijon, France; 81100267045, Jon Oberlander, University of Edinburgh, Edinburgh, United Kingdom; "
"CHI","08","http://dx.doi.org/10.1145/1357054.1357230","Word usage and posting behaviors: modeling blogs with unobtrusive data collection methods","7 ","1","33","556","blogs; human factors; measurement; pca; theory; user modeling","4","81100175734, Adam D. I. Kramer, University of Oregon, Eugene, OR, USA; 81100347361, Kerry Rodden, Google, Mountain View, CA, USA; "
"CHI","08","http://dx.doi.org/10.1145/1357054.1357232","Topobo in the wild: longitudinal evaluations of educators appropriating a tangible interface","7 ","10","73","691","case studies; digital manipulative; experimentation; tangible user interface","10","81100008987, Amanda J. Parkes, Massachusetts Institute of Technology (MIT) Media Lab, Cambridge, MA, USA; 81100381813, Hayes Solos Raffle, Massachusetts Institute of Technology (MIT) Media Lab, Cambridge, MA, USA; 81100363076, Hiroshi Ishii, Massachusetts Institute of Technology (MIT) Media Lab, Cambridge, MA, USA; "
"CHI","08","http://dx.doi.org/10.1145/1357054.1357233","You can touch, but you can't look: interacting with in-vehicle systems","18 ","10","134","1,486","driving; gesture interaction; in-vehicle systems; tactile interaction; visual attention","10","81350584724, Kenneth Majlund Ba h, Aalborg University, Aalborg, Denmark; 81418596551, Mads Gregers J&#230;ger, Aalborg University, Aalborg, Denmark; 81100131331, Mikael B. Skov, Aalborg University, Aalborg, Denmark; 81418595720, Nils Gram Thomassen, Aalborg University, Aalborg, Denmark; "
"CHI","08","http://dx.doi.org/10.1145/1357054.1357234","Touchers and mousers: commonalities and differences in co-located collaboration with multiple input devices","12 ","1","31","629","co-located collaboration; direct and indirect input devices; group and organization interfaces; human factors; tabletop; user interfaces","4","81100249927, Christian M&#252;ller-Tomfelde, CSIRO, Marsfield, Australia; 81100283369, Claudia Schremmer, CSIRO, Marsfield, Australia; "
"CHI","08","http://dx.doi.org/10.1145/1357054.1357235","Information distance and orientation in liquid layout","2 ","1","26","452","browser width; experimentation; liquid layout; software psychology; user interface management systems","4","81339501487, Joseph H. Goldberg, Oracle Corporation, Redwood Shores, CA, USA; 81100125410, Jonathan I. Helfman, Oracle Corporation, Redwood Shores, CA, USA; 81350577311, Lynne Martin; "
"CHI","08","http://dx.doi.org/10.1145/1357054.1357237","Activity-based serendipitous recommendations with the Magitti mobile leisure guide","42 ","18","168","1,657","context aware computing; design; human factors; leisure; miscellaneous; user experience","10","81100464780, Victoria Bellotti, PARC, Palo Alto, CA, USA; 81385592906, Bo Begole, PARC, Palo Alto, CA, USA; 81100330316, Ed H. Chi, PARC, Palo Alto, CA, USA; 81100116901, Nicolas Ducheneaut, PARC, Palo Alto, CA, USA; 81544816256, Ji Fang, PARC, Palo Alto, CA, USA; 81100495075, Ellen Isaacs, PARC, Palo Alto, CA, USA; 81543513556, Tracy King, PARC, Palo Alto, CA, USA; 81406594629, Mark W. Newman, PARC, Palo Alto, CA, USA; 81100558733, Kurt Partridge, PARC, Palo Alto, CA, USA; 81100551096, Bob Price, PARC, Palo Alto, CA, USA; 81351591238, Paul Rasmussen, PARC, Palo Alto, CA, USA; 81539032956, Michael Roberts, PARC, Palo Alto, CA, USA; 81100092251, Diane J. Schiano, PARC, Palo Alto, CA, USA; 81100444640, Alan Walendowski, PARC, Palo Alto, CA, USA; "
"CHI","08","http://dx.doi.org/10.1145/1357054.1357238","Performing thrill: designing telemetry systems and spectator interfaces for amusement rides","21 ","7","56","454","amusement; design; general; orchestration; performance; telemetry; user/machine systems","10","81100504057, Holger Schn&#228;delbach; 81416605898, Stefan Rennick Egglestone; 81100228688, Stuart Reeves; 81100619971, Steve Benford; 81100423582, Brendan Walker; 81100659969, Michael Wright; "
"CHI","08","http://dx.doi.org/10.1145/1357054.1357239","Understanding geocaching practices and motivations","30 ","27","180","1,236","diary study; global positioning system; human factors; location-based computing","10","81452615958, Kenton O'Hara, Hewlett-Packard Labs, Bristol, UK; "
"CHI","08","http://dx.doi.org/10.1145/1357054.1357241","Large scale analysis of web revisitation patterns","41 ","14","127","1,124","human factors; query log analysis; revisitation; web behavior","10","81100589033, Eytan Adar, University of Washington, Seattle, WA, USA; 81100167805, Jaime Teevan, Microsoft Research, Redmond, WA, USA; 81100134501, Susan T. Dumais, Microsoft Research, Redmond, WA, USA; "
"CHI","08","http://dx.doi.org/10.1145/1357054.1357242","SearchBar: a search-centric web history for task resumption and information re-finding","31 ","15","92","804","human factors; search process; web search interfaces","10","81405594249, Dan Morris, Microsoft Research, Redmond, WA, USA; 81452607037, Meredith Ringel Morris, Microsoft Research, Redmond, WA, USA; 81100190815, Gina Venolia, Microsoft Research, Redmond, WA, USA; "
"CHI","08","http://dx.doi.org/10.1145/1357054.1357243","Exploring multi-session web tasks","16 ","7","63","618","diary study; field study; miscellaneous; web tasks","10","81350583349, Bonnie Ma Kay, Dalhousie University, Halifax, NS, Canada; 81100083433, Carolyn Watters, Dalhousie University, Halifax, NS, Canada; "
"CHI","08","http://dx.doi.org/10.1145/1357054.1357245","An exploratory study of visual information analysis","23 ","11","103","1,096","analysis process; human factors; user interfaces","10","81384597747, Petra Isenberg, University of Calgary, Calgary, AB, Canada; 81100640680, Anthony Tang, University of British Columbia, Vancouver, BC, Canada; 81452616781, Sheelagh Carpendale, University of Calgary, Calgary, AB, Canada; "
"CHI","08","http://dx.doi.org/10.1145/1357054.1357246","Do visualizations improve synchronous remote collaboration?","9 ","3","57","816","collaboration; computer-supported cooperative work; distributed work; experimentation; synchronous interaction","10","81350576595, Aruna D. Balakrishnan, Carnegie Mellon University, Pittsburgh, PA, USA; 81100583820, Susan R. Fussell, Carnegie Mellon University, Pittsburgh, PA, USA; 81100476487, Sara Kiesler, Carnegie Mellon University, Pittsburgh, PA, USA; "
"CHI","08","http://dx.doi.org/10.1145/1357054.1357247","Supporting the analytical reasoning process in information visualization","26 ","20","171","1,336","analytical reasoning process; graphical user interfaces; visual analytics","10","81350584254, Yedendra Babu Shrinivasan, Technische Universiteit Eindhoven (TU/e), Eindhoven, Netherlands; 81100381561, Jarke J. van Wijk, Technische Universiteit Eindhoven (TU/e), Eindhoven, Netherlands; "
"CHI","08","http://dx.doi.org/10.1145/1357054.1357249","Impact of screen size on performance, awareness, and user satisfaction with adaptive graphical user interfaces","20 ","16","193","1,662","adaptive interfaces; experimentation; interaction techniques; personalization; user study","10","81100170743, Leah Findlater, University of British Columbia, Vancouver, Canada; 81100232506, Joanna McGrenere, University of British Columbia, Vancouver, Canada; "
"CHI","08","http://dx.doi.org/10.1145/1357054.1357250","Improving the performance of motor-impaired users with automatically-generated, ability-based interfaces","40 ","55","176","1,068","ability-based user interfaces; assistive technologies for persons with disabilities; evaluation/methodology; motor impairments; supple++","10","81100593751, Krzysztof Z. Gajos, University of Washington, Seattle, WA, USA; 81100086173, Jacob O. Wobbrock, University of Washington, Seattle, WA, USA; 81100087768, Daniel S. Weld, University of Washington, Seattle, WA, USA; "
"CHI","08","http://dx.doi.org/10.1145/1357054.1357251","Evaluation of a role-based approach for customizing a complex development environment","2 ","3","21","331","adaptable and adaptive interfaces; evaluation/methodology; graphical user interfaces; role-based interface","4","81100170743, Leah Findlater, University of British Columbia, Vancouver, Canada; 81100232506, Joanna McGrenere, University of British Columbia, Vancouver, Canada; 81100284481, David Modjeska, University of Toronto, Toronto, Canada; "
"CHI","08","http://dx.doi.org/10.1145/1357054.1357252","Predictability and accuracy in adaptive user interfaces","20 ","9","98","1,038","accuracy; evaluation/methodology; interaction styles; user study","4","81100593751, Krzysztof Z. Gajos, University of Washington, Seattle, WA, USA; 81100584715, Katherine Everitt, University of Washington, Seattle, WA, USA; 81100255664, Desney S. Tan, Microsoft Research, Redmond, WA, USA; 81100280834, Mary Czerwinski, Microsoft Research, Redmond, WA, USA; 81100087768, Daniel S. Weld, University of Washington, Seattle, WA, USA; "
"CHI","08","http://dx.doi.org/10.1145/1357054.1357254","Indirect mappings of multi-touch input using one and two hands","29 ","20","145","2,353","bimanual; experimentation; human factors; human information processing; multi-touch","10","81100624219, Tomer Moscovich, University of Toronto, Toronto, ON, Canada and Brown University, Providence, RI, USA; 81100166298, John F. Hughes, Brown University, Providence, RI, USA; "
