"""conference""","""year""","""doi""","""title""","""citationCount""","""download6weeks""","""download12months""","""downloadAll""","""keywords""","""pageNumber""","""authors"""CHI,1,http://dx.doi.org/10.1145/365024.365027,Scale effects in steering law tasks,29,4,60,938,arm; consumer products; control theory; device size; finger; human factors; input devices and strategies; limb; movement scale; steering law; wrist,8,"81100509407, Johnny Accot, IBM Almaden Research Center, 650 Harry Road, San Jose, CA; 81408591988, Shumin Zhai; "CHI,1,http://dx.doi.org/10.1145/365024.365028,Accuracy measures for evaluating computer pointing devices,93,13,148,"2,267",computer pointing devices; design; human factors; measurement; performance evaluation; reliability,8,"81100367406, I. Scott MacKenzie, Dept. of Computer Science, York University, Toronto, Ontario, Canada M3J 1P3; 81100358954, Tatu Kauppinen, Nokia Research Center, P.O. Box 407, FIN-00045 Nokia Group, Finland; 81100199031, Miika Silfverberg, Nokia Research Center, P.O. Box 407, FIN-00045 Nokia Group, Finland; "CHI,1,http://dx.doi.org/10.1145/365024.365030,Laser pointer interaction,89,6,86,"1,686",camera-based interaction; group interaction; input devices and strategies; interaction techniques; management; performance; user/machine systems,6,"81410595121, Dan R. Olsen, Jr., Computer Science Department, Brigham Young University, Provo, UT; 81332518387, Travis Nielsen, Computer Science Department, Brigham Young University, Provo, UT; "CHI,1,http://dx.doi.org/10.1145/365024.365031,Listen reader: an electronically augmented paper-based book,54,15,114,"1,851","artificial, augmented, and virtual realities; audio input/output; augmented reality; documentation; embedded tags; gestural input; interactive audio; interactive museum; management; natural language; page detection; portable devices; smart documents; theory; voice i/o",7,"81100005666, Maribeth Back, Xerox PARC, 3333 Coyote Hill Road, Palo Alto, CA; 81332493853, Jonathan Cohen, Xerox PARC, 3333 Coyote Hill Road, Palo Alto, CA; 81332501009, Rich Gold, Xerox PARC, 3333 Coyote Hill Road, Palo Alto, CA; 81100010024, Steve Harrison, Xerox PARC, 3333 Coyote Hill Road, Palo Alto, CA; 81100078779, Scott Minneman, Xerox PARC, 3333 Coyote Hill Road, Palo Alto, CA; "CHI,1,http://dx.doi.org/10.1145/365024.365032,"Exploiting interactivity, influence, space and time to explore non-linear drama in virtual worlds",10,4,37,940,"artificial, augmented, and virtual realities; enterainment applications; interaction styles; management; theory; virtual reality",8,"81100554242, Mike Craven, School of Computer Science, University of Nottingham, Nottingham, NG8 1BB, UK; 81542123356, Ian Taylor, School of Computer Science, University of Nottingham, Nottingham, NG8 1BB, UK; 81100638532, Adam Drozd, School of Computer Science, University of Nottingham, Nottingham, NG8 1BB, UK; 81100542016, Jim Purbrick, School of Computer Science, University of Nottingham, Nottingham, NG8 1BB, UK; 81100557223, Chris Greenhalgh, School of Computer Science, University of Nottingham, Nottingham, NG8 1BB, UK; 81100619971, Steve Benford, School of Computer Science, University of Nottingham, Nottingham, NG8 1BB, UK; 81100364452, Mike Fraser, School of Computer Science, University of Nottingham, Nottingham, NG8 1BB, UK; 81100260889, John Bowers, NADA, Royal Institute of Technology, S-100 44 Stockholm, Sweden; 81100228951, Kai-Mikael J&#228;&#228;-Aro, NADA, Royal Institute of Technology, S-100 44 Stockholm, Sweden; 81408601767, Bernd Lintermann; 81332504327, Michael Hoch; "CHI,1,http://dx.doi.org/10.1145/365024.365033,Orchestrating a mixed reality performance,31,3,39,833,"artificial, augmented, and virtual realities; human factors; mixed reality; performance; theory; virtual reality",8,"81100296314, Boriana Koleva, School of Computer Science, The University of Nottingham, Nottingham NG7 2RD, UK; 81542123356, Ian Taylor, School of Computer Science, The University of Nottingham, Nottingham NG7 2RD, UK; 81100619971, Steve Benford, School of Computer Science, The University of Nottingham, Nottingham NG7 2RD, UK; 81100364452, Mike Fraser, School of Computer Science, The University of Nottingham, Nottingham NG7 2RD, UK; 81100557223, Chris Greenhalgh, School of Computer Science, The University of Nottingham, Nottingham NG7 2RD, UK; 81100504057, Holger Schn&#228;delbach, School of Computer Science, The University of Nottingham, Nottingham NG7 2RD, UK; 81100561154, Dirk vom Lehn, The Management Centre, Kings College London, Franklin-Wilkins Building, London SE1 8WA, UK; 81100164455, Christian Heath, The Management Centre, Kings College London, Franklin-Wilkins Building, London SE1 8WA, UK; 81100463317, Ju Row-Farr; 81100312947, Matt Adams; "CHI,1,http://dx.doi.org/10.1145/365024.365034,Cookies and Web browser design: toward realizing informed consent online,25,16,190,"1,950",computer ethics; design; e-commerce; human factors; human-computer interaction; interaction styles; internet; locus of control; measurement; online interactions; personalization; privacy; social computing; theory; value-sensitive design; world wide web,7,"81100351532, Lynette I. Millett, Department of Computer Science, Cornell University, Ithaca, NY; 81100636215, Batya Friedman, The Information School, University of Washington, Seattle, WA; 81100373505, Edward Felten, Department of Computer Science, Princeton University, NJ; "CHI,1,http://dx.doi.org/10.1145/365024.365035,Empirically validated web page design metrics,49,19,152,"4,177",automated usability evaluation; empirical studies; human factors; measurement; screen design; web site design; web-based services,8,"81100296046, Melody Y. Ivory, EECS Department, UC Berkeley, Berkeley, CA; 81100335844, Rashmi R. Sinha, SIMS/Psychology Department, UC Berkeley, Berkeley, CA; 81100612246, Marti A. Hearst, SIMS, UC Berkeley, Berkeley, CA; "CHI,1,http://dx.doi.org/10.1145/365024.365037,What makes Web sites credible?: a report on a large quantitative study,120,54,357,"5,636",captology; design; expertise; management; online research; reliability; trustworthiness; web design; web-based services,8,"81452616406, B. J. Fogg, Persuasive Technology Lab, Stanford University, Cordura Hall, Stanford, CA; 81100280809, Jonathan Marshall, Persuasive Technology Lab, Stanford University, Cordura Hall, Stanford, CA; 81100342488, Othman Laraki, Persuasive Technology Lab, Stanford University, Cordura Hall, Stanford, CA; 81100578560, Alex Osipovich, Persuasive Technology Lab, Stanford University, Cordura Hall, Stanford, CA; 81100153571, Chris Varma, Persuasive Technology Lab, Stanford University, Cordura Hall, Stanford, CA; 81100350049, Nicholas Fang, Persuasive Technology Lab, Stanford University, Cordura Hall, Stanford, CA; 81100339687, Jyoti Paul, Persuasive Technology Lab, Stanford University, Cordura Hall, Stanford, CA; 81100141598, Akshay Rangnekar, Persuasive Technology Lab, Stanford University, Cordura Hall, Stanford, CA; 81100456453, John Shon, Persuasive Technology Lab, Stanford University, Cordura Hall, Stanford, CA; 81332530745, Preeti Swani, Persuasive Technology Lab, Stanford University, Cordura Hall, Stanford, CA; 81100446411, Marissa Treinen, Persuasive Technology Lab, Stanford University, Cordura Hall, Stanford, CA; "CHI,1,http://dx.doi.org/10.1145/365024.365038,Improving the performance of the cyberlink mental interface with &ldquo;yes / no program&rdquo;,6,2,24,710,assistive technologies for persons with disabilities; cyberlink; human factors; interaction techniques; mental interface; performance; user/machine systems,8,"81100175531, Eamon Doherty, School of Computing, Engineering and Technology, University of Sunderland, P.O. Box 299, Sunderland, SR6 OYN, UK; 81100175348, Gilbert Cockton, School of Computing, Engineering and Technology, University of Sunderland, P.O. Box 299, Sunderland, SR6 OYN, UK; 81100198998, Chris Bloor, School of Computing, Engineering and Technology, University of Sunderland, P.O. Box 299, Sunderland, SR6 OYN, UK; 81100643688, Dennis Benigno; "CHI,1,http://dx.doi.org/10.1145/365024.365047,"Responding to subtle, fleeting changes in the user's internal state",16,4,21,559,acknowledgements; ephemeral emotions; human factors; management; performance; real-time; social interaction; theory; user interfaces,8,"81332532709, Wataru Tsukahara, Hitachi Central Research Labs, 1-280 Higashi-Koigakubo, Kokubunji-shi, Tokyo 185-8601 Japan; 81100632992, Nigel Ward, Mech-Info Engineering, University of Tokyo, 7-3-1 Hongo, Bunkyo-ku, Tokyo 113-8656 Japan; "CHI,1,http://dx.doi.org/10.1145/365024.365051,An &ldquo;independent visual background&rdquo; reduced balance disturbance envoked by visual scene motion: implication for alleviating simulator sickness,2,1,23,597,"artificial, augmented, and virtual realities; cybersickness; human factors; management; performance; simulator sickness; virtual environments; virtual reality",5,"81100369572, Henry Been-Lirn Duh, Human Interface Techology Lab, University of Washington, Seattle, WA; 81100170435, Donald E. Parker, Department of Otolaryngology, University of Washington, Seattle, WA; 81100270213, Thomas A. Furness, Human Interface Techology Lab, University of Washington, Seattle, WA; "CHI,1,http://dx.doi.org/10.1145/365024.365054,Layered participatory analysis: new developments in the CARD technique,17,7,43,"1,009",card; group and organization interfaces; management; panda; participatory design; systems development; work analysis,8,"81332517372, Michael J. Muller; "CHI,1,http://dx.doi.org/10.1145/365024.365056,Building a human factors &ldquo;knowledge shelf&rdquo; as a collaborative information tool for designers,0,1,40,844,collaborative work; documentation; group and organization interfaces; industrial design; knowledge shelf; performance; systems analysis and design,6,"81100478551, Brian H. Philips, Motorola, Design Integration - Human Factors, Communications Enterprise, 8000 West Sunrise Boulevard, Fort Lauderdale, FL; 81100275460, Moin Rahman, Motorola, Design Integration - Human Factors, Communications Enterprise, 8000 West Sunrise Boulevard, Fort Lauderdale, FL; 81339506713, Jari J&#228;rvinen, Motorola, Design Integration - Human Factors, Communications Enterprise, 8000 West Sunrise Boulevard, Fort Lauderdale, FL; "CHI,1,http://dx.doi.org/10.1145/365024.365060,Global-software development lifecycle: an exploratory study,26,11,107,"2,568",design; global-software development; human factors; life cycle; management; performance; spreadsheets; usability evaluation,8,"81100426389, Alvin W. Yeo, Faculty of Information Technology, Universiti Malaysia Sarawak, 94300 Kota Samarahan, Sarawak, Malaysia; "CHI,1,http://dx.doi.org/10.1145/365024.365061,Ignoring perfect knowledge in-the-world for imperfect knowledge in-the-head,9,2,24,794,cognitive least-effort; direct-manipulation interfaces; eye movements; human factors; interface design; satisficing,8,"81100400779, Wayne D. Gray, Human Factors and Applied Cognition, George Mason University, Fairfax, VA; 81100244379, Wai-Tat Fu, Human Factors and Applied Cognition, George Mason University, Fairfax, VA; "CHI,1,http://dx.doi.org/10.1145/365024.365064,Predicting the effects of in-car interfaces on driver behavior using a cognitive architecture,14,4,54,"1,574",act-r; cognitive architectures; consumer products; driving; human factors; management; performance; theory,8,"81100289294, Dario D. Salvucci, Nissan Cambridge Basic Research, Four Cambridge Center, Cambridge, MA; "CHI,1,http://dx.doi.org/10.1145/365024.365069,Towards demystification of direct manipulation: cognitive modeling charts the gulf of execution,3,1,30,636,cognitive modeling; design; human factors; management; performance,8,"81100254452, David Kieras, Electrical Engineering and Computer Science Department, University of Michigan, Ann Arbor, MI; 81100569254, David Meyer, Psychology Department, University of Michigan, Ann Arbor, MI; 81100032930, James Ballas, Naval Research Laboratory, Washington, D.C.; "CHI,1,http://dx.doi.org/10.1145/365024.365073,Visualization components for persistent conversations,62,7,85,"1,457",asynchronous threaded discussions; design; electronic mail; management; performance; social cyberspaces; usenet,8,"81100077378, Marc A. Smith, Collaboration & Multimedia Group, Microsoft Research, One Microsoft Way, Redmond, WA; 81542582156, Andrew T. Fiore, Collaboration & Multimedia Group, Microsoft Research, One Microsoft Way, Redmond, WA; "CHI,1,http://dx.doi.org/10.1145/365024.365077,Time Aura: interfaces for pacing,5,2,29,593,applications; human factors; measurement; performance; ubiquitous computing; user/machine systems,8,"81100538787, Lena Mamykina, Everyday Computing Lab, GVU Center, Georgia Institute of Technology, Atlanta, GA; 81100331104, Elizabeth Mynatt, Everyday Computing Lab, GVU Center, Georgia Institute of Technology, Atlanta, GA; 81100295906, Michael A. Terry, Everyday Computing Lab, GVU Center, Georgia Institute of Technology, Atlanta, GA; "CHI,1,http://dx.doi.org/10.1145/365024.365078,Doom as an interface for process management,25,2,40,"1,385",3d user interfaces; design; first-person shooter; games; human factors; metaphors; performance; theory; video games,6,"81100133918, Dennis Chao, Computer Science Department, University of New Mexico, Albuquerque, NM; "CHI,1,http://dx.doi.org/10.1145/365024.365090,"Shall we mix synthetic speech and human speech?: impact on users' performance, perception, and attitude",9,2,28,770,consistency; email and calendar; human factors; management; performance; speech recognition and synthesis; theory; voice i/o,8,"81100009981, Li Gong; 81452599494, Jennifer Lai; "CHI,1,http://dx.doi.org/10.1145/365024.365092,"Effects of spatial audio on memory, comprehension, and preference during desktop conferences",17,5,43,711,3d; audio input/output; comprehension; design; focal assurance; management; memory; performance; spatial; user preference,8,"81100522643, Jessica J. Baldis, Human Interface Technology Laboratory, University of Washington, PO Box 352142, Seattle, WA; "CHI,1,http://dx.doi.org/10.1145/365024.365094,Quiet calls: talking silently on mobile phones,30,3,56,"1,203",communications applications; design; human factors; languages; measurement; performance; sound and music computing; theory; user/machine systems,8,"81100407787, Les Nelson, FX Palo Alto Laboratory, Palo Alto, CA; 81100274421, Sara Bly, Space &amp; Virtuality Studio, The Interactive Institute, Malmo, Sweden; 81100318754, Tomas Sokoler; "CHI,1,http://dx.doi.org/10.1145/365024.365096,The audio notebook: paper and pen interaction with structured speech,58,5,53,"1,316",acoustic structuring; design; human factors; languages; paper; performance; speech as data; speech recognition and synthesis; user structuring,8,"81100180551, Lisa Stifelman, MIT Media Laboratory, Cambridge, MA; 81100365992, Barry Arons, MIT Media Laboratory, Cambridge, MA; 81100444749, Chris Schmandt, MIT Media Laboratory, Cambridge, MA; "CHI,1,http://dx.doi.org/10.1145/365024.365097,Does organisation by similarity assist image browsing?,84,9,51,"1,256",design; evaluation/methodology; human factors; image retrieval; interaction styles; management; performance; theory,8,"81100347361, Kerry Rodden, University of Cambridge Computer Laboratory, Pembroke Street, Cambridge CB2 3QG, UK; 81100470296, Wojciech Basalaj, University of Cambridge Computer Laboratory, Pembroke Street, Cambridge CB2 3QG, UK; 81100094737, David Sinclair, AT&T Laboratories Cambridge, Trumpington Street, Cambridge CB2 1QA, UK; 81344500170, Kenneth Wood, AT&T Laboratories Cambridge, Trumpington Street, Cambridge CB2 1QA, UK; "CHI,1,http://dx.doi.org/10.1145/365024.365098,Using thumbnails to search the Web,62,7,50,"1,390",design; interaction styles; measurement; reliability; theory; web search task; web-based services,8,"81100327302, Allison Woodruff, Xerox Palo Alto Research Center, 3333 Coyote Hill Rd., Palo Alto, CA; 81100067252, Andrew Faulring, Xerox Palo Alto Research Center, 3333 Coyote Hill Rd., Palo Alto, CA and Carnegie Mellon University, 5000 Forbes Avenue, Pittsburgh, PA; 81100414889, Ruth Rosenholtz, Xerox Palo Alto Research Center, 3333 Coyote Hill Rd., Palo Alto, CA; 81100423179, Julie Morrsion, Xerox Palo Alto Research Center, 3333 Coyote Hill Rd., Palo Alto, CA; 81100252735, Peter Pirolli, Xerox Palo Alto Research Center, 3333 Coyote Hill Rd., Palo Alto, CA; "CHI,1,http://dx.doi.org/10.1145/365024.365100,On the road and on the Web?: comprehension of synthetic and human speech while driving,9,0,30,816,comprehension; driving performance; human factors; management; performance; speech synthesis; theory; web-based interaction,7,"81452599499, Jennifer Lai, IBM Corporation, T.J. Watson Research Center, Hawthorne, NY; 81100100757, Karen Cheng, IBM Corporation, T.J. Watson Research Center, Hawthorne, NY; 81407594358, Paul Green, University of Michigan, Transportation Research Institute, Ann Arbor, MI; 81100633125, Omer Tsimhoni, University of Michigan, Transportation Research Institute, Ann Arbor, MI; "CHI,1,http://dx.doi.org/10.1145/365024.365102,Accordion summarization for end-game browsing on PDAs and cellular phones,44,2,17,"1,009",design; html; human factors; management; pda; portable devices; wap; web-based services; www,8,"81100501214, Orkut Buyukkokten, Digital Libraries Lab (InfoLab), Stanford University, Stanford, CA; 81100308969, Hector Garcia-Molina, Digital Libraries Lab (InfoLab), Stanford University, Stanford, CA; 81100130120, Andreas Paepcke, Digital Libraries Lab (InfoLab), Stanford University, Stanford, CA; "CHI,1,http://dx.doi.org/10.1145/365024.365105,ConNexus to awarenex: extending awareness to mobile users,108,0,49,"1,612",algorithms; computer-mediated communication; cscw; ergonomics; human factors; management; performance; theory,8,"81405592014, John C. Tang, Sun Microsystems Laboratories, 901 San Antonio Road, Palo Alto, CA; 81310499777, Nicole Yankelovich, Sun Microsystems Laboratories, 901 San Antonio Road, Palo Alto, CA; 81385592906, James Begole, Sun Microsystems Laboratories, 901 San Antonio Road, Palo Alto, CA; 81328490974, Max Van Kleek, MIT and Sun Microsystems Laboratories, 901 San Antonio Road, Palo Alto, CA; 81414609896, Francis Li, U.C Berkeley and Sun Microsystems Laboratories, 901 San Antonio Road, Palo Alto, CA; 81414617247, Janak Bhalodia, Sun Microsystems Laboratories, 901 San Antonio Road, Palo Alto, CA; "CHI,1,http://dx.doi.org/10.1145/365024.365107,Beyond command knowledge: identifying and teaching strategic knowledge for using complex computer applications,7,0,23,636,"curriculum; experimentation; human factors; management; performance; theory; training, help, and documentation",8,"81100435759, Suresh K. Bhavnani, School of Information, University of Michigan, Ann Arbor, MI; 81100564883, Frederick Reif, Center for Innovation in Learning, Carnegie Mellon University, Pittsburgh, PA; 81100482886, Bonnie E. John, HCI Institute, Carnegie Mellon University, Pittsburgh, PA; "CHI,1,http://dx.doi.org/10.1145/365024.365109,Teachers as simulation programmers: minimalist learning and reuse,5,0,18,625,"curriculum; general; management; simulations; theory; training, help, and documentation",8,"81335496622, Mary Beth Rosson, Department of Computer Science, Virginia Tech, Blacksburg, VA; 81332526317, Cheryl D. Seals, Department of Computer Science, Virginia Tech, Blacksburg, VA; "CHI,1,http://dx.doi.org/10.1145/365024.365111,"Locus of feedback control in computer-based tutoring: impact on learning rate, achievement and attitudes",31,8,64,"1,090",computer uses in education; feedback in problem solving; instructional interface design; management; performance; theory; user/machine systems,8,"81100192841, Albert T. Corbett, Human Computer Interaction Institute, Carnegie Mellon University, Pittsburgh, PA; 81363598414, John R. Anderson, Psychology &amp; Computer Science Departments, Carnegie Mellon University, Pittsburgh, PA; "CHI,1,http://dx.doi.org/10.1145/365024.365112,Sensetable: a wireless object tracking platform for tangible user interfaces,91,12,128,"1,564","artificial, augmented, and virtual realities; design; interaction techniques; management; performance; tangible user interface; two-handed manipulation; virtual reality",8,"81100339352, James Patten, Tangible Media Group, MIT Media Lab, 20 Ames Street, Cambridge, MA; 81100363076, Hiroshi Ishii, Tangible Media Group, MIT Media Lab, 20 Ames Street, Cambridge, MA; 81332504228, Jim Hines, System Dynamics Group, MIT Sloan School of Management, 50 Memorial Drive, Cambridge, MA; 81100297437, Gian Pangaro, Tangible Media Group, MIT Media Lab, 20 Ames Street, Cambridge, MA; "CHI,1,http://dx.doi.org/10.1145/365024.365114,Surface drawing: creating organic 3D shapes with the hand and tangible tools,63,24,195,"2,113","3d modeling; curve, surface, solid, and object representations; design prototyping; fine arts; human factors; interaction techniques; performance; semi-immersive environment; theory",8,"81100001340, Steven Schkolne, Bell Labs; 81100420528, Michael Pruett; 81100117380, Peter Schr&#246;der; "CHI,1,http://dx.doi.org/10.1145/365024.365115,DataTiles: a modular platform for mixed physical and graphical interactions,80,6,88,"1,537",design; graphical user interfaces; interaction styles; interaction techniques; performance; tangible user interfaces; visual language,8,"81100008564, Jun Rekimoto, Interaction Laboratory, Sony Computer Science Laboratories, Inc., 3-14-13 Higashigotanda, Shinagawa-ku, Tokyo 141-0022 Japan; 81100226633, Brygg Ullmer, Tangible Media Group, MIT Media Laboratory, 20 Ames Street, Cambridge, MA; 81100154483, Haruo Oba, Interaction Laboratory, Sony Computer Science Laboratories, Inc., 3-14-13 Higashigotanda, Shinagawa-ku, Tokyo 141-0022 Japan; "CHI,1,http://dx.doi.org/10.1145/365024.365116,Optimizing search by showing results in context,84,9,58,"1,537",design; human factors; measurement; search; text categorization; usability; user study; web-based services,8,"81100134501, Susan Dumais, Microsoft Research, One Microsoft Way, Redmond, WA; 81100506242, Edward Cutrell, Microsoft Research, One Microsoft Way, Redmond, WA; 81540489656, Hao Chen, Computer Science Division, University of California, Berkeley, CA; "CHI,1,http://dx.doi.org/10.1145/365024.365117,Robust annotation positioning in digital documents,32,3,54,"1,152",algorithms; annotation system design; digital; document capture; documents; general; management; performance; theory; user/machine systems,8,"81332491415, A. J. Bernheim Brush, Collaboration and Multimedia Systems Group, Microsoft Research, Redmond, WA; 81100187010, David Bargeron, Collaboration and Multimedia Systems Group, Microsoft Research, Redmond, WA; 81452611908, Anoop Gupta, Collaboration and Multimedia Systems Group, Microsoft Research, Redmond, WA; 81100025873, J. J. Cadiz, Collaboration and Multimedia Systems Group, Microsoft Research, Redmond, WA; "CHI,1,http://dx.doi.org/10.1145/365024.365118,"Reading of electronic documents: the usability of linear, fisheye, and overview+detail interfaces",47,12,70,"1,583",design; document capture; electronic documents; human factors; information visualization; reading activity; theory; user interfaces; user/machine systems,8,"81100047223, Kasper Hornb&#230;k, Department of Computing, University of Copenhagen, Copenhagen East, Denmark; 81100265136, Erik Fr&#248;kj&#230;r; "CHI,1,http://dx.doi.org/10.1145/365024.365119,Eye gaze patterns in conversations: there is more to conversational agents than meets the eyes,90,29,210,"2,128",attention-based interfaces; conversational attention; gaze; languages; measurement; multiparty communication; theory,8,"81100497077, Roel Vertegaal, Queen's University, Canada; 81100136322, Robert Slagter, Vrije Universiteit, The Netherlands; 81100545115, Gerrit van der Veer, Twente University, The Netherlands; 81100266861, Anton Nijholt; "CHI,1,http://dx.doi.org/10.1145/365024.365121,The impact of eye gaze on communication using humanoid avatars,56,11,87,"1,786","artificial, augmented, and virtual realities; collaborative virtual enviroments; design; experimentation; human factors; management; mediated communication; performance; virtual reality",8,"81100051968, Maia Garau, Department of Computer Science, University College London (UCL), Gower St., London, WC1E 6BT, UK; 81100615391, Mel Slater, Department of Computer Science, University College London (UCL), Gower St., London, WC1E 6BT, UK; 81100302046, Simon Bee, Parametric Technology Corp., 19 Apex Court, Woodlands, Almondsbury Park, Bristol, BS32 4JT, UK and MLB3/7, BT Labs., Martlesham Heath, Ipswich, IP5 3RE, UK; 81100499004, Martina Angela Sasse, Department of Computer Science, University College London (UCL), Gower St., London, WC1E 6BT, UK; "CHI,1,http://dx.doi.org/10.1145/365024.365124,The dynamics of mass online marketplaces: a case study of an online auction,6,3,48,"1,847",design; electronic marketplaces; information overload; management; market technostructure; measurement; performance; user interfaces,8,"81100617612, Jungpil Hahn, Information and Decision Sciences, University of Minnesota, Minneapolis, MN; "