"conference","year","doi","title","citationCount","download6weeks","download12months","downloadAll","keywords","pageNumber","authors"
"CHI","09","http://dx.doi.org/10.1145/1518701.1518980","The problem of consistency in the design of Fitts' law experiments: consider either target distance and width or movement form and scale","9 ","5","79","652","evaluation/methodology; experimentation; human factors; movement amplitude; movement form; movement shape; target tolerance; theory","10","81100143867, Yves Guiard, CNRS & TELECOM ParisTech, Paris, France; "
"CHI","09","http://dx.doi.org/10.1145/1518701.1518981","Toward a unified theory of the multitasking continuum: from concurrent performance to task switching, interruption, and resumption","13 ","35","182","957","attention; human factors; interruption; theory and methods","10","81100289294, Dario D. Salvucci, Drexel University, Philadelphia, PA, USA; 81488649710, Niels A. Taatgen, Carnegie Mellon University, Pittsburgh, PA, USA; 81416603354, Jelmer P. Borst, University of Groningen, Groningen, Netherlands; "
"CHI","09","http://dx.doi.org/10.1145/1518701.1518983","Evaluating existing audio CAPTCHAs and an interface optimized for non-visual use","15 ","3","62","584","assistive technologies for persons with disabilities; blind users; experimentation; non-visual interfaces","10","81338487593, Jeffrey P. Bigham, University of Washington, Seattle, WA, USA; 81100369055, Anna C. Cavender, University of Washington, Seattle, WA, USA; "
"CHI","09","http://dx.doi.org/10.1145/1518701.1518984","On the audio representation of distance for blind users","3 ","5","64","551","arts and humanities; blind users; distance perception; experimentation; measurement","10","81100516440, Martin Talbot, University of Waterloo, Waterloo, ON, Canada; 81410592379, William Cowan, University of Waterloo, Waterloo, ON, Canada; "
"CHI","09","http://dx.doi.org/10.1145/1518701.1518986","Amplifying community content creation with mixed initiative information extraction","20 ","6","61","498","community content creation; information extraction; user interfaces","10","81350572145, Raphael Hoffmann, University of Washington, Seattle, WA, USA; 81323487634, Saleema Amershi, University of Washington, Seattle, WA, USA; 81350576909, Kayur Patel, University of Washington, Seattle, WA, USA; 81350591670, Fei Wu, University of Washington, Seattle, WA, USA; 81100142271, James Fogarty, University of Washington, Seattle, WA, USA; 81100087768, Daniel S. Weld, University of Washington, Seattle, WA, USA; "
"CHI","09","http://dx.doi.org/10.1145/1518701.1518987","Attaching UI enhancements to websites with end users","8 ","5","63","754","end-user programming; mashups; user interfaces","10","81350578147, Michael Toomim, DUB Group, University of Washington, Seattle, WA, USA; 81100090466, Steven M. Drucker, Microsoft Live Labs, Redmond, WA, USA; 81100654713, Mira Dontcheva, Adobe Systems, San Francisco, CA, USA; 81100652249, Ali Rahimi, Intel Research Berkeley, Berkeley, CA, USA; 81416593141, Blake Thomson, DUB Group, University of Washington, Seattle, WA, USA; 81100103519, James A. Landay, DUB Group, University of Washington, Seattle, WA, USA; "
"CHI","09","http://dx.doi.org/10.1145/1518701.1518988","User-created forms as an effective method of human-agent communication","3 ","2","42","349","agents; human factors; interaction design; user interfaces","10","81406592256, John Zimmerman, Carnegie Mellon University, Pittsburgh, PA, USA; 81416592564, Kathryn Rivard, Carnegie Mellon University, Pittsburgh, PA, USA; 81328488342, Ian Hargraves, Carnegie Mellon University, Pittsburgh, PA, USA; 81309501235, Anthony Tomasic, Carnegie Mellon University, Pittsburgh, PA, USA; 81100618899, Ken Mohnkern, Carnegie Mellon University, Pittsburgh, PA, USA; "
"CHI","09","http://dx.doi.org/10.1145/1518701.1518990","Designable visual markers","12 ","6","72","857","design; human factors; mobile devices; ui toolkits; visual marker design","10","81100088903, Enrico Costanza, EPFL Media and Design Lab, Lausanne, Switzerland; 81100084419, Jeffrey Huang, EPFL Media and Design Lab, Lausanne, Switzerland; "
"CHI","09","http://dx.doi.org/10.1145/1518701.1518991","Like bees around the hive: a comparative study of a mobile augmented reality map","17 ","16","178","1,224","augmented reality; miscellaneous","10","81331499954, Ann Morrison, Helsinki Institute for Information Technology, Helsinki, Finland; 81100333050, Antti Oulasvirta, Helsinki Institute for Information Technology, Helsinki, Finland; 81342507378, Peter Peltonen, Helsinki Institute for Information Technology, Helsinki, Finland; 81328489253, Saija Lemmela, Nokia Research Center, Helsinki, Finland; 81100644548, Giulio Jacucci, Helsinki Institute for Information Technology, Helsinki, Finland; 81100102652, Gerhard Reitmayr, University of Cambridge, Cambridge, United Kingdom; 81416608530, Jaana N&#228;s&#228;nen, Helsinki Institute for Information Technology, Helsinki, Finland; 81416608966, Antti Juustila, University of Oulu, Oulu, Finland; "
"CHI","09","http://dx.doi.org/10.1145/1518701.1518992","Going my way: a user-aware route planner","6 ","2","40","495","context awareness; direction; location awareness; navigation; personalized information","4","81100293116, Jaewoo Chung, Massachusetts Institute of Technology, Cambridge, MA, USA; 81100444749, Chris Schmandt, Massachusetts Institute of Technology, Cambridge, MA, USA; "
"CHI","09","http://dx.doi.org/10.1145/1518701.1518993","Inferring player engagement in a pervasive experience","2 ","1","48","383","context-awareness; engagement; experience-sampling method; human factors","4","81416603014, Joel E. Fischer, University of Nottingham, Nottingham, United Kingdom; 81100619971, Steve Benford; "
"CHI","09","http://dx.doi.org/10.1145/1518701.1518995","Back-of-device interaction allows creating very small touch devices","62 ","87","389","1,882","back-of-device interaction; human factors; input devices and strategies; lucidtouch; nanotouch; touch","10","81100137268, Patrick Baudisch, Hasso Plattner Institute, Potsdam, Germany; 81435596125, Gerry Chu, Hasso Plattner Institute, Potsdam, Germany; "
"CHI","09","http://dx.doi.org/10.1145/1518701.1518996","Codex: a dual screen tablet computer","19 ","19","206","1,306","collaboration; human factors; mobility; sensors","10","81100519448, Ken Hinckley, Microsoft Research, Redmond, WA, USA; 81350581254, Morgan Dixon, Microsoft Research, Redmond, WA, USA; 81100396865, Raman Sarin, Microsoft Research, Redmond, WA, USA; 81100301845, Francois Guimbretiere, University of Maryland, College Park, MD, USA; 81100503904, Ravin Balakrishnan, University of Toronto, Toronto, ON, Canada; "
"CHI","09","http://dx.doi.org/10.1145/1518701.1518997","Tilt techniques: investigating the dexterity of wrist-based input","33 ","12","86","928","human factors; tilt input; wrist dexterity","10","81416596702, Mahfuz Rahman, University of Manitoba, Winnipeg, MAN, Canada; 81350569912, Sean Gustafson, University of Manitoba, Winnipeg, MAN, Canada; 81100459517, Pourang Irani, University of Manitoba, Winnipeg, MAN, Canada; 81100277483, Sriram Subramanian, University of Bristol, Bristol, United Kingdom; "
"CHI","09","http://dx.doi.org/10.1145/1518701.1518999","A tag in the hand: supporting semantic, social, and spatial navigation in museums","16 ","7","101","937","collaborative computing; experience; human factors; museum; presence","10","81100288358, Dan Cosley, Cornell University, Ithaca, NY, USA; 81545068356, Jonathan Baxter, Cornell University, Ithaca, NY, USA; 81416594798, Soyoung Lee, Cornell University, Ithaca, NY, USA; 81416608679, Brian Alson, Cornell University, Ithaca, NY, USA; 81342505963, Saeko Nomura, Cornell University, Ithaca, NY, USA; 81538014356, Phil Adams, Cornell University, Ithaca, NY, USA; 81416608952, Chethan Sarabu, Cornell University, Ithaca, NY, USA; 81367597457, Geri Gay, Cornell University, Ithaca, NY, USA; "
"CHI","09","http://dx.doi.org/10.1145/1518701.1519000","Familial collaborations in a museum","5 ","5","76","603","actor-networks; design; miscellaneous; video analysis","10","81320490152, Tom Hope, National Institute of Advanced Industrial Science and Technology, Tokyo, Japan; 81100585225, Yoshiyuki Nakamura, National Institute of Advanced Industrial Science and Technology, Tokyo, Japan; 81416601305, Toru Takahashi, ATR Cognitive Information Science Laboratories, Kyoto, Japan; 81416607313, Atsushi Nobayashi, National Museum of Ethnology, Osaka, Japan; 81416609044, Shota Fukuoka, National Museum of Ethnology, Osaka, Japan; 81314482894, Masahiro Hamasaki, National Institute of Advanced Industrial Science and Technology, Tokyo, Japan; 81100461925, Takuichi Nishimura, National Institute of Advanced Industrial Science and Technology, Tokyo, Japan; "
"CHI","09","http://dx.doi.org/10.1145/1518701.1519001","Supporting the creation of hybrid museum experiences","3 ","10","100","794","authoring tools; hybrid physical-digital artifacts; prototyping; user-centered design","10","81100296314, Boriana Koleva, University of Nottingham, Nottingham, United Kingdom; 81416605898, Stefan Rennick Egglestone, University of Nottingham, Nottingham, United Kingdom; 81100504057, Holger Schn&#228;delbach, University of Nottingham, Nottingham, United Kingdom; 81337489709, Kevin Glover, University of Nottingham, Nottingham, United Kingdom; 81100557223, Chris Greenhalgh, University of Nottingham, Nottingham, United Kingdom; 81100347821, Tom Rodden, University of Nottingham, Nottingham, United Kingdom; 81416609218, Martyn Dade-Robertson, Newcastle University, Newcastle, United Kingdom; "
"CHI","09","http://dx.doi.org/10.1145/1518701.1519003","It's not what you know, but who you know: a social approach to last-resort authentication","5 ","1","45","541","human factors; security; user interfaces","10","81100609426, Stuart Schechter, Microsoft Research, Redmond, WA, USA; 81315488724, Serge Egelman, Carnegie Mellon University, Pittsburgh, PA, USA; 81100651314, Robert W. Reeder, Microsoft, Redmond, WA, USA; "
"CHI","09","http://dx.doi.org/10.1145/1518701.1519004","""When I am on Wi-Fi, I am fearless"": privacy concerns & practices in eeryday Wi-Fi use","11 ","14","123","1,441","general; security; user interfaces; wi-fi","10","81407594537, Predrag Klasnja, University of Washington, Seattle, WA, USA; 81100459425, Sunny Consolvo, Intel Research Seattle, Seattle, WA, USA; 81381591375, Jaeyeon Jung, Intel Research Seattle, Seattle, WA, USA; 81100210712, Benjamin M. Greenstein, Intel Research Seattle, Seattle, WA, USA; 81351598189, Louis LeGrand, Intel Research Seattle, Seattle, WA, USA; 81416600019, Pauline Powledge, Intel Research Seattle, Seattle, WA, USA; 81100082633, David Wetherall, Intel Research Seattle, Seattle, WA, USA; "
"CHI","09","http://dx.doi.org/10.1145/1518701.1519005","Who's viewed you?: the impact of feedback in a mobile location-sharing application","43 ","20","189","1,338","context-awareness; human factors; mobile location sharing technology; privacy; user-centered design","10","81443595473, Janice Y. Tsai, Carnegie Mellon University, Pittsburgh, PA, USA; 81384615723, Patrick Kelley, Carnegie Mellon University, Pittsburgh, PA, USA; 81416607719, Paul Drielsma, Carnegie Mellon University, Pittsburgh, PA, USA; 81100472223, Lorrie Faith Cranor, Carnegie Mellon University, Pittsburgh, PA, USA; 81408598366, Jason Hong, Carnegie Mellon University, Pittsburgh, PA, USA; 81100339054, Norman Sadeh, Carnegie Mellon University, Pittsburgh, PA, USA; "
"CHI","09","http://dx.doi.org/10.1145/1518701.1519007","Exploring websites through contextual facets","7 ","3","63","849","contextual facets; design; faceted navigation; interaction styles","10","81375605292, Yevgeniy Medynskiy, Georgia Institute of Technology, Atlanta, GA, USA; 81100654713, Mira Dontcheva, Adobe Systems, Inc., San Francisco, CA, USA; 81100090466, Steven M. Drucker, Microsoft Research, Seattle, WA, USA; "
"CHI","09","http://dx.doi.org/10.1145/1518701.1519008","Visual snippets: summarizing web pages for search and revisitation","26 ","5","89","794","design; graphical user interfaces; refinding; semantic zoom; visual snippets; web search","10","81100167805, Jaime Teevan, Microsoft Corporation, Redmond, WA, USA; 81100506242, Edward Cutrell, Microsoft Corporation, Redmond, WA, USA; 81309487122, Danyel Fisher, Microsoft Corporation, Redmond, WA, USA; 81100090466, Steven M. Drucker, Microsoft Corporation, Redmond, WA, USA; 81100092787, Gonzalo Ramos, Microsoft Corporation, Redmond, WA, USA; 81351602292, Paul Andr&#233;, University of Southampton, Southampton, United Kingdom; 81350567642, Chang Hu, University of Mayland, College Park, MD, USA; "
"CHI","09","http://dx.doi.org/10.1145/1518701.1519009","From x-rays to silly putty via Uranus: serendipity and its role in web search","9 ","11","66","483","human factors; measurement; personalization; user interfaces","4","81351602292, Paul Andr&#233;, University of Southampton, Southampton, United Kingdom; 81100167805, Jaime Teevan, Microsoft Research, Redmond, VA, USA; 81100134501, Susan T. Dumais, Microsoft Research, Redmond, VA, USA; "
"CHI","09","http://dx.doi.org/10.1145/1518701.1519010","Semantically structured tag clouds: an empirical evaluation of clustered presentation approaches","18 ","10","97","1,016","clustering; folksonomy; tag clouds","4","81100044484, Johann Schrammel, CURE - Center for Usability Research and Engineering, Vienna, Austria; 81331497408, Michael Leitner, CURE - Center for Usability Research and Engineering, Vienna, Austria; 81100481664, Manfred Tscheligi, CURE - Center for Usability Research and Engineering, Vienna, Austria; "
"CHI","09","http://dx.doi.org/10.1145/1518701.1519012","A mobile voice communication system in medical setting: love it or hate it?","6 ","6","65","496","communication strategy; human factors; miscellaneous; observational study; voice communication","10","81384594929, Charlotte Tang, University of Calgary, Calgary, AB, Canada; 81452616781, Sheelagh Carpendale, University of Calgary, Calgary, AB, Canada; "
"CHI","09","http://dx.doi.org/10.1145/1518701.1519013","Clinical evaluations and collaborative design: developing new technologies for mental healthcare interventions","14 ","11","102","863","clinical evaluations; computer gaming; human factors","10","81333488106, David Coyle, Trinity College Dublin, Dublin, Ireland; 81100175529, Gavin Doherty, Trinity College Dublin, Dublin, Ireland; "
"CHI","09","http://dx.doi.org/10.1145/1518701.1519014","<i>I just don't know why it's gone</i>: maintaining informal information use in inpatient care","17 ","11","67","662","computer-supported collaborative work; cscw; documentation; human factors; management; medical records; psychosocial information","10","81416595640, Xiaomu Zhou, University of Michigan, Ann Arbor, MI, USA; 81100017207, Mark S. Ackerman, University of Michigan, Ann Arbor, MI, USA; 81100580587, Kai Zheng, University of Michigan, Ann Arbor, MI, USA; "
"CHI","09","http://dx.doi.org/10.1145/1518701.1519016","Blogging at work and the corporate attention economy","21 ","20","123","1,234","attention economy; blogging; miscellaneous; social computing","10","81309483660, Sarita Yardi, Georgia Institute of Technology, Atlanta, GA, USA; 81100225511, Scott A. Golder, Cornell University, Ithaca, NY, USA; 81309505971, Michael J. Brzozowski, Hewlett-Packard Labs, Palo Alto, CA, USA; "
"CHI","09","http://dx.doi.org/10.1145/1518701.1519017","Learning by seeing: photo viewing in the workplace","8 ","3","51","532","acculturation; human factors; photo viewing","10","81100334243, Jennifer Thom-Santelli, Cornell University, Ithaca, NY, USA; 81100086599, David R. Millen, IBM T.J. Watson Research, Cambridge, MA, USA; "
"CHI","09","http://dx.doi.org/10.1145/1518701.1519018","Exploring awareness needs and information display preferences between coworkers","6 ","1","34","400","awareness; cscw; privacy","4","81332491415, A.J. Bernheim Brush, Microsoft Research, Redmond, WA, USA; 81100591949, Brian R. Meyers, Microsoft Research, Redmond, WA, USA; 81407592275, James Scott, Microsoft Research, Cambridge, United Kingdom; 81100190815, Gina Venolia, Microsoft Research, Redmond, WA, USA; "
"CHI","09","http://dx.doi.org/10.1145/1518701.1519019","Yours, mine and (not) ours: social influences on group information repositories","10 ","3","41","460","collaborative computing; file organization; human factors; information producers and consumers","4","81328489766, Emilee Rader, University of Michigan, Ann Arbor, MI, USA; "
"CHI","09","http://dx.doi.org/10.1145/1518701.1519021","I'm sorry, Dave: i'm afraid i won't do that: social aspects of human-agent conflict","6 ","3","81","602","disagreement; experimentation; human-robot interaction; spatial audio; user interfaces","10","81100499212, Leila Takayama, Stanford University, Stanford, CA, USA; 81416605221, Victoria Groom, Stanford University, Stanford, CA, USA; 81100153283, Clifford Nass; "
"CHI","09","http://dx.doi.org/10.1145/1518701.1519022","Machine intelligence","13 ","1","73","857","design; intelligence; miscellaneous","10","81100517358, Alex S. Taylor, Microsoft Research, Cambridge, United Kingdom; "
"CHI","09","http://dx.doi.org/10.1145/1518701.1519023","<i>Why and why not</i> explanations improve the intelligibility of context-aware intelligent systems","26 ","12","95","832","context-aware; human factors; miscellaneous","10","81416601689, Brian Y. Lim, Carnegie Mellon University, Pittsburgh, PA, USA; 81100327371, Anind K. Dey, Carnegie Mellon University, Pittsburgh, PA, USA; 81100367734, Daniel Avrahami, Intel Research Seattle, Seattle, WA, USA; "
"CHI","09","http://dx.doi.org/10.1145/1518701.1519025","An evaluation of coordination techniques for protecting objects and territories in tabletop groupware","9 ","3","76","851","awareness; computer-supported cooperative work; design; human factors; tabletop","10","81100573952, David Pinelle, National Research Council, Fredericton, NB, Canada; 81416608308, Mutasem Barjawi, University of Saskatchewan, Saskatoon, SK, Canada; 81100377766, Miguel Nacenta, University of Saskatchewan, Saskatoon, SK, Canada; 81100231855, Regan Mandryk, University of Saskatchewan, Saskatoon, SK, Canada; "
"CHI","09","http://dx.doi.org/10.1145/1518701.1519026","Territorial coordination and workspace awareness in remote tabletop collaboration","12 ","86","182","828","computer-supported cooperative work; fluidity; remote tabletop interfaces","10","81416601589, Philip Tuddenham, University of Cambridge, Cambridge, United Kingdom; 81350590377, Peter Robinson, University of Cambridge, Cambridge, United Kingdom; "
"CHI","09","http://dx.doi.org/10.1145/1518701.1519027","Fighting for control: children's embodied interactions when using physical and digital representations","27 ","4","84","595","children; embodied interaction; human factors","4","81100280485, Paul Marshall, Open University, Milton Keynes, United Kingdom; 81100013964, Rowanne Fleck, University of Sussex, Brighton, United Kingdom; 81416599940, Amanda Harris, University of Sussex, Brighton, United Kingdom; 81339524448, Jochen Rick, The Open University, Milton Keynes, United Kingdom; 81100374937, Eva Hornecker, University of Strathclyde, Glasgow, United Kingdom; 81100173923, Yvonne Rogers, The Open University, Milton Keynes, United Kingdom; 81416600158, Nicola Yuill, University of Sussex, Brighton, United Kingdom; 81100572218, Nick Sheep Dalton, The Open University, Milton Keynes, United Kingdom; "
"CHI","09","http://dx.doi.org/10.1145/1518701.1519028","Measuring the impact of third place attachment on the adoption of a place-based community technology","5 ","11","68","438","community; human factors; physical spaces; place-based community; social media; third places; web-based interaction","4","81100243264, Shelly D. Farnham; 81452615627, Joseph F. McCarthy; 81416594939, Yagnesh Patel; 81436592927, Sameer Ahuja; 81436599140, Daniel Norman; 81100103654, William R. Hazlewood; 81436596743, Josh Lind; "
"CHI","09","http://dx.doi.org/10.1145/1518701.1519030","A mischief of mice: examining children's performance in single display groupware systems with 1 to 32 mice","15 ","5","53","445","children; experimentation; large displays; miscellaneous","10","81100082877, Neema Moraveji, Stanford University, Stanford, CA, USA; 81100519232, Kori Inkpen, Microsoft Research, Redmond, WA, USA; 81100506242, Ed Cutrell, Microsoft Research, Redmond, WA, USA; 81100503904, Ravin Balakrishnan, University of Toronto, Toronto, Canada; "
"CHI","09","http://dx.doi.org/10.1145/1518701.1519031","Mobile media in the social fabric of a kindergarten","4 ","2","50","454","group and organization interfaces; intervention; mobile media","10","81416608530, Jaana N&#228;s&#228;nen, Helsinki Institute for Information Technology (HIIT), Helsinki University of Technology TKK and University of Helsinki, Espoo, Finland; 81100333050, Antti Oulasvirta, Helsinki Institute for Information Technology (HIIT), Helsinki University of Technology TKK and University of Helsinki, Espoo, Finland; 81416606388, Asko Lehmuskallio, Helsinki Institute for Information Technology (HIIT), Helsinki University of Technology TKK and University of Helsinki, Espoo, Finland; "
"CHI","09","http://dx.doi.org/10.1145/1518701.1519032","Designing with children with severe motor impairments","7 ","2","45","326","accessibility; children; design; participant observation","4","81100426680, Anthony J. Hornof, University of Oregon, Eugene, OR, USA; "
"CHI","09","http://dx.doi.org/10.1145/1518701.1519033","HeartBeat: an outdoor pervasive game for children","6 ","8","70","596","design; head up games; pervasive games","4","81416608699, Remco Magielse, Eindhoven University of Technology, Eindhoven, Netherlands; 81350577812, Panos Markopoulos, Eindhoven University of Technology, Eindhoven, Netherlands; "
"CHI","09","http://dx.doi.org/10.1145/1518701.1519035","Brain measurement for usability testing and adaptive interfaces: an example of uncovering syntactic workload with functional near infrared spectroscopy","17 ","2","114","729","brain; experimentation; human factors; workload","10","81324490057, Leanne M. Hirshfield, Tufts University, Medford, MA, USA; 81324494052, Erin Treacy Solovey, Tufts University, Medford, MA, USA; 81324489772, Audrey Girouard, Tufts University, Medford, MA, USA; 81416608677, James Kebinger, Tufts University, Medford, MA, USA; 81100438120, Robert J.K. Jacob, Tufts University, Medford, MA, USA; 81416607862, Angelo Sassaroli, Tufts University, Medford, MA, USA; 81416600157, Sergio Fantini, Tufts University, Medford, MA, USA; "
"CHI","09","http://dx.doi.org/10.1145/1518701.1519036","O' game, can you feel my frustration?: improving user's gaming experience via stresscam","8 ","8","104","772","design; experimentation; human factors; input devices and strategies; performance; stress monitoring; video games","10","81388591034, Chang Yun, University of Houston, Houston, TX, USA; 81100041487, Dvijesh Shastri, University of Houston, Houston, TX, USA; 81100120272, Ioannis Pavlidis, University of Houston, Houston, TX, USA; 81100180219, Zhigang Deng, University of Houston, Houston, TX, USA; "
"CHI","09","http://dx.doi.org/10.1145/1518701.1519037","A performance model of selection techniques for p300-based brain-computer interfaces","2 ","3","43","407","brain-computer interface; human factors; interaction technique; p300 evoked potential; theory and methods","4","81416607636, Jean-Baptiste Sauvan, INRIA/Sup&#233;l&#233;c, Rennes, France; 81100289712, Anatole L&#233;cuyer, INRIA, Rennes, France; 81414604702, Fabien Lotte, University of Lille 1/INRIA, Lille, France; 81100168597, G&#233;ry Casiez; "
"CHI","09","http://dx.doi.org/10.1145/1518701.1519038","Discriminating the relevance of web search results with measures of pupil size","4 ","5","57","488","evaluation/methodology; human factors; pupil dilation; web search results","4","81416599316, Flavio T.P. Oliveira, University of California, Berkeley, Berkeley, CA, USA; 81100241569, Anne Aula, Google, Mountain View, CA, USA; 81100589296, Daniel M. Russell, Google, Mountain View, CA, USA; "
"CHI","09","http://dx.doi.org/10.1145/1518701.1519040","Anatomy of a failure: how we knew when our design went wrong, and what we learned from it","20 ","8","114","859","design; home; miscellaneous","10","81100104022, William Gaver, Goldsmiths, University of London, London, United Kingdom; 81100260889, John Bowers, Goldsmiths, University of London, London, United Kingdom; 81328488900, Tobie Kerridge, Goldsmiths, University of London, London, United Kingdom; 81100230335, Andy Boucher, Goldsmiths, University of London, London, United Kingdom; 81416602135, Nadine Jarvis, Goldsmiths, University of London, London, United Kingdom; "
"CHI","09","http://dx.doi.org/10.1145/1518701.1519041","Getting there: six meta-principles and interaction design","12 ","9","98","902","axiology; design approaches; evaluation; management; theory; worth-centred development frameworks","10","81100175348, Gilbert Cockton, University of Sunderland, Sunderland, United Kingdom; "
"CHI","09","http://dx.doi.org/10.1145/1518701.1519042","On being supple: in search of rigor without rigidity in meeting new design and evaluation challenges for HCI practitioners","15 ","6","70","688","design; evaluation; mobile; suppleness; user interfaces","10","81100174911, Katherine Isbister, Polytechnic Institute of New York University, Brooklyn, NY, USA; 81341491415, Kristina H&#246;&#246;k, Swedish Institute of Computer Science, Kista, Sweden; "
