"conference","year","doi","title","citationCount","download6weeks","download12months","downloadAll","keywords","pageNumber","authors"
"CHI","09","http://dx.doi.org/10.1145/1518701.1518842","Graspables: grasp-recognition as a user interface","27 ","6","152","1,248","design; human factors; prototyping","10","81416606369, Brandon T. Taylor, MIT, Cambridge, MA, USA; 81100438052, V. Michael Bove, Jr., MIT, Cambridge, MA, USA; "
"CHI","09","http://dx.doi.org/10.1145/1518701.1518843","MicroRolls: expanding touch-screen input vocabulary by distinguishing rolls vs. slides of the thumb","31 ","18","270","1,650","design; human factors; interaction; microroll; one-handed; rollmark; screen design; thumb interaction; user interfaces","10","81414614562, Anne Roudaut, TELECOM ParisTech - CNRS LTCI, Alcatel-Lucent Bell Labs France, Paris, France; 81100390376, Eric Lecolinet, TELECOM ParisTech - CNRS LTCI, Paris, France; 81100143867, Yves Guiard, TELECOM ParisTech - CNRS LTCI, Paris, France; "
"CHI","09","http://dx.doi.org/10.1145/1518701.1518844","Unravelling seams: improving mobile gesture recognition with visual feedback techniques","5 ","7","61","898","gesture recognition; human factors; seamful design","4","81416602445, Sven Kratz, Deutsche Telekom Laboratories, TU Berlin, Berlin, Germany; 81405596165, Rafael Ballagas, Nokia Research Center, Palo Alto, CA, USA; "
"CHI","09","http://dx.doi.org/10.1145/1518701.1518845","Where to locate wearable displays?: reaction time performance of visual alerts from tip to toe","8 ","4","63","526","ambient information; design research; human factors; reaction time; visual alerts","4","81350573130, Chris Harrison, Carnegie Mellon University, Pittsburgh, PA, USA; 81416601689, Brian Y. Lim, Carnegie Mellon University, Pittsburgh, PA, USA; 81416607001, Aubrey Shick, Carnegie Mellon University, Pittsburgh, PA, USA; 81328488846, Scott E. Hudson, Carnegie Mellon University, Pittsburgh, PA, USA; "
"CHI","09","http://dx.doi.org/10.1145/1518701.1518847","Feed me: motivating newcomer contribution in social network sites","55 ","49","412","2,436","collaborative computing; distribution; feedback; online communities; sharing; sns; social network sites","10","81100241308, Moira Burke, Carnegie Mellon University, Pittsburgh, PA, USA; 81100515083, Cameron Marlow; 81416607555, Thomas Lento; "
"CHI","09","http://dx.doi.org/10.1145/1518701.1518848","'Helpfulness' in online communities: a measure of message quality","10 ","9","121","971","design; human factors; information quality; product reviews","10","81100101769, Jahna Otterbacher, University of Michigan, Ann Arbor, MI, USA; "
"CHI","09","http://dx.doi.org/10.1145/1518701.1518849","The problem of conflicting social spheres: effects of network structure on experienced tension in social network sites","17 ","23","207","1,771","human factors; network diversity; sns","10","81416593330, Jens Binder, University of Manchester, Manchester, United Kingdom; 81100489674, Andrew Howes, University of Manchester, Manchester, United Kingdom; 81100269401, Alistair Sutcliffe, University of Manchester, Manchester, United Kingdom; "
"CHI","09","http://dx.doi.org/10.1145/1518701.1518851","Comparing the use of tangible and graphical programming languages for informal science education","22 ","29","317","1,551","children; education; informal science education; miscellaneous; programming languages; tern","10","81328488785, Michael S. Horn, Tufts University, Medford, MA, USA; 81324494052, Erin Treacy Solovey, Tufts University, Medford, MA, USA; 81416608644, R. Jordan Crouser, Tufts University, Medford, MA, USA; 81100438120, Robert J.K. Jacob, Tufts University, Medford, MA, USA; "
"CHI","09","http://dx.doi.org/10.1145/1518701.1518852","Designers wanted: participation and the user experience in open source software development","6 ","11","85","836","codeplex; design; miscellaneous; software development","10","81100328344, Paula M. Bach, The Pennsylvania State University, University Park, PA, USA; 81350602833, Robert DeLine, Microsoft, Redmond, WA, USA; 81350576124, John M. Carroll, The Pennsylvania State University, University Park, PA, USA; "
"CHI","09","http://dx.doi.org/10.1145/1518701.1518853","Understanding how and why open source contributors use diagrams in the development of Ubuntu","1 ","3","48","579","computer-supported cooperative work; human factors; open source software; software development","10","81100158260, Koji Yatani, University of Toronto, Toronto, ON, Canada; 81416597951, Eunyoung Chung, Oregon State University, Corvalis, OR, USA; 81350577066, Carlos Jensen, Oregon State University, Corvalis, OR, USA; 81339532748, Khai N. Truong, University of Toronto, Toronto, ON, Canada; "
"CHI","09","http://dx.doi.org/10.1145/1518701.1518855","Comparing usage of a large high-resolution display to single or dual desktop displays for daily work","26 ","9","98","879","experimentation; miscellaneous","10","81309485662, Xiaojun Bi, University of Toronto, Toronto, ON, Canada; 81100503904, Ravin Balakrishnan, University of Toronto, Toronto, ON, Canada; "
"CHI","09","http://dx.doi.org/10.1145/1518701.1518856","DICE: designing conference rooms for usability","1 ","1","44","429","design; miscellaneous; ubiquitous computing","10","81100169417, Gene Golovchinsky, FX Palo Alto Laboratory, Inc., Palo Alto, CA, USA; 81100507433, Pernilla Qvarfordt, FX Palo Alto Laboratory, Inc., Palo Alto, CA, USA; 81545535556, Bill van Melle, FX Palo Alto Laboratory, Inc., Palo Alto, CA, USA; 81405594119, Scott Carter, FX Palo Alto Laboratory, Inc., Palo Alto, CA, USA; 81309499008, Tony Dunnigan, FX Palo Alto Laboratory, Inc., Palo Alto, CA, USA; "
"CHI","09","http://dx.doi.org/10.1145/1518701.1518857","Arrow tag: a direction-key-based technique for rapidly selecting hyperlinks while gazing at a screen","0 ","1","40","413","direction keys; input devices and strategies; target selection; web browser","4","81416598036, Atsuhiko Maeda, NTT Cyber Solutions Laboratories, NTT Corporation, Yokosuka, Japan; 81100024909, Hirohito Inagaki, NTT Cyber Solutions Laboratories, NTT Corporation, Yokosuka, Japan; 81502732326, Masanobu Abe, NTT Cyber Solutions Laboratories, NTT Corporation, Yokosuka, Japan; "
"CHI","09","http://dx.doi.org/10.1145/1518701.1518858","What's ""this"" you say?: the use of local references on distant displays","3 ","1","41","384","discourse; field of view; large display","4","81416596129, Patti Bao, Northwestern University, Evanston, IL, USA; 81100246470, Darren Gergle, Northwestern University, Evanston, IL, USA; "
"CHI","09","http://dx.doi.org/10.1145/1518701.1518860","It's not easy being green: understanding home computer power management","23 ","25","168","1,329","home computer use; miscellaneous; sustainability","10","81328487724, Marshini Chetty, Georgia Institute of Technology, Atlanta, GA, USA; 81332491415, A.J. Bernheim Brush, Microsoft Research, Seattle, WA, USA; 81100591949, Brian R. Meyers, Microsoft Research, Seattle, WA, USA; 81416608130, Paul Johns, Microsoft Research, Seattle, WA, USA; "
"CHI","09","http://dx.doi.org/10.1145/1518701.1518861","UbiGreen: investigating a mobile tool for tracking and supporting green transportation habits","92 ","46","429","1,933","ambient displays; miscellaneous; sensing; transportation","10","81331492504, Jon Froehlich, University of Washington, Seattle, WA, USA; 81416606961, Tawanna Dillahunt, Carnegie Mellon University, Pittsburgh, PA, USA; 81407594537, Predrag Klasnja, University of Washington, Seattle, WA, USA; 81100650762, Jennifer Mankoff, Carnegie Mellon University, Pittsburgh, PA, USA; 81100459425, Sunny Consolvo, Intel Research, Seattle, WA, USA; 81100010116, Beverly Harrison, Intel Research, Seattle, WA, USA; 81100103519, James A. Landay, University of Washington, Seattle, WA, USA; "
"CHI","09","http://dx.doi.org/10.1145/1518701.1518862","Understanding why we preserve some things and discard others in the context of interaction design","40 ","25","230","1,189","consumer products; design theory; markets; personal inventories; sustainable interaction design","10","81350582655, William Odom, Indiana University at Bloomington, Bloomington, IN, USA; 81100303073, James Pierce, Indiana University at Bloomington, Bloomington, IN, USA; 81100118833, Erik Stolterman, Indiana University at Bloomington, Bloomington, IN, USA; 81100365314, Eli Blevis, Indiana University at Bloomington, Bloomington, IN, USA; "
"CHI","09","http://dx.doi.org/10.1145/1518701.1518864","Empirical evaluation for finger input properties in multi-touch interaction","30 ","42","555","3,253","area; empirical evaluation; finger input property; input devices and strategies; orientation","10","81416592938, Feng Wang, Kochi University of Technology, Kochi, Japan; 81100597892, Xiangshi Ren, Kochi University of Technology, Kochi, Japan; "
"CHI","09","http://dx.doi.org/10.1145/1518701.1518865","The design and evaluation of multi-finger mouse emulation techniques","20 ","14","105","1,530","human factors; interaction styles; multi-finger input","10","81100153192, Justin Matejka; 81100477897, Tovi Grossman; 81416604643, Jessica Lo; 81100585120, George Fitzmaurice; "
"CHI","09","http://dx.doi.org/10.1145/1518701.1518866","User-defined gestures for surface computing","157 ","85","858","3,737","design; gesture recognition; guessability; interaction styles; signs; tabletop; user-centered design","10","81100086173, Jacob O. Wobbrock, University of Washington, Seattle, WA, USA; 81452607037, Meredith Ringel Morris, Microsoft Research, Redmond, WA, USA; 81350567780, Andrew D. Wilson, Microsoft Research, Redmond, WA, USA; "
"CHI","09","http://dx.doi.org/10.1145/1518701.1518868","Improving visual search with image segmentation","5 ","4","63","634","graphical user interfaces; image presentation; segmentation","10","81100584798, Clifton Forlines, Mitsubishi Electric Research Labs, University of Toronto, Cambridge, USA; 81100503904, Ravin Balakrishnan, University of Toronto, Toronto, Canada; "
"CHI","09","http://dx.doi.org/10.1145/1518701.1518869","PhotoScope: visualizing spatiotemporal coverage of photos for construction management","3 ","3","168","920","construction management; evaluation/methodology; human factors; management; spatiotemporal coverage; workflow management","10","81361596860, Fuqu Wu, University of Victoria, Victoria, BC, Canada; 81100424672, Melanie Tory, University of Victoria, Victoria, BC, Canada; "
"CHI","09","http://dx.doi.org/10.1145/1518701.1518870","Graph sketcher: extending illustration to quantitative graphs","1 ","3","164","882","charting; graphical user interfaces; illustration; planar map coloring; snap-dragging","4","81538037556, Robin Stewart, MIT CSAIL, Cambridge, MA, USA; 81311483103, m.c. schraefel, University of Southampton, Highfield, United Kingdom; "
"CHI","09","http://dx.doi.org/10.1145/1518701.1518871","SiteLens: situated visualization techniques for urban site visits","3 ","5","74","687","artificial, augmented, and virtual realities; data curation; experimentation; human factors; site visits; urban design","4","81313481954, Sean White, Columbia University, New York, NY, USA; 81100427474, Steven Feiner, Columbia University, New York, NY, USA; "
"CHI","09","http://dx.doi.org/10.1145/1518701.1518873","Design research as explanation: perceptions in the field","2 ","9","83","699","design research; theories of explanation; theory and methods","10","81100410098, Steven R. Haynes, The Pennsylvania State University, University Park, PA, USA; 81350576124, John M. Carroll, The Pennsylvania State University, University Park, PA, USA; 81100137586, Thomas G. Kannampallil, The Pennsylvania State University, University Park, PA, USA; 81450593533, Lu Xiao, The Pennsylvania State University, University Park, PA, USA; 81100328344, Paula M. Bach, The Pennsylvania State University, University Park, PA, USA; "
"CHI","09","http://dx.doi.org/10.1145/1518701.1518874","Framing design in the third paradigm","5 ","8","111","734","design; experimentation; reflective practice; user-centered design; user/machine systems","10","81436592252, Salu Ylirisku, The University of Art and Design Helsinki, Helsinki, Finland; 81100046284, Virtu Halttunen, University of Oulu, Oulu, Finland; 81384619973, Johanna Nuojua, University of Oulu, Oulu, Finland; 81416608966, Antti Juustila, University of Oulu, Oulu, Finland; "
"CHI","09","http://dx.doi.org/10.1145/1518701.1518875","Values as lived experience: evolving value sensitive design in support of value discovery","27 ","23","112","680","design; fieldwork; photo elicitation; value sensitive design","10","81367592039, Christopher A. Le Dantec, Georgia Institute of Technology, Atlanta, GA, USA; 81339522411, Erika Shehan Poole, Georgia Institute of Technology, Atlanta, GA, USA; 81314492849, Susan P. Wyche, Georgia Institute of Technology, Atlanta, GA, USA; "
"CHI","09","http://dx.doi.org/10.1145/1518701.1518877","Body and mind: a study of avatar personalization in three virtual worlds","22 ","29","320","1,668","artificial, augmented, and virtual realities; customization; personality","10","81100116901, Nicolas Ducheneaut, Palo Alto Research Center, Palo Alto, CA, USA; 81423595831, Ming-Hui Wen, National Chiao-Tung University, Hsinchu, Taiwan Roc; 81319504922, Nicholas Yee, Palo Alto Research Center, Palo Alto, CA, USA; 81309499961, Greg Wadley, The University of Melbourne, Parkville, Australia; "
"CHI","09","http://dx.doi.org/10.1145/1518701.1518878","Capturing and sharing memories in a virtual world","3 ","4","54","683","design; memories; second life; virtual worlds","10","81100495977, Carman Neustaedter, Kodak Research Labs, Rochester, NY, USA; 81435606538, Elena Fedorovskaya, Kodak Research Labs, Rochester, NY, USA; "
"CHI","09","http://dx.doi.org/10.1145/1518701.1518879","In support of city exploration","5 ","1","56","621","city guide; design; performance","10","81416608206, Ben Bedwell, University of Nottingham, Nottingham, United Kingdom; 81100504057, Holger Schn&#228;delbach, University of Nottingham, Nottingham, United Kingdom; 81100619971, Steve Benford, University of Nottingham, Nottingham, United Kingdom; 81100347821, Tom Rodden, University of Nottingham, Nottingham, United Kingdom; 81100296314, Boriana Koleva, University of Nottingham, Nottingham, United Kingdom; "
"CHI","09","http://dx.doi.org/10.1145/1518701.1518881","Input-agreement: a new mechanism for collecting data using human computation games","37 ","17","170","802","design; human computation; tagging","10","81100048165, Edith Law, Carnegie Mellon University, Pittsburgh, PA, USA; 81100069810, Luis von Ahn, Carnegie Mellon University, Pittsburgh, PA, USA; "
"CHI","09","http://dx.doi.org/10.1145/1518701.1518882","Matchin: eliciting user preferences with an online game","22 ","27","119","736","experimentation; human factors; preference elicitation","10","81416605493, Severin Hacker, Carnegie Mellon University, Pittsburgh, PA, USA; 81100069810, Luis von Ahn, Carnegie Mellon University, Pittsburgh, PA, USA; "
"CHI","09","http://dx.doi.org/10.1145/1518701.1518883","Mixing it up: recommending collections of items","9 ","8","53","598","automatic playlist generation; collection recommender systems; design; music; playlist","10","81311486004, Derek L. Hansen, University of Maryland, College Park, MD, USA; 81100123477, Jennifer Golbeck, University of Maryland, College Park, MD, USA; "
"CHI","09","http://dx.doi.org/10.1145/1518701.1518885","Tabletop displays for small group study: affordances of paper and digital materials","34 ","11","326","1,451","affordance; collaborative computing; education; human factors; paper; tabletop","10","81316490036, Anne Marie Piper, University of California, San Diego, La Jolla, CA, USA; 81332504463, James D. Hollan, University of California, San Diego, La Jolla, CA, USA; "
"CHI","09","http://dx.doi.org/10.1145/1518701.1518886","WeSpace: the design development and deployment of a walk-up and share multi-surface visual collaboration system","48 ","33","360","1,514","collaborative computing; computer-supported cooperative work; human factors; shared-display groupware","10","81100606762, Daniel Wigdor, Harvard University, Cambridge, USA; 81416606428, Hao Jiang, Mitsubishi Electric Research Labs, Tsinghua University, Cambridge, Beijing, China; 81100584798, Clifton Forlines, Mitsubishi Electric Research Labs, Cambridge, USA; 81350585455, Michelle Borkin, Harvard University, Cambridge, USA; 81100343583, Chia Shen, Harvard University, Cambridge, USA; "
"CHI","09","http://dx.doi.org/10.1145/1518701.1518887","CThru: exploration in a video-centered information space for educational purposes","1 ","2","53","692","design; multimedia information systems; video-centered information space","4","81416606428, Hao Jiang, Tsinghua University, Beijing, China; 81416609081, Alain Viel, Harvard University, Cambridge, MA, USA; 81416607897, Meekal Bajaj, Georgia Institute of Technology, Atlanta, GA, USA; 81416609286, Robert A. Lue, Harvard University, Cambridge, MA, USA; 81100343583, Chia Shen, Harvard University, Cambridge, MA, USA; "
"CHI","09","http://dx.doi.org/10.1145/1518701.1518888","Turning the tables: an interactive surface for vjing","8 ","10","73","857","collaboration; interactive surface; tabletop; vjing","4","81381590706, Stuart Taylor, Microsoft Research Cambridge, Cambridge, United Kingdom; 81328488768, Shahram Izadi, Microsoft Research Cambridge, Cambridge, United Kingdom; 81100166914, David Kirk, Microsoft Research Cambridge, Cambridge, United Kingdom; 81452613064, Richard Harper, Microsoft Research Cambridge, Cambridge, United Kingdom; 81381610378, Armando Garcia-Mendoza, Microsoft Research Cambridge, Cambridge, United Kingdom; "
"CHI","09","http://dx.doi.org/10.1145/1518701.1518890","An experimental study of field dependency in altered Gz environments","0 ","1","32","283","comparative informatics; evaluation/methodology; extreme environments; human factors; mobile devices; performance; target acquisition; theory and methods","10","81416608573, Marc A. Le Pape, University of Hawai'i at Manoa, Honolulu, HI, USA; 81375593285, Ravi K. Vatrapu, Copenhagen Business School, Frederiksberg, Denmark; "
"CHI","09","http://dx.doi.org/10.1145/1518701.1518891","Taking the time to care: empowering low health literacy hospital patients with virtual nurse agents","17 ","12","127","749","design; evaluation/methodology; graphical user interfaces; health literacy; interaction styles; natural language; relational agent; universal access","10","81100360895, Timothy W. Bickmore, Northeastern University, Boston, MA, USA; 81381591529, Laura M. Pfeifer, Northeastern University, Boston, MA, USA; 81416607104, Brian W. Jack, Boston University School of Medicine, Boston, MA, USA; "
"CHI","09","http://dx.doi.org/10.1145/1518701.1518892","Evaluation of a tool-mounted guidance display for computer-assisted surgery","1 ","2","33","247","hand-held displays; surgical guidance interfaces; user interfaces","4","81416607215, Kevin Kassil, Queen's University, Kingston, ON, Canada; 81100264012, A. James Stewart, Queen's University, Kingston, ON, Canada; "
"CHI","09","http://dx.doi.org/10.1145/1518701.1518893","Towards human-centered support for indoor navigation","10 ","4","74","562","design; indoor navigation; user-centered design","4","81363601116, Leonardo Ramirez, Fraunhofer Institute for Applied Information Technology FIT, Sankt Augustin, Germany; 81363603319, Sebastian Denef, Fraunhofer Institute for Applied Information Technology FIT, Sankt Augustin, Germany; 81363605889, Tobias Dyrks, Fraunhofer Institute for Applied Information Technology FIT, Sankt Augustin, Germany; "
"CHI","09","http://dx.doi.org/10.1145/1518701.1518895","EnsembleMatrix: interactive visualization to support machine learning with multiple classifiers","15 ","6","81","503","caltech-101; ensemble classifiers; interactive machine learning; object recognition","10","81100516544, Justin Talbot, Stanford, Stanford, CA, USA; 81409593205, Bongshin Lee, Microsoft Research, Redmond, WA, USA; 81100301388, Ashish Kapoor, Microsoft Research, Redmond, WA, USA; 81100255664, Desney S. Tan, Microsoft Research, Redmond, WA, USA; "
"CHI","09","http://dx.doi.org/10.1145/1518701.1518896","FacetLens: exposing trends and relationships to support sensemaking within faceted datasets","23 ","5","87","880","design; graphical user interfaces; relationships; trends","10","81409593205, Bongshin Lee, Microsoft Research, Redmond, WA, USA; 81351602807, Greg Smith, Microsoft Research, Redmond, WA, USA; 81452612822, George G. Robertson, Microsoft Research, Redmond, WA, USA; 81100280834, Mary Czerwinski, Microsoft Research, Redmond, WA, USA; 81100255664, Desney S. Tan, Microsoft Research, Redmond, WA, USA; "
"CHI","09","http://dx.doi.org/10.1145/1518701.1518897","Sizing the horizon: the effects of chart size and layering on the graphical perception of time series visualizations","16 ","28","189","889","experimentation; horizon graphs; line charts; user interfaces","10","81100465553, Jeffrey Heer, Stanford University, Stanford, CA, USA; 81328489071, Nicholas Kong, University of California, Berkeley, Berkeley, CA, USA; 81100346089, Maneesh Agrawala, University of California, Berkeley, Berkeley, CA, USA; "
"CHI","09","http://dx.doi.org/10.1145/1518701.1518899","Call browser: a system to improve the caller experience by analyzing live calls end-to-end","0 ","3","47","375","call center analytics; design; interactive voice response; reliability; state diagrams; voice user interfaces","10","81100059950, Bernhard Suhm, BBN Technologies, Cambridge, MA, USA; 81329491340, Pat Peterson, BBN Technologies, Cambridge, MA, USA; "
"CHI","09","http://dx.doi.org/10.1145/1518701.1518900","Finding canonical behaviors in user protocols","1 ","0","26","305","algorithms; protocol analysis; user interfaces; web browsing","4","81416608682, Walter C. Mankowski, Drexel University, Philadelphia, PA, USA; 81416608326, Peter Bogunovich, Drexel University, Philadelphia, PA, USA; 81100377116, Ali Shokoufandeh, Drexel University, Philadelphia, PA, USA; 81100289294, Dario D. Salvucci, Drexel University, Philadelphia, PA, USA; "
"CHI","09","http://dx.doi.org/10.1145/1518701.1518901","Reduced empathizing skills increase challenges for user-centered design","0 ","3","47","446","designer behavior; human factors; user-centered design","4","81100570773, William Hudson; "
"CHI","09","http://dx.doi.org/10.1145/1518701.1518903","An intuitive model of perceptual grouping for HCI design","3 ","6","80","663","algorithms; design; good continuation; human factors; proximity; theory","10","81100414889, Ruth Rosenholtz, MIT, Cambridge, MA, USA; 81416609026, Nathaniel R. Twarog, MIT, Cambridge, MA, USA; 81416609142, Nadja Schinkel-Bielefeld, MIT, Cambridge, MA, USA; 81100331534, Martin Wattenberg, IBM Watson Research, Cambridge, MA, USA; "
"CHI","09","http://dx.doi.org/10.1145/1518701.1518904","Development of decision rationale in complex group decision making","1 ","10","92","651","cscw; experimentation; rationale","10","81100393102, Helena M. Mentis, The Pennsylvania State University, University Park, PA, USA; 81100328344, Paula M. Bach, The Pennsylvania State University, University Park, PA, USA; 81416605187, Blaine Hoffman, The Pennsylvania State University, University Park, PA, USA; 81335496622, Mary Beth Rosson, The Pennsylvania State University, University Park, PA, USA; 81350576124, John M. Carroll, The Pennsylvania State University, University Park, PA, USA; "
"CHI","09","http://dx.doi.org/10.1145/1518701.1518905","Learning to predict information needs: context-aware display as a cognitive aid and an assessment tool","1 ","4","57","617","adaptive display; context-aware computing; experimentation; human factors","10","81100378244, Bradley C. Love, The University of Texas at Austin, Austin, TX, USA; 81416595997, Matt Jones, University of Colorado at Boulder, Boulder, CO, USA; 81416605850, Marc T. Tomlinson, The University of Texas at Austin, Austin, TX, USA; 81416604319, Michael Howe, The University of Texas at Austin, Austin, TX, USA; "
"CHI","09","http://dx.doi.org/10.1145/1518701.1518907","backchan.nl: integrating backchannels in physical space","4 ","3","45","340","backchannel; design; web-based interaction","10","81350583956, Drew Harry, MIT, Cambridge, MA, USA; 81406593744, Joshua Green, MIT, Cambridge, MA, USA; 81100223099, Judith Donath, MIT, Cambridge, MA, USA; "
"CHI","09","http://dx.doi.org/10.1145/1518701.1518908","Learning how: the search for craft knowledge on the internet","27 ","17","130","804","craft; expertise locating; how-to; informal learning; miscellaneous; social search","10","81310500984, Cristen Torrey, Carnegie Mellon University, Pittsburgh, PA, USA; 81100143170, Elizabeth F. Churchill, Yahoo! Research, Santa Clara, CA, USA; 81406596787, David W. McDonald, University of Washington, Seattle, WA, USA; "
"CHI","09","http://dx.doi.org/10.1145/1518701.1518909","Resonance on the web: web dynamics and revisitation patterns","21 ","6","71","623","change; hypertext/hypermedia; re-finding; revisitation; web log analysis","10","81100589033, Eytan Adar, University of Washington, Seattle, WA, USA; 81100167805, Jaime Teevan, Microsoft Research, Redmond, WA, USA; 81100134501, Susan T. Dumais, Microsoft Research, Redmond, WA, USA; "
"CHI","09","http://dx.doi.org/10.1145/1518701.1518911","DynaSpot: speed-dependent area cursor","18 ","9","93","859","area cursor; design; experimentation; human factors; performance","10","81319489300, Olivier Chapuis, LRI - University Paris-Sud & CNRS; INRIA, Orsay, France; 81309503263, Jean-Baptiste Labrune, MIT Media Lab, Cambridge, MA, USA; 81100222004, Emmanuel Pietriga, INRIA; LRI - Univ. Paris-Sud & CNRS, Orsay, France; "
