"conference","year","doi","title","citationCount","download6weeks","download12months","downloadAll","keywords","pageNumber","authors"
"CHI","89","http://dx.doi.org/10.1145/67449.67451","Generalization, consistency, and control","2 ","1","14","619","design; human factors; systems analysis and design","5","81100349845, C. Lewis, Univ. of Colorado, Boulder, CO; 81100288195, D. C. Hair, Univ. of Colorado, Boulder, CO; 81100182722, V. Schoenberg, Univ. of Colorado, Boulder, CO; "
"CHI","89","http://dx.doi.org/10.1145/67449.67452","Artifact as theory-nexus: hermeneutics meets theory-based design","36 ","0","25","1,075","computer-assisted instruction; human factors; management; theory","8","81350576124, J. M. Carroll, IBM Watson Research Center, Yorktown Heights, NY; 81100457150, W. A. Kellogg, IBM Watson Research Center, Yorktown Heights, NY; "
"CHI","89","http://dx.doi.org/10.1145/67449.67453","Programmable user models for predictive evaluation of interface designs","34 ","3","43","731","applications; human factors; languages; systems analysis and design","5","81100514029, R. M. Young, MRC Applied Psychology Unit, Cambridge, UK; 81100201414, T. R. G. Green, MRC Applied Psychology Unit, Cambridge, UK; 81100526397, T. Simon, MRC Applied Psychology Unit, Cambridge, UK; "
"CHI","89","http://dx.doi.org/10.1145/67449.67454","Experience with contextual field research","1 ","0","10","290","experimentation; human factors; systems analysis and design","4","81100090422, M. Good, Digital Equipment Corporation, Nashua, NH; 81100212332, R. Campbell, IBM; 81339515323, G. Lynch, Univ. of York, Jamaica, NY; 81332536218, P. Wright; "
"CHI","89","http://dx.doi.org/10.1145/67449.67455","Color in user interface design: functionally and aesthetics","2 ","7","42","1,937","computer selection; human factors; interaction techniques","3","81544840656, A. Marcus, Univ. of Waterloo, Ontario, Canada; 81410592379, W. B. Cowan, Hewlett-Packard Labs., Palo Alto, CA; 81537711956, W. Smith; "
"CHI","89","http://dx.doi.org/10.1145/67449.67456","LIZA: an extensible groupware toolkit","24 ","1","14","281","design; human factors; management; user interfaces","7","81542837756, S. J. Gibbs, MCC, Software Technology Program, Austin, TX; "
"CHI","89","http://dx.doi.org/10.1145/67449.67457","Collaboration in KMS, a shared hypermedia system","7 ","0","16","357","data models; human factors; interaction techniques","6","81332537065, E. Yoder; 81100120280, R. Akscyn; 81100018231, D. McCracken; "
"CHI","89","http://dx.doi.org/10.1145/67449.67458","The effects of bargaining orientation and communication medium on negotiations in the bilateral monopoly task: a comparison of decision room and computer conferencing communication media","3 ","1","14","427","computer conferencing, teleconferencing, and videoconferencing; human factors; theory","6","81100246296, J. Sheffield, Univ. of Auckland, Auckland, New Zealand; "
"CHI","89","http://dx.doi.org/10.1145/67449.67459","University of Colorado at Boulder, Institute of cognitive science","0 ","0","7","80","computer science education; experimentation; human factors; management","2","81409592298, G. Fischer, Univ. of Colorado, Boulder; 81100528996, S. Doane, Univ. of Colorado, Boulder; "
"CHI","89","http://dx.doi.org/10.1145/67449.67460","What is EuroParc?","0 ","2","11","178","experimentation; human factors; management","2","81407594532, T. P. Moran; "
"CHI","89","http://dx.doi.org/10.1145/67449.67461","NYNEX intelligent systems group","0 ","0","9","127","computer-assisted instruction; documentation; human factors","2","81100571618, M. E. Atwood; "
"CHI","89","http://dx.doi.org/10.1145/67449.67462","NASA Johnson Space Center, Human-Computer Interaction","0 ","0","16","256","aerospace; documentation; human factors; interaction techniques; systems analysis and design","2","81339525705, M. Rudisill, NASA Johnson Space Center, Houston, TX; 81100246269, D. J. Gillan, Lockheed Engineering & Sciences Company, Houston, TX; "
"CHI","89","http://dx.doi.org/10.1145/67449.67463","Inducing programs in a direct-manipulation environment","18 ","0","13","212","design; human factors; interaction techniques; theory","6","81100340093, D. L. Maulsby, Univ. of Calgary, Calgary, Canada; 81100252005, I. H. Witten, Univ. of Calgary, Calgary, Canada; "
"CHI","89","http://dx.doi.org/10.1145/67449.67464","A system for example-based programming","12 ","2","24","204","design; human factors; management; program editors; software development","6","81442620233, L. R. Neal, Harvard Univ., Cambridge, MA; "
"CHI","89","http://dx.doi.org/10.1145/67449.67465","Some strategies of reuse in an object-oriented programming environment","29 ","3","34","479","design; human factors; methodologies","5","81547376356, B. M. Lange, Univ. of Illinois, Chicago; 81100538646, T. G. Moher, Univ. of Illinois, Chicago; "
"CHI","89","http://dx.doi.org/10.1145/67449.67466","A spreadsheet interface for logic programming","20 ","2","21","423","application packages; human factors; interaction techniques; languages; prolog","6","81100171476, M. Spenke; 81100228113, C. Beilken; "
"CHI","89","http://dx.doi.org/10.1145/67449.67467","On-line tutorials: What kind of inference leads to the most effective learning?","2 ","1","17","307","computer-assisted instruction; documentation; human factors; training","3","81100576470, J. B. Black, Columbia Univ., New York, NY; 81100549535, J. S. Bechtold, Columbia Univ., New York, NY; 81100256018, M. Mitrani, Columbia Univ., New York, NY; 81350576124, J. M. Carroll, IBM Thomas J. Watson Research Center; "
"CHI","89","http://dx.doi.org/10.1145/67449.67468","How some advice fails","5 ","0","9","155","design; human factors; management; training","6","81100454370, W. C. Hill, MCC Human Interface Labs., Austin, TX; "
"CHI","89","http://dx.doi.org/10.1145/67449.67469","Responding to :20HUH?&rdquo;: answering vaguely articulated follow-up questions","8 ","0","9","165","computer-assisted instruction; human factors","6","81100045785, J. D. Moore, Univ. of California, Los Angeles; "
"CHI","89","http://dx.doi.org/10.1145/67449.67470","Protecting user interfaces through copyright: the debate","2 ","0","14","379","copyrights; human factors; lotus 1-2-3; user interfaces","8","81100661766, P. Samuelson, Univ. of Pittsburgh Law School, Pittsburgh, PA; "
"CHI","89","http://dx.doi.org/10.1145/67449.67471","Drama and personality in user interface design","4 ","0","22","427","design; human factors; systems analysis and design","4","81100604755, S. J. Mountford, Apple:2E Company, Cupertino, CA; 81452616421, B. Buxton, Apple Computer; 81100204270, M. Krueger; 81100603693, B. Laurel; 81100270631, L. Vertelney; "
"CHI","89","http://dx.doi.org/10.1145/67449.67472","Cumulating the science of HCI: from s-R compatibility to transcription typing","11 ","2","28","412","algorithms; human factors; human information processing; theory","6","81100482886, B. E. John, Carnegie Mellon Univ., Pittsburgh, PA; 81100393604, A. Newell, Carnegie Mellon Univ., Pittsburgh, PA; "
"CHI","89","http://dx.doi.org/10.1145/67449.67473","Learning and transfer of measurement tasks","5 ","0","11","129","design; human factors; theory","6","81100385391, A. Y. Lee, Univ. of Colorado, Boulder, CO; 81100564360, P. G. Polson, Univ. of Colorado, Boulder, CO; 81100645102, W. A. Bailey, Univ. of Colorado, Boulder, CO; "
"CHI","89","http://dx.doi.org/10.1145/67449.67474","Skilled financial planning: the cost of translating ideas into action","19 ","2","17","413","application packages; financial; human factors; performance","6","81100223021, F. J. Lerch, Carnegie Mellon Univ., Pittsburgh, PA; 81100372271, M. M. Mantei, Univ. of Toronto; 81406595878, J. R. Olson, Univ. of Michigan, Ann Arbor, MI; "
"CHI","89","http://dx.doi.org/10.1145/67449.67475","A case study of user interface management system development and application","2 ","0","9","336","design; human factors; user interfaces","6","81100350914, J. M. Manheimer; 81100337170, R. C. Burnett; 81100550226, J. A. Wallers; "
"CHI","89","http://dx.doi.org/10.1145/67449.67476","A high-level user interface management system","20 ","3","18","275","design; human factors","6","81100278882, G. Singh, National Univ. of Singapore, Kent Ridge; 81332501956, M. Green, Univ. of Alberta, Alberta, Canada; "
"CHI","89","http://dx.doi.org/10.1145/67449.67477","Graphical specification of user interfaces with behavior abstraction","3 ","0","13","352","design; human factors; user interfaces","6","81100017024, J. F. DeSoi, Texas A&M Univ., College Station; 81100002674, W. M. Lively, Texas A&M UNiv., College Station; 81332527126, S. V. Sheppard, Texas A&M Univ., College Station; "
"CHI","89","http://dx.doi.org/10.1145/67449.67478","Center for coordination science, MIT","0 ","0","8","167","human factors; organizational impacts","2","81100548740, T. W. Malone, Massachusetts Institute of Technology, Cambridge, MA; "
"CHI","89","http://dx.doi.org/10.1145/67449.67479","CHI research at MCC","0 ","0","8","166","design; human factors; methodologies","3","81332504463, J. Hollan, Microelectronics and Computer Technology Corporation; 81332495004, B. Curtis, Microelectronics and Computer Technology Corporation; "
"CHI","89","http://dx.doi.org/10.1145/67449.67480","Cognitive science and machine intelligence laboratory, University of Michigan","0 ","0","12","193","human factors; management; theory","2","81100178543, G. M. Olson, Univ. of Michigan, Ann Arbor, MI; "
"CHI","89","http://dx.doi.org/10.1145/67449.67481","The ergonomics psychology project at Inria","0 ","0","12","251","human factors","2","81100489330, A. Bisseret, INRIA, France; "
"CHI","89","http://dx.doi.org/10.1145/67449.67482","Bat brushes: on the uses of six position and orientation parameters in a paint program","4 ","2","15","332","color, shading, shadowing, and texture; human factors; input devices","6","81100446762, C. Ware, Univ. of New Brunswick, New Brunswick, Canada; 81100207485, C. Baxter, Univ. of New Brunswick, New Brunswick, Canada; "
"CHI","89","http://dx.doi.org/10.1145/67449.67483","Circling: a method of mouse-based selection without button presses","1 ","0","11","239","human factors; input devices","6","81544465756, J. C. Jackson, Carnegie Mellon Univ., Pittsburgh, PA; 81100159987, R. J. Roske-Hofstrand, NASA Ames Research Center, Moffett Field, CA; "
"CHI","89","http://dx.doi.org/10.1145/67449.67484","Systemic implications of leap and an improved two-part cursor","0 ","1","16","187","human factors; interaction techniques","4","81100214678, J. Raskin; "
"CHI","89","http://dx.doi.org/10.1145/67449.67485","A programming language basis for user interface","25 ","1","28","420","apple; human factors; interaction techniques; pascal","6","81410595121, D. R. Olsen, Jr., Brigham Young Univ., Provo, UT; "
"CHI","89","http://dx.doi.org/10.1145/67449.67486","Statemaster: A UIMS based on statecharts for prototyping and target implementation","15 ","0","10","358","c++; human factors; languages; rapid prototyping","6","81546418256, P. D. Wellner, Xerox Corporation, Rochester, NY; "
"CHI","89","http://dx.doi.org/10.1145/67449.67487","Task-oriented representation of asynchronous user interfaces","9 ","0","14","423","apple; human factors; interaction techniques","6","81100498699, A. C. Siochi, Virginia Tech, Blacksburg, VA; 81100488487, H. R. Hartson, Virginia Tech, Blacksburg, VA; "
"CHI","89","http://dx.doi.org/10.1145/67449.67488","Innovation in user interface development: obstacles and opportunities","8 ","3","14","421","design; human factors; software development; standards","5","81100102525, S. E. Poltrock, Microelectronics & Computer Technology Corporation, Austin, TX; "
"CHI","89","http://dx.doi.org/10.1145/67449.67489","User interface design in large corporations: coordination and communication across disciplines","20 ","1","30","601","design; human factors; software development","7","81100031531, J. Grudin, Microelectronics & Computer Technology Corporation, Austin, TX; 81100102525, S. E. Poltrock, Microelectronics & Computer Technology Corporation, Austin, TX; "
"CHI","89","http://dx.doi.org/10.1145/67449.67490","Behavioral evaluation and analysis of a hypertext browser","34 ","3","17","423","content analysis and indexing; experimentation; information search and retrieval; measurement; systems and software","6","81100209082, Dennis E. Egan, Bellcore, Morristown, NJ; 81100564585, Joel R. Remde, Bellcore, Morristown, NJ; 81100552367, Thomas K. Landauer, Bellcore, Morristown, NJ; 81100247865, Carol C. Lochbaum, Bellcore, Morristown, NJ; 81100403758, L. M. Gomez, Bellcore, Morristown, NJ; "
"CHI","89","http://dx.doi.org/10.1145/67449.67491","How do experienced information lens users use rules?","24 ","0","17","316","electronic mail; human factors","6","81100236706, W. E. Mackay, Massachusetts Institute of Technology; 81100548740, T. W. Malone, Massachusetts Institute of Technology; 81100075918, K. Crowston, Massachusetts Institute of Technology; 81100591911, R. Rao, Xerox Palo Alto Research Center; 81100154204, D. Rosenblitt, Massachusetts Institute of Technology; 81406592524, S. K. Card, Xerox Palo Alto Reserch Center; "
"CHI","89","http://dx.doi.org/10.1145/67449.67492","Performance, preference, and visual scan patterns on a menu-based system: implications for interface design","6 ","3","19","570","design; human factors; query formulation","6","81332503731, J. J. Hendrickson, Texas Instruments, Incorporated, Dallas, TX; "
"CHI","89","http://dx.doi.org/10.1145/67449.67493","My user interface is the best because...","0 ","0","13","235","apple; human factors","3","81100536170, A. B. Farrand, Apple Computer; 81100235869, T. Erickson; 81100400209, T. Hoeber; 81100404934, B. Parkhurst; 81332535833, T. Wilson; "
"CHI","89","http://dx.doi.org/10.1145/67449.67494","Synergistic use of direct manipulation and natural language","51 ","1","14","196","human factors; interaction techniques","7","81100149856, P. R. Cohen, SRI International, Menlo Park, CA; 81100493697, M. Dalrymple, SRI International, Menlo Park, CA; 81100516225, D. B. Moran, SRI International, Menlo Park, CA; 81100147733, F. C. Pereira, SRI International, Menlo Park, CA; 81536964456, J. W. Sullivan, Lockheed Missiles and Space Co, Menlo Park, CA; "
"CHI","89","http://dx.doi.org/10.1145/67449.67495","A synthetic visual environment with hand gesturing and voice input","29 ","4","49","658","computer-aided design; human factors; interaction techniques; speech recognition and synthesis","6","81100631648, D. Weimer, AT&T Bell Labs., Holmdel, NJ; 81502764390, S. K. Ganapathy, AT&T Bell Labs., Holmdel, NJ; "
"CHI","89","http://dx.doi.org/10.1145/67449.67496","Speech and gestures for graphic image manipulation","41 ","6","49","914","human factors; interaction techniques","5","81100535010, A. G. Hauptmann, Carnegie Mellon Univ., Pittsburgh, PA; "
"CHI","89","http://dx.doi.org/10.1145/67449.67497","Design rationale: the argument behind the artifact","48 ","6","42","993","design; human factors; management","6","81100609167, A. MacLean; 81100514029, R. M. Young; 81407594532, T. P. Moran; "
"CHI","89","http://dx.doi.org/10.1145/67449.67498","Conversational resources for situated action","6 ","3","19","366","design; human factors","6","81100162362, D. M. Frohlich, Univ. of Surrey, Guildford, UK; 81100229533, P. Luff, Univ. of Surrey, Guildford, UK; "
"CHI","89","http://dx.doi.org/10.1145/67449.67499","Prototyping techniques for different problem contexts","7 ","2","35","854","design; human factors; management; systems development","6","81100022438, O. Gutierrez, Univ. of Massachusetts, Boston, MA; "
"CHI","89","http://dx.doi.org/10.1145/67449.67500","The role of laboratory  experiments in HCI: help, hindrance, or ho-hum?","3 ","2","31","462","design; human factors; theory","4","81332535977, C. G. Wolf, IBM Watson Research Center, Yorktown Heights, NY; 81350576124, J. M. Carroll, IBM Watson Research Center, Yorktown Heights, NY; 81100552367, T. K. Landauer, Bellcore, Morristown, NJ; 81100482886, B. E. John, Carnegie Mellon Univ., Pittsburgh, PA; 81100512851, J. Whiteside, Digital Equipment Corporation; "
"CHI","89","http://dx.doi.org/10.1145/67449.67501","Design environments for constructive and argumentative design","29 ","2","22","537","design; human factors; management; systems development","7","81409592298, G. Fischer, Univ. of Colorado, Boulder; 81100517817, R. McCall, Univ. of Colorado, Boulder; 81408593399, A. Morch, Univ. of Colorado, Boulder; "
"CHI","89","http://dx.doi.org/10.1145/67449.67502","Generating highly interactive user interfaces","15 ","0","7","297","design; human factors; languages; systems analysis and design","6","81100557538, C. Wiecha, IBM T.J. Watson Research Center, Yorktown Heights, NY; 81100291403, W. Bennett, IBM T.J. Watson Research Center, Yorktown Heights, NY; 81100117098, s. Boies, IBM T.J. Watson Research Center, Yorktown Heights, NY; 81406593839, J. Gould, IBM T.J. Watson Research Center, Yorktown Heights, NY; "
"CHI","89","http://dx.doi.org/10.1145/67449.67503","Directed dialogue protocols: verbal data for user interface design","4 ","2","13","253","design; human factors; systems analysis and design","5","81332509370, S. T. Knox, Tektronix Labs., Beaverton, OR; 81100645102, W. A. Bailey, Tektronix Labs., Beaverton, OR; 81100269840, E. F. Lynch, Tektronix Labs., Beaverton, OR; "
"CHI","89","http://dx.doi.org/10.1145/67449.67504","Conversational hypertext: information access through natural language dialogues with computers","2 ","0","7","191","human factors; languages; query languages; retrieval models","4","81100590721, T. Whalen; 81100139537, A. Patrick; "
"CHI","89","http://dx.doi.org/10.1145/67449.67505","Transforming text into hypertext for a compact disc encyclopedia","8 ","0","12","271","content analysis and indexing; information search and retrieval; miscellaneous","6","81351602519, Robert J. Glushko, Search Technology, Inc., Norcross, GA; "
"CHI","89","http://dx.doi.org/10.1145/67449.67506","The tourist artificial reality","1 ","0","9","272","design; human factors; systems analysis and design","6","81100503835, K. Fairchild, MCC/STP, Austin, TX; 81100129699, G. Meredith, MCC/STP, Austin, TX; 81100474095, A. Wexelblat, MCC/STP, Austin, TX; "
"CHI","89","http://dx.doi.org/10.1145/67449.67507","Human-computer interaction department, Hewlett-Packard Laboratories","0 ","0","11","183","human factors; management; user interfaces","2","81100039691, N. Kendzierski, Hewlett-Packard Labs., Palo Alto, CA; "
"CHI","89","http://dx.doi.org/10.1145/67449.67508","Cognitive user interface laboratory, GMD-IPSI","0 ","0","8","177","human factors; information theory","2","81100397563, H. U. Hoppe, IPSI, Darmstadt, W. Germany; 81332508947, R. T. King, IPSI, Darmstadt, W. Germany; 81100044611, A. Tissen, IPSI, Darmstadt, W. Germany; "
"CHI","89","http://dx.doi.org/10.1145/67449.67509","Human-computer interaction lab, University of Maryland","1 ","0","9","257","design; human factors","2","81100146468, B. Shneiderman, Univ. of Maryland, College Park; "
"CHI","89","http://dx.doi.org/10.1145/67449.67510","Search technology, Inc.","0 ","0","7","203","human factors","2","81339505649, R. M. Hunt, Search Technology, Inc., Norcross, GA; "
"CHI","89","http://dx.doi.org/10.1145/67449.67511","Planar maps: an interaction paradigm for graphic design","9 ","1","19","510","design; human factors; interaction techniques","6","81100375394, P. Baudelaire, Digital Equipment Corp., France; 81100393077, M. Gangnet, Digital Equipment Corp., France; "
"CHI","89","http://dx.doi.org/10.1145/67449.67512","Encapsulating interactive behaviors","19 ","1","15","268","design; human factors; user interfaces","6","81100013136, B. A. Myers, Carnegie Mellon Univ., Pittsburgh, PA; "
"CHI","89","http://dx.doi.org/10.1145/67449.67513","Constraint grammars&ndash;a new model for specifying graphical applications","14 ","n/a","n/a","n/a","device independence; human factors; languages","6","81547254256, B. T. Zanden, Carnegie Mellon Univ., Pittsburgh, PA; "
"CHI","89","http://dx.doi.org/10.1145/67449.67514","The effects of device technology on the usability of advanced telephone functions","10 ","1","21","408","design; human factors","7","81405592305, T. L. Roberts, U S West Advanced Technologies, Englewood, CO; 81100429025, G. Engelbeck, U S West Advanced Technologies, Englewood, CO; "
"CHI","89","http://dx.doi.org/10.1145/67449.67515","An experiment into the use of auditory cues to reduce visual workload","14 ","5","25","539","color, shading, shadowing, and texture; human factors; ibm pc","8","81543977056, M. L. Brown, Rensselaer Polytechnic Institute, Troy, NY; 81100632468, S. L. Newsome, Rensselaer Polytechnic Institute, Troy, NY; 81100124411, E. P. Glinert, Rensselaer Polytechnic Institute, Troy, NY; "
"CHI","89","http://dx.doi.org/10.1145/67449.67516","The design of phone-based interfaces for consumers","7 ","2","27","652","design; human factors","6","81100262199, R. Halstead-Nussloch; "
"CHI","89","http://dx.doi.org/10.1145/67449.67517","Tools for supporting cooperative work near and far: highlights from the CSCW conference","2 ","0","9","270","computer conferencing, teleconferencing, and videoconferencing; human factors","4","81100368806, S. F. Ehrlich, Rand Corporation; 81100229614, T. Bikson, MIT; 81100236706, W. Mackay, Xerox Parc; 81405592014, J. C. Tang; "
"CHI","89","http://dx.doi.org/10.1145/67449.67518","Helgon: extending the retrieval by reformulation paradigm","24 ","0","11","232","design; human factors; languages; query formulation","6","81409592298, G. Fischer, Univ. of Colorado, Boulder, CO; 81100380715, H. Nieper-Lemke, Univ. of Colorado, Boulder, CO; "
"CHI","89","http://dx.doi.org/10.1145/67449.67519","User-interface design for a clinical neurophysiological intensive monitoring system","0 ","0","11","264","design; human factors; interaction techniques","6","81332494049, T. F. Collura, Cleveland Clinic Foundation, Cleveland, OH; 81100068685, E. C. Jacobs, Cleveland Clinic Foundation, Cleveland, OH; 81100611399, R. C. Burgess, Cleveland Clinic Foundation, Cleveland, OH; 81100176022, G. H. Klem, Cleveland Clinic Foundation, Cleveland, OH; "
"CHI","89","http://dx.doi.org/10.1145/67449.67520","A document layout system using automatic document architecture extraction","1 ","1","12","438","documentation; human factors; word processing","6","81100176654, I. Iwai, Toshiba Corporation, Kawasaki, Japan; 81543879556, M. Doi, Toshiba Corporation, Kawasaki, Japan; 81543694356, K. Yamaguchi, Toshiba Corporation, Kawasaki, Japan; 81100388201, M. Fukui, Toshiba Corporation, Kawaski, Japan; 81100229077, Y. Takebayashi, Toshiba Corporation, Kawasaki, Japan; "
"CHI","89","http://dx.doi.org/10.1145/67449.67521","Models of user interactions with graphical interfaces: 1. statistical","0 ","3","14","333","design; human factors; interaction techniques","6","81100246269, D. J. Gillan, Lockheed Engineering and Sciences Co., Houston, TX; 81332511958, R. Lewis, Rice Univ., Houston, TX; 81339525705, M. Rudisill, NASA Johnson Space Center, Houston, TX; "
"CHI","89","http://dx.doi.org/10.1145/67449.67522","Understanding Bayesian reasoning via graphical displays","5 ","2","39","605","human factors; medical information systems; theory","6","81332494067, W. G. Cole, Univ. of California, San Francisco; "
"CHI","89","http://dx.doi.org/10.1145/67449.67523","Mathematical formula editor for CAI","0 ","0","32","673","computer-assisted instruction; human factors; mathematics and statistics; program editors","6","81100186889, Yasutomo Nakayama, IBM Japan, Ltd., Tokyo, Japan; "
