"conference","year","doi","title","citationCount","download6weeks","download12months","downloadAll","keywords","pageNumber","authors"
"CHI","87","http://dx.doi.org/10.1145/29933.275623","What kind of minimal instruction manual is the most effective","15 ","3","44","691","design; documentation; instruction; management; performance; training, help, and documentation","4","81100576470, John B. Black, Columbia Univ., New York, NY; 81350576124, John M. Carroll, IBM T.J. Watson Research Center, Yorktown Heights, NY; 81351605201, Stuart M. McGuigan, Yale Univ., New Haven, CT; "
"CHI","87","http://dx.doi.org/10.1145/29933.275624","Intelligent help in a one-shot dialog: a protocol study","15 ","0","14","251","advisory dialogs; design; intelligent help; performance; training, help, and documentation","6","81351595037, Amy Aaronson, IBM T.J. Watson Research Center, Yorktown Heights, NY; 81350576124, John M. Carroll, IBM T.J. Watson Research Center, Yorktown Heights, NY; "
"CHI","87","http://dx.doi.org/10.1145/29933.275625","Learning a word processing system with training wheels and guided exploration","24 ","3","23","493","design; error blocking; guided exploration; languages; measurement; performance; theory; training, help, and documentation; word processing","6","81100165314, Richard Catrambone, Univ. of Michigan, Ann Arbor; 81350576124, John M. Carroll, IBM Thomas J. Watson Research Center, Yorktown Heights, NY; "
"CHI","87","http://dx.doi.org/10.1145/29933.275626","Behavioral experiments on handmarkings","1 ","0","14","154","design; editing; gestures; human factors; management; performance; user interface techniques","7","81406593839, John D. Gould, IBM Thomas J. Watson Reseach Center, Yorktown Heights, NY; 81100096576, Josiane Salaun, IBM Thomas J. Watson Reseach Center, Yorktown Heights, NY; "
"CHI","87","http://dx.doi.org/10.1145/29933.275627","An evaluation of an eye tracker as a device for computer input2","75 ","30","168","1,462","design; eye movements; input devices; management; theory","6","81100446762, Colin Ware, Univ. of New Brunswick, Fredericton, N.B., Canada; 81100300029, Harutune H. Mikaelian, Univ. of New Brunswick, Fredericton, N.B., Canada; "
"CHI","87","http://dx.doi.org/10.1145/29933.275628","A hand gesture interface device","56 ","41","311","2,754","design; haptic i/o; human interface; management; motor interface; sensors; theory","4","81100030187, Thomas G. Zimmerman; 81100623833, Jaron Lanier; 81100068468, Chuck Blanchard; 81100575006, Steve Bryson; 81100242471, Young Harvill; "
"CHI","87","http://dx.doi.org/10.1145/29933.275629","Developing computer animation packages (panel)","1 ","0","10","292","animation; design; human factors; parallelism and concurrency; theory","4","81544405756, Jeffrey Graber, Massachusetts Institute of Technology; 81100200029, Kevin Lefebvre, New York Institute of Technology; 81100407398, Michael Sciulli; 81100030642, Donald Leich; 81546330556, Milan Novacek; 81100265794, David Ross; 81100216523, David Zeltzer; 81100463083, David Sturman; "
"CHI","87","http://dx.doi.org/10.1145/29933.275630","Learning about hidden events in system interactions","1 ","0","14","209","design; example-based learning; explanations; management; performance; training, help, and documentation","7","81100478252, Stephen Casner, Univ. of Colorado, Boulder; 81100349845, Clayton Lewis, Univ. of Colorado, Boulder; "
"CHI","87","http://dx.doi.org/10.1145/29933.275631","Transfer of learning: beyond common elements","0 ","5","21","252","cognitive skills; document preparation; human factors; management; production models; text editing; transfer","6","81100497898, Linda Tetzlaff, IBM T.J. Watson Research Center, Yorktown Heights, NY; "
"CHI","87","http://dx.doi.org/10.1145/29933.275632","Sophisticated image rendering in environmental design review","0 ","0","17","222","design; government; image displays; performance; three-dimensional graphics and realism","8","81100324182, John W. Danahy, Univ. of Toronto, Toronto, Ont., Canada; "
"CHI","87","http://dx.doi.org/10.1145/29933.275633","The user interface and program structure of a graphical VLSI layout editor","0 ","0","18","225","cad/cam; graphics processors; interaction techniques; management; symbolic layout; theory; vlsi","7","81100433648, Kevin S. B. Szab&#243;, Univ. of Waterloo, Waterloo, Ont., Canada; 81100442960, Mohamed I. Elmasry, Univ. of Waterloo, Waterloo, Ont., Canada; "
"CHI","87","http://dx.doi.org/10.1145/29933.275634","Computer-supported cooperative work (panel): is this REALLY a new field of research?","0 ","0","16","230","computer-supported collaborative work; design; management; theory","2","81100427186, Irene Greif, M. I. T. Laboratory for Computer Science; 81332495004, Bill Curtis, University of Maryland; 81100628996, Herb Krasner; 81100548740, Thomas W. Malone; 81100146468, Ben Shneiderman; "
"CHI","87","http://dx.doi.org/10.1145/29933.275635","Specifying complex dialogs in ALGAE","17 ","2","17","234","computer-user dialogs; event based languages; languages; performance; theory; user interfaces","6","81100448034, Mark A. Flecchia, Univ. of New Hampshire, Durham; 81100495153, R. Daniel Bergeron; "
"CHI","87","http://dx.doi.org/10.1145/29933.275636","Modular implementation of presentations","8 ","0","14","215","applications; graphical user interfaces; management; object-oriented programming; semantics of interaction; user interface management systems","6","81100625746, Pedro Szekely, Carnegie-Mellon Univ., Pittsburgh, PA; "
"CHI","87","http://dx.doi.org/10.1145/29933.275637","Event-response systems: a technique for specifying multi-threaded dialogues","16 ","1","18","351","concurrency; human factors; interaction techniques; languages; parallelism and concurrency; theory; user interfaces","8","81100454732, Ralph D. Hill, Univ. of Toronto, Toronto, Ont., Canada; "
"CHI","87","http://dx.doi.org/10.1145/29933.275638","Towards a model of user perception of computer systems response time","2 ","1","27","461","configuration design; empirical studies; human factors; management; models; performance measures; user perception","5","81452600675, Robert Geist, Clemson Univ., Clemson, SC; 81100652746, Robert Allen, Clemson Univ., Clemson, SC; 81100481687, Ronald Nowaczyk, Clemson Univ., Clemson, SC; "
"CHI","87","http://dx.doi.org/10.1145/29933.275639","A comparison of rule-based and positionally constant arrangements of computer menu items","17 ","0","19","428","computer menus; experimentation; human-computer interaction; management; performance; screen design; theory; visual search","6","81100286401, Benjamin L. Somberg, GTE Laboratories, Inc., Waltham, MA; "
"CHI","87","http://dx.doi.org/10.1145/29933.275640","Comparing a form-based and a language-based user interface for instructing a mail program","3 ","0","15","242","design; electronic mail; forms; interaction styles; management; performance","6","81332506629, Robin Jeffries, Hewlett-Packard Labs, Palo Alto, CA; 81546139956, Jarrett Rosenberg, Hewlett-Packard Labs, Palo Alto, CA; "
"CHI","87","http://dx.doi.org/10.1145/29933.275641","Intelligence in interfaces (panel)","0 ","0","11","192","applications and expert systems; design tools and techniques; management; theory; user/machine systems","3","81327490788, Robert Neches, Univ. of Southern California, Marina del Rey; 81100014251, John Seely Brown, Xerox Palo Alto Research Center, Palo Alto, CA; 81100309548, Norm Sondheimer, Univ. of Southern California, Marina del Rey; 81100548740, Tom Malone, Massachusetts Institute of Technology, Cambridge; 81100006454, Mike Williams; "
"CHI","87","http://dx.doi.org/10.1145/29933.275642","Creating dynamic interaction techniques by demonstration","24 ","2","19","299","automatic programming; direct manipulation; input devices and strategies; management; program synthesis; theory; user interface management systems; visual programming","8","81100013136, Brad A. Myers, Univ. of Toronto, Toronto, Ont., Canada; "
"CHI","87","http://dx.doi.org/10.1145/29933.275643","Panther: a specification system for graphical controls","3 ","0","14","186","control theory; experimentation; graphical interface specification; human factors; interaction techniques; performance; theory","6","81100125410, J. I. Helfman, AT&amp;T Bell Labs, Murray Hill, NJ; "
"CHI","87","http://dx.doi.org/10.1145/29933.275644","A control panel interface for graphics and image processing applications","4 ","1","16","264","applications environment; design; graphics applications; image processing applications; management; theory","6","81100550078, Gene L. Fisher, Univ. of California, Davis; 81100148606, Kenneth I. Joy, Univ. of California, Davis; "
"CHI","87","http://dx.doi.org/10.1145/29933.275645","The use of scenarios in human-computer interaction research: turbocharging the tortoise of cumulative science","18 ","8","75","858","design; management; performance; scenarios; theory; user/machine systems","6","81100514029, Richard M. Young, MRC, Cambridge, UK; 81100469779, Phil Barnard, MRC, Cambridge, UK; "
"CHI","87","http://dx.doi.org/10.1145/29933.275646","Structural analysis of verbal data","3 ","0","15","275","cognitive engineering; evaluation/methodology; management; performance; protocol analysis; user/machine systems","5","81100645102, Wayne A. Bailey, Tektronix, Inc., Beaverton, OR; 81323491911, Edwin J. Kay, Lehigh Univ., Bethlehem, PA; "
"CHI","87","http://dx.doi.org/10.1145/29933.275647","Evaluating user and system models: applying scaling techniques to problems in human-computer interaction","4 ","0","19","485","assessment of system usability; design; measurement; performance; reliability; user conceptual models","6","81100457150, Wendy A. Kellogg, IBM Thomas J. Watson Research Center, Yorktown Heights, NY; 81100023130, Timothy J. Breen, New Mexico State Univ., Las Cruces; "

"CHI","87","http://dx.doi.org/10.1145/29933.275649","Whiter (or wither) UIMS?","2 ","0","11","192","design; human factors; measurement; theory","4","81410595121, Dan R. Olsen, Jr., Computer Science Department, Brigham Young University; 81339501983, Mark Green, Department of Computing Science, University of Alberta; 81100425740, Keith A. Lantz, Department of Computer Science, Stanford University; 81100273481, Andrew Schulert, Department of Electrical Engineering and Computer Science, The George Washington University; 81100481379, John L. Sibert; "
"CHI","87","http://dx.doi.org/10.1145/29933.275650","Evolution of an organizational interface: the new business department at a large insurance firm","2 ","0","11","258","business; design; management; office automation; organizational interface; performance","8","81100406488, Andrew Clement, York Univ., North York, Ont., Canada; 81452617735, C. C. Gotlieb, Univ. of Toronto, Toronto, Ont., Canada; "
"CHI","87","http://dx.doi.org/10.1145/29933.275651","Social and psychological factors influencing the design of office communications systems","19 ","3","30","672","communication; design; human factors; office automation; performance; sociology; voice mail","7","81100368806, Susan F. Ehrlich; "
"CHI","87","http://dx.doi.org/10.1145/29933.275652","The politics of human factors (panels)","0 ","0","12","167","design; management; theory","2","81100279219, William Mosteller, IBM Corporation, Armonk, New York; 81100117098, Stephen J. Boies, Pacific Bell, San Ramon, California; 81100174948, Charles E. Grantham, Honeywell Corporation, Waltham, Massachusetts; 81100360079, Thomas Drby, Digital Equipment Corporation, Nasuha, New Hampshire; 81100218293, Richard Rubinstein; 81100285993, Dennis Wixon; "
"CHI","87","http://dx.doi.org/10.1145/29933.275653","Psychology as a mother of invention","4 ","2","17","371","design; management; psychology; user/machine systems","3","81100552367, Thomas K. Landauer, Bell Communications Research, Morristown, NJ; "
"CHI","87","http://dx.doi.org/10.1145/29933.275654","The social dimensions of computerization","2 ","3","27","595","design; management; performance; theory","3","81332509256, Rob Kling, Univ. of California, Irvine; "
"CHI","87","http://dx.doi.org/10.1145/29933.275837","Summary of the CHI'87 doctoral consortium","0 ","0","11","165","design; management; theory; user/machine systems","2","81392616258, Tom Carey, Univ. of Guelph, Guelph, Ont., Canada; "
"CHI","87","http://dx.doi.org/10.1145/29933.30852","Designing optimum CRT text blinking video image presentation","0 ","0","7","160","design; human factors; performance; user interfaces","6","81543971356, Seiji Kitakaze, C&C Information Technology Research Laboratories, NEC Corporation, 4-1-1 Miyazaki, Miyamae-ku, Kawasaki, KANAGAWA, 213, JAPAN; 81100348847, Yutaka Kasahara, C&C Information Technology Research Laboratories, NEC Corporation, 4-1-1 Miyazaki, Miyamae-ku, Kawasaki, KANAGAWA, 213, JAPAN; "
"CHI","87","http://dx.doi.org/10.1145/29933.30853","Why reading was slower from CRT displays than from paper","12 ","6","28","1,099","design; human factors; performance","5","81406593839, John D. Gould, IBM Thomas J. Watson Research Center, Hawthorne, P. O. Box 704, Yorktown Heights, New York; 81100255430, Lizette Alfaro, IBM Thomas J. Watson Research Center, Hawthorne, P. O. Box 704, Yorktown Heights, New York; 81100359304, Rich Finn, IBM Thomas J. Watson Research Center, Hawthorne, P. O. Box 704, Yorktown Heights, New York; 81100288839, Brian Haupt, IBM Thomas J. Watson Research Center, Hawthorne, P. O. Box 704, Yorktown Heights, New York; 81100404914, Angela Minuto, IBM Thomas J. Watson Research Center, Hawthorne, P. O. Box 704, Yorktown Heights, New York; "
"CHI","87","http://dx.doi.org/10.1145/29933.30854","On the parameters of human visual performance: an investigation of the benefits of antialiasing","3 ","0","11","317","design; human factors; performance; theory","7","81100170154, Kellogg S. Booth, Computer Graphics Laboratory, University of Waterloo, Waterloo, Ontario, Canada N2L 3G1; 81100532837, M. Philip Bryden, Computer Graphics Laboratory, University of Waterloo, Waterloo, Ontario, Canada N2L 3G1; 81410592379, Wiliam B. Cowan, Computer Graphics Laboratory, University of Waterloo, Waterloo, Ontario, Canada N2L 3G1; 81405591710, Michael F. Morgan, Computer Graphics Laboratory, University of Waterloo, Waterloo, Ontario, Canada N2L 3G1; 81100576602, Brian L. Plante, Computer Graphics Laboratory, University of Waterloo, Waterloo, Ontario, Canada N2L 3G1; "
"CHI","87","http://dx.doi.org/10.1145/29933.30855","Approximate modelling of cognitive activity: towards an expert system design aid","3 ","1","11","333","cognitive simulation; human factors; performance; user interfaces","6","81100469779, Phil Barnard, MRC Applied Psychology Unit, 15 Chaucer Road, Cambridge, England CB2 2EF; 81100531210, Michael Wilson, MRC Applied Psychology Unit, 15 Chaucer Road, Cambridge, England CB2 2EF; 81100609167, Allan MacLean, MRC Applied Psychology Unit, 15 Chaucer Road, Cambridge, England CB2 2EF; "
"CHI","87","http://dx.doi.org/10.1145/29933.30856","Transfer between text editors","4 ","1","10","222","applications; document preparation; human factors; model validation and analysis; simulation output analysis","6","81100564360, Peter G. Polson, University of Colorado, Boulder, CO; 81100518726, Susan Bovair, University of Michigan, Ann Arbor, MI; 81100254452, David Kieras, University of Michigan, Ann Arbor, MI; "
"CHI","87","http://dx.doi.org/10.1145/29933.30857","Predicting the time to recall computer command abbreviations","6 ","1","11","242","design; interaction styles; performance","8","81100482886, Bonnie E. John, Department of Psychology, Carnegie-Mellon University, Pittsburgh, PA; 81100393604, Allen Newell, Department of Computer Science, Carnegie-Mellon University, Pittsburgh, PA; "
"CHI","87","http://dx.doi.org/10.1145/29933.30858","Voice: technology searching for communication needs","3 ","0","14","613","design; human factors; performance; theory","4","81100387350, Arlene Aucella, Hewlett-Packard, 3500 Deer Creek Rd., Pain Alto, CA; 81100209547, Robin Kinkead, MIT Media Laboratory, 20 Ames St., Cambridge, MA; 81100478606, Anna Wichansky; 81100055057, Chris Shmandt; "
"CHI","87","http://dx.doi.org/10.1145/29933.30859","Notecards in a nutshell","130 ","5","46","824","design; management; standardization; user interfaces","8","81100332524, Frank G. Halasz, Intelligent Systems Laboratory, Xerox Palo Alto Research Center, 3333 Coyote Hill Rd., Palo Alto, CA; 81407594532, Thomas P. Moran, Intelligent Systems Laboratory, Xerox Palo Alto Research Center, 3333 Coyote Hill Rd., Palo Alto, CA; 81100607598, Randall H. Trigg, Intelligent Systems Laboratory, Xerox Palo Alto Research Center, 3333 Coyote Hill Rd., Palo Alto, CA; "
"CHI","87","http://dx.doi.org/10.1145/29933.30860","A multiple, virtual-workspace interface to support user task switching","39 ","4","42","818","artificial, augmented, and virtual realities; human factors; performance; user-centered design","7","81406592524, Stuart K. Card, Intelligent Systems Laboratory, Xerox Palo Alto Research Center, Palo Alto, California; 81100433710, Austin Henderson, Jr., Intelligent Systems Laboratory, Xerox Palo Alto Research Center, Palo Alto, California; "
"CHI","87","http://dx.doi.org/10.1145/29933.30861","Experiences with the alternate reality kit: an example of the tension between literalism and magic","43 ","2","38","332","animations; environments; management; theory","7","81406594842, Randall B. Smith, Xerox Palo Alto Research Center, 3333 Coyote Hill Rd., Palo Alto, CA; "
"CHI","87","http://dx.doi.org/10.1145/29933.30862","A case example of human factors in product definition: needs finding for a voice output workstation for the blind","2 ","1","32","408","assistive technologies for persons with disabilities; health; human factors; performance; theory","5","81100101387, Richard M. Kane; 81100553987, Matthew Yuschik; "
"CHI","87","http://dx.doi.org/10.1145/29933.30863","Towards universality of access: interfacing physically disabled students to the Icon educational microcomputer","0 ","3","14","363","assistive technologies for persons with disabilities; health; human factors; measurement; user interfaces","12","81100362512, Gerbrand Verburg; 81100419511, Debbie Field; 81100659490, Francois St. Pierre; 81100447554, Stephen Naumann; "
"CHI","87","http://dx.doi.org/10.1145/29933.30864","A user interface for deaf-blind people (preliminary report)","2 ","4","36","643","assistive technologies for persons with disabilities; health; human factors; performance; user interfaces","6","81100297556, Richard Ladner, Department of Computer Science, University of Washington, Seattle, Washington; 81100616540, randy Day, Department of Computer Science, University of Washington, Seattle, Washington; 81100242316, Dennis Gentry, Department of Computer Science, University of Washington, Seattle, Washington; 81100568989, Karin Meyer, Department of Computer Science, University of Washington, Seattle, Washington; 81310489500, Scott Rose, Department of Computer Science, University of Washington, Seattle, Washington; "
"CHI","87","http://dx.doi.org/10.1145/29933.30865","Interface design: a neglected issue in educational software","1 ","2","16","727","design; management; theory; user-centered design","5","81100464092, Douglas Frye, Department of Computer Science, Yale University, P.O. Box 2158, New Haven, Connecticut; 81332528788, Elliot Soloway, Department of Computer Science, Yale University, P.O. Box 2158, New Haven, Connecticut; "
"CHI","87","http://dx.doi.org/10.1145/29933.30866","Cognition-sensitive design and user modeling for syntax-directed editors","12 ","0","15","292","cognitive simulation; documentation; management; performance; user/machine systems","4","81442620233, Lisa Rubin Neal, Aiken Computation Laboratory, Harvard University, Cambridge, MA; "
"CHI","87","http://dx.doi.org/10.1145/29933.30867","A self-regulating adaptive system","4 ","2","12","314","design; human factors; management; performance; user interfaces","5","81100518455, Robert Trevellyan; 81100010235, Dermot P. Browne; "
"CHI","87","http://dx.doi.org/10.1145/29933.30868","The definition, editing, and contouring of surfaces for the analysis of field problems","1 ","0","6","212","algorithms; design; management; spline and piecewise polynomial approximation","6","81100607545, Robert R. Dickinson, University of Waterloo, Department of Systems Design, Waterloo Ont., N2L 3G1; 81100508844, Richard H. Bartels, University of Waterloo, Computer Graphics Laboratory, Department of Computer Science, Waterloo Ont. N2L 3G1; "
"CHI","87","http://dx.doi.org/10.1145/29933.30869","From contours to surfaces: testbed and initial results","3 ","0","12","354","algorithms; design; human factors; performance; three-dimensional graphics and realism","6","81100524612, Kenneth R. Sloan, Jr., Department of Computer Science, FR-35, University of Washington, Seattle WA; 81100400443, James Painter, Department of Computer Science, FR-35, University of Washington, Seattle WA; "
"CHI","87","http://dx.doi.org/10.1145/29933.30870","Social science and system design: interdisciplinary collaborations","0 ","1","23","435","design; management; systems analysis and design","3","81100633564, Lucy Suchman; 81100118673, William Beeman; 81332520488, Michael Pear; 81339499887, Barbara Fox; 81100169537, Paul Smolensky; "
"CHI","87","http://dx.doi.org/10.1145/29933.30871","Positioning human factors in the user interface development chain","4 ","1","37","773","design; life cycle; performance; user interfaces","7","81100031531, Jonathan Grudin, MCC, P.O. Box 200195, Austin, TX; 81100368806, Susan F. Ehrlich; 81100282844, Rick Shriner; "
"CHI","87","http://dx.doi.org/10.1145/29933.30872","The interface is often not the problem","8 ","0","13","258","design; human factors; performance; user interfaces","4","81100057078, Bengt Goransson, Uppsala University Data Center, Box 2103, S-750 02 Uppsala, Sweden; 81100540194, Mats Lind, Uppsala University Data Center, Box 2103, S-750 02 Uppsala, Sweden; 81100535261, Else Pettersson, Uppsala University Data Center, Box 2103, S-750 02 Uppsala, Sweden; 81100282336, Bengt Sandblad, Uppsala University Data Center, Box 2103, S-750 02 Uppsala, Sweden; 81100631568, Patrik Schwalbe, Uppsala University Data Center, Box 2103, S-750 02 Uppsala, Sweden; "
"CHI","87","http://dx.doi.org/10.1145/29933.30873","Designing for designers: an analysis of design practice in the real world","11 ","1","26","512","design; interactive systems; performance; theory","6","81335496622, Mary Beth Rosson, IBM Thomas J. Watson Research Center, P.O. Box 704, Yorktown Heights, New York; 81100339171, Susanne Maass, IBM Thomas J. Watson Research Center, P.O. Box 704, Yorktown Heights, New York; 81100457150, Wendy A. Kellogg, IBM Thomas J. Watson Research Center, P.O. Box 704, Yorktown Heights, New York; "
"CHI","87","http://dx.doi.org/10.1145/29933.30874","Automated lip-synch and speech synthesis for character animation","8 ","4","59","715","algorithms; animations; human factors; languages; natural language; theory","5","81409595942, J. P. Lewis, Computer Graphics Laboratory, New York Institute of Technology; 81100304539, F. I. Parke, Computer Graphics Laboratory, New York Institute of Technology; "
"CHI","87","http://dx.doi.org/10.1145/29933.30875","Story driven animation","4 ","3","22","325","animation; design; languages; natural language; theory","5","81100486853, Yosuke Takashima, C&C Information Technology Research Laboratories, NEC Corporation, 4-1-1 Miyazaki Miyamae-ku Kawasaki, Kanagawa 213 Japan; 81100379256, Hideo Shimazu, C&C Information Technology Research Laboratories, NEC Corporation, 4-1-1 Miyazaki Miyamae-ku Kawasaki, Kanagawa 213 Japan; 81544761656, Masahiro Tomono, C&C Information Technology Research Laboratories, NEC Corporation, 4-1-1 Miyazaki Miyamae-ku Kawasaki, Kanagawa 213 Japan; "
"CHI","87","http://dx.doi.org/10.1145/29933.30876","Issues limiting the acceptance of user interfaces using gesture input and handwriting character recognition (panel)","0 ","0","19","486","computer vision; documentation; human factors; optical character recognition; theory","4","81100481379, John Sibert, George Washington University; 81545882456, Michael G. Buffa, Nestor Inc.; 81100393826, Hewitt D. Crane, SRI International & CIC; 81100427254, Wolfgang Doster, AEG Research Institute; 81100216477, James Rhyne, IBM/Thomas J. Watson Research Center; 81100633213, Jean Renaerd Ward; "
