"conference","year","doi","title","citationCount","download6weeks","download12months","downloadAll","keywords","pageNumber","authors"
"CHI","91","http://dx.doi.org/10.1145/108844.108966","Demonstrational interfaces: Coming soon?","7 ","0","17","277","design; input devices and strategies","4","81100013136, Brad A. Myers, School of Computer Science, Carnegie Mellon University, Pittsburgh, PA; 81100562008, Allen Cypher, Apple Computer, Inc.; 81100340093, David Maulsby, University of Calgary; 81100080090, David C. Smith, Apple Computer, Inc.; 81100146468, Ben Shneiderman, University of Maryland; "
"CHI","91","http://dx.doi.org/10.1145/108844.108969","Legal debate on the copyright look and feel lawsuits: the sequel","0 ","n/a","n/a","n/a","copyrights; human factors; user interfaces","2","81100661766, Pamela Samuelson; 81100393677, Anthony L. Clapes; 81309491787, Michael Jacobs; 81100556662, Michael Lesk; 81100610874, Bruce Warren; "
"CHI","91","http://dx.doi.org/10.1145/108844.108974","HCI theory on trial","2 ","1","23","594","design; human factors; theory and methods","3","81100269401, Alistair Sutcliffe, Department of Business Computing, City University, Northampton Square, London EC1V 0HB, U.K.; 81350576124, John Carroll, IBM T.J. Watson Research Centre, NY; 81100514029, Richard Young, MRC Applied Psychology Unit, Cambridge; 81100466738, John Long, Ergonomics Unit, University College, London; "
"CHI","91","http://dx.doi.org/10.1145/108844.108976","Ethical issues in the use of video: is it time to establish guidelines?","4 ","0","13","330","ethics; human factors; management; social issues","3","81100236706, Wendy E. Mackay, Massachusetts Institute of Technology, E40-366, 1 Amherst Street, Cambridge, MA; "
"CHI","91","http://dx.doi.org/10.1145/108844.108978","FRIEND21 project: a construction of 21st century human interface","8 ","0","13","265","design; human factors; theory and methods","8","81100244783, Hajime Nonogaki; 82858813457, Hirotada Ueda; "
"CHI","91","http://dx.doi.org/10.1145/108844.108980","The views user-interface system","0 ","0","13","150","document preparation; interaction styles","2","81100559620, Lon Barfield, CWI, Kruislaan 413, 1098 SJ Amsterdam, The Netherlands; 81100442683, Eddy Boeve, CWI, Kruislaan 413, 1098 SJ Amsterdam, The Netherlands; 81100382418, Steven Pemberton, CWI, Kruislaan 413, 1098 SJ Amsterdam, The Netherlands; "
"CHI","91","http://dx.doi.org/10.1145/108844.108981","User-oriented color interface design: direct manipulation of color in context","2 ","5","35","760","design; interaction styles; theory","2","81100208023, Penny F. Bauersfeld, ATG Human Interface Group, Apple Computer Inc., Cupertino, CA; 81332528657, Jodi L. Slater; "
"CHI","91","http://dx.doi.org/10.1145/108844.108982","RPP: a system for prototyping user interfaces","0 ","0","12","158","design; windowing systems","2","81342491355, Jen-Hsien Chien, Computer Science Department, University of Southern California, Los Angeles, CA; 81545728756, Sheng-Tsai Fu, Computer Science Department, University of Southern California, Los Angeles, CA; 81332524388, Christopher Rougff, TRW, Systems Engineering and Development Division, Carson, CA; 81341491369, Ellis Horowitz, Computer Science Department, University of Southern California, Los Angeles, CA; "
"CHI","91","http://dx.doi.org/10.1145/108844.108983","ERGO-Shell: a UNIX-interface for task preparation","0 ","0","12","145","design; user interfaces","2","81100261906, Wolfgang Dzida; 81100258983, Regine Freitag; 81100626085, Wilhelm Valder; "
"CHI","91","http://dx.doi.org/10.1145/108844.108984","John Cocke: a retrospective by friends (an interactive multimedia scrapbook)","1 ","1","15","180","design; human factors; trees","2","81100504042, Nancy Frishberg, T. J. Watson Research Center, P.O. Box 704, Yorktown Heights, New York; 81100347998, Mark R. Laff, T. J. Watson Research Center, P.O. Box 704, Yorktown Heights, New York; 81100508358, Moe R. Desrosiers, T. J. Watson Research Center, P.O. Box 704, Yorktown Heights, New York; 81100026648, W. Randall Koons, T. J. Watson Research Center, P.O. Box 704, Yorktown Heights, New York; 81332508265, J. F. Kelley, T. J. Watson Research Center, P.O. Box 704, Yorktown Heights, New York; "
"CHI","91","http://dx.doi.org/10.1145/108844.108985","Object lens: letting end-users create cooperative work applications","2 ","0","10","164","decision support; group and organization interfaces; hypertext navigation and maps","2","81452599095, Kum-Yeq Lai, Center for Coordination Science, Massachusetts Institute of Technology, Cambridge, MA; 81100548740, Thomas W. Malone, Center for Coordination Science, Massachusetts Institute of Technology, Cambridge, MA; "
"CHI","91","http://dx.doi.org/10.1145/108844.108986","An automated cognitive walkthrough","11 ","2","38","537","design; human factors","2","81100642568, John Rieman, Institute of Cognitive Science, University of Colorado, Campus Box 430, Boulder, Colorado; 81452615178, Susan Davies, Institute of Cognitive Science, University of Colorado, Campus Box 430, Boulder, Colorado; 81100288195, D. Charles Hair, Institute of Cognitive Science, University of Colorado, Campus Box 430, Boulder, Colorado; 81100604674, Mary Esemplare, Institute of Cognitive Science, University of Colorado, Campus Box 430, Boulder, Colorado; 81100564360, Peter Polson, Institute of Cognitive Science, University of Colorado, Campus Box 430, Boulder, Colorado; 81100349845, Clayton Lewis, Center for Advanced Decision Support for Water and Environmental Systems, University of Colorado, Campus Box 430, Boulder, Colorado; "
"CHI","91","http://dx.doi.org/10.1145/108844.108987","Computers as communicators: designing a multimedia interface that facilitates cultural understanding among sixth graders","0 ","0","10","188","design; human factors; training, help, and documentation","2","81332524082, Amanda Ropa, Interdisciplinary Computer Science, Mills College, Oakland, California; "
"CHI","91","http://dx.doi.org/10.1145/108844.108988","Demonstrating a view matcher for reusing Smalltalk classes","2 ","0","13","119","human factors; reusable software; user interfaces","2","81335496622, Mary Beth Rosson, IBM T.J. Watson Research Center, P.O. Box 704, Yorktown Heights, NY; 81350576124, John M. Carroll, IBM T.J. Watson Research Center, P.O. Box 704, Yorktown Heights, NY; 81100201931, Christine Sweeney, Department of Computer Science, University of Washington, Seattle, WA; "
"CHI","91","http://dx.doi.org/10.1145/108844.108989","A graphical reflection notation used in an intelligent discovery world tutoring system","0 ","0","10","155","human factors; user/machine systems","2","81332525909, Jamie Schultz, Learning Research and Development Center, University of Pittsburgh, Pittsburgh, PA; "
"CHI","91","http://dx.doi.org/10.1145/108844.108990","Hypermedia and echocardiography: an interface design for guided discovery","0 ","0","11","111","design; medical information systems; training, help, and documentation","2","81100198308, Marc M. Sebrechts, Department of Psychology, The Catholic Univ. of America, Washington, DC; 81540867456, C. Carl Jaffe, Diagnostic Radiology, Yale Univ. School of Medicine, New Haven, CT; 81407593785, Patrick Lynch, Biomedical Communications, Yale Univ. School of Medicine, New Haven, CT; "
"CHI","91","http://dx.doi.org/10.1145/108844.108991","Supporting personal networking through computer networking","2 ","0","8","152","bulletin boards; electronic mail; hypercard","2","81100398303, Mildred L. G. Shaw, Knowledge Science Institute, University of Calgary, Calgary, Alberta, Canada T2N 1N4; 81100428034, Brian R. Gaines, Knowledge Science Institute, University of Calgary, Calgary, Alberta, Canada T2N 1N4; "
"CHI","91","http://dx.doi.org/10.1145/108844.108992","MOLEHILL: an instructional system for Smalltalk programming","0 ","0","10","112","computer-assisted instruction; languages; user interfaces","2","81100654751, Mark K. Singley, User Interface Institute, IBM T.J. Watson Research Center, Yorktown Heights, NY; "
"CHI","91","http://dx.doi.org/10.1145/108844.108993","We-met (window environment-meeting enhancement tools)","3 ","0","15","172","computer conferencing, teleconferencing, and videoconferencing; input devices and strategies; windowing systems","2","81332535977, Catherine G. Wolf, IBM T. J. Watson Research Center, P. O. Box 704, Yorktown Heights, NY; 81100216477, James R. Rhyne, IBM T. J. Watson Research Center, P. O. Box 704, Yorktown Heights, NY; 81328491124, Lorna A. Zorman, Computer Science Dept., University of Southern California, Los Angeles, CA; 81540145356, Harold L. Ossher, IBM T. J. Watson Research Center, P. O. Box 704, Yorktown Heights, NY; "
"CHI","91","http://dx.doi.org/10.1145/108844.108994","Documents as user interfaces","1 ","1","22","238","document and text editing; human factors","2","81100084142, Eric A. Bier, Xerox Palo Alto Research Center, 3333 Coyote Hill Rd., Palo Alto, CA; 81342507475, Ken Pier, Xerox Palo Alto Research Center, 3333 Coyote Hill Rd., Palo Alto, CA; "
"CHI","91","http://dx.doi.org/10.1145/108844.108995","Video presentation Eager: programming repetitive tasks by example","0 ","0","11","179","design; hypercard; video","2","81100562008, Allen Cypher, Advanced Technology Group, Apple Computer, Inc., Cupertino, CA; "
"CHI","91","http://dx.doi.org/10.1145/108844.108996","Guides 3.0","9 ","0","14","241","human factors; training, help, and documentation","2","81392603419, Abbe Don, Apple Computer, Inc., 20525 Mariani Blvd., MS 76-2C, Cupertino, CA; 81100601226, Tim Oren; 81100603693, Brenda Laurel; "
"CHI","91","http://dx.doi.org/10.1145/108844.108997","COMET: generating coordinated multimedia explanations","2 ","0","12","194","design; industrial automation; multimedia information systems","2","81100427474, Steven K. Feiner, Department of Computer Science, Columbia University, New York, New York; 81100057436, Kathleen R. McKeown, Department of Computer Science, Columbia University, New York, New York; "
"CHI","91","http://dx.doi.org/10.1145/108844.108998","Editable graphical histories: the video","0 ","0","14","206","design; interaction styles","2","81100041571, David Kurlander, Department of Computer Science, Columbia University, New York, NY; 81100427474, Steven Feiner, Department of Computer Science, Columbia University, New York, NY; "
"CHI","91","http://dx.doi.org/10.1145/108844.108999","Spoken language interfaces: the OM system","2 ","0","9","149","human factors; natural language interfaces; user interfaces","2","81100533521, Jean-Michel Lunati, School of Computer Science, Carnegie Mellon University, Pittsburgh, Pennsylvania; 81100553496, Alexander I. Rudnicky, School of Computer Science, Carnegie Mellon University, Pittsburgh, Pennsylvania; "
"CHI","91","http://dx.doi.org/10.1145/108844.109000","Rapid controlled movement through virtual 3D workspaces (videotape)","0 ","0","15","195","animations; human factors","2","81452617082, Jock D. Mackinlay, Xerox Palo Alto Research Center, 3333 Coyote Hill Road, Palo Alto, CA; 81452612822, George G. Robertson, Xerox Palo Alto Research Center, 3333 Coyote Hill Road, Palo Alto, CA; 81406592524, Stuart K. Card, Xerox Palo Alto Research Center, 3333 Coyote Hill Road, Palo Alto, CA; "
"CHI","91","http://dx.doi.org/10.1145/108844.109001","JANUS: basic concepts and sample dialog","0 ","0","13","197","computer-aided design; human factors","2","81408593399, Anders Morch, Department of Computer Science and Institute of Cognitive Science, University of Colorado, Boulder, Colorado; 81100542604, Andreas Girgensohn; "
"CHI","91","http://dx.doi.org/10.1145/108844.109002","Scheduling on-off home control devices","2 ","0","15","337","consumer products; human factors; interaction styles","2","81100041782, Catherine Plaisant, Human-Computer Interaction Laboratory, Center for Automation Research, University of Maryland, College Park, MD; 81100146468, Ben Shneiderman, Human-Computer Interaction Laboratory, Center for Automation Research, University of Maryland, College Park, MD; "
"CHI","91","http://dx.doi.org/10.1145/108844.109003","Information visualization using 3D interactive animation","6 ","3","32","590","animations; human factors; trees","2","81452612822, George G. Robertson, Xerox Palo Alto Research Center, 3333 Coyote Hill Road, Palo Alto, CA; 81452617082, Jock D. Mackinlay, Xerox Palo Alto Research Center, 3333 Coyote Hill Road, Palo Alto, CA; 81406592524, Stuart K. Card, Xerox Palo Alto Research Center, 3333 Coyote Hill Road, Palo Alto, CA; "
"CHI","91","http://dx.doi.org/10.1145/108844.109004","The cue ball as part of a gestural interface","0 ","0","11","135","games; input devices and strategies","2","81408594940, David D. Thiel; "
"CHI","91","http://dx.doi.org/10.1145/108844.109005","The Lapidary graphical interface design tool","2 ","0","16","157","design; interaction styles","2","81452613430, Brad Vander Zanden, Computer Science Department, University of Tennessee, Knoxville, TN; 81100013136, Brad A. Myers, School of Computer Science, Carnegie Mellon University, Pittsburgh, PA; "
"CHI","91","http://dx.doi.org/10.1145/108844.109006","The University of Toronto dynamic graphics project","0 ","0","19","359","human factors; user/machine systems","2","81100448368, Ronald Baecker, Dynamic Graphics Project, Computer Systems Research Institute and Department of Computer Science, University of Toronto; 81100372271, Marilyn Mantei, Dynamic Graphics Project, Computer Systems Research Institute and Department of Computer Science, University of Toronto; 81452616426, William Buxton, Dynamic Graphics Project, Computer Systems Research Institute and Department of Computer Science, University of Toronto; 81100188679, Eugene Fiume, Dynamic Graphics Project, Computer Systems Research Institute and Department of Computer Science, University of Toronto; "
"CHI","91","http://dx.doi.org/10.1145/108844.109007","Computer dialogue laboratory SRI International","0 ","0","9","109","human factors; languages","2","81100149852, Philip R. Cohen, Artificial Intelligence Center, SRI International, Menlo Park, California; "
"CHI","91","http://dx.doi.org/10.1145/108844.109008","Human interface at SUN (East)","0 ","0","8","114","design; sun","2","81331492075, Kate Ehrlich, Sun Microsystems, 2 Federal St., Billerica MA; "
"CHI","91","http://dx.doi.org/10.1145/108844.109009","Apple computer's human interface group: advanced technology group","0 ","0","14","352","design; human factors","2","81332501266, Kathleen M. Gomoll, Apple Computer, Inc., 20525 Mariani Avenue, MS: 76-3H, Cupertino, CA; "
"CHI","91","http://dx.doi.org/10.1145/108844.109010","Human computer interaction laboratory Queen Mary and Westfield College University of London","0 ","0","12","166","design; human factors","2","81332506976, Peter Johnson, Department of Computer Science, Queen Mary and Westfield College, University of London, Mile End Road, London E1 4NS, England; "
"CHI","91","http://dx.doi.org/10.1145/108844.109011","The system work group computer science department Aarhus University","1 ","0","6","141","design; human factors","2","81100435567, Morten Kyng, Computer Science Department, Aarhus University, Ny Munkegade, Building 540, DK-8000 Aarhus C, Denmark; "
"CHI","91","http://dx.doi.org/10.1145/108844.109012","Research in HCI and usability at IBM's User Interface Institute","0 ","1","15","255","design; human factors; input devices and strategies","2","81100451878, John T. Richards, IBM T.J. Watson Research Center, P.O.Box 704, Yorktown Heights, NY; "
"CHI","91","http://dx.doi.org/10.1145/108844.109013","Human computer interaction division Logica Cambridge LTD., UK","0 ","0","16","184","human factors; user/machine systems","2","81100601550, Rod Rivers, Logica Cambridge Ltd., 104 Hills Road, Cambridge, CB2 1LQ, UK; "
"CHI","91","http://dx.doi.org/10.1145/108844.109014","HCI research at the Institute of Systems Science","0 ","0","12","144","human factors; multimedia information systems; user/machine systems","2","81100397259, John A. Waterworth, Institute of Systems Science, National University of Singapore, Kent Ridge, Singapore 0511; 81339518488, Juzaar Motiwalla, Institute of Systems Science, National University of Singapore, Kent Ridge, Singapore 0511; "
